ID,Tên công việc,Tên công ty,Nơi làm việc,Mức lương,Ngày đăng tin,Ngày hết hạn,Link
35C59E03,Giám Sát Kiểm Soát Nội Bộ Và Quản Trị Rủi Ro,Công Ty CP Việt Tinh Anh,Hồ Chí Minh,Lương: Cạnh tranh,09-10-2025,02-11-2025,https://careerviet.vn/vi/tim-viec-lam/giam-sat-kiem-soat-noi-bo-va-quan-tri-rui-ro.35C59E03.html
35C59E03,Giám Sát Kiểm Soát Nội Bộ Và Quản Trị Rủi Ro,Công Ty CP Việt Tinh Anh,Hồ Chí Minh,Lương: Cạnh tranh,09-10-2025,02-11-2025,https://careerviet.vn/vi/tim-viec-lam/giam-sat-kiem-soat-noi-bo-va-quan-tri-rui-ro.35C59E03.html
35C59D76,Nhân Viên Kinh Doanh Hóa Chất Xét Nghiệm - Urgent,Công Ty Cổ Phần Thiết Bị Y Tế Nam Trung,Hồ Chí Minh,Lương: Cạnh tranh,09-10-2025,31-12-2025,https://careerviet.vn/vi/tim-viec-lam/nhan-vien-kinh-doanh-hoa-chat-xet-nghiem-urgent.35C59D76.html
35C59D8E,Trưởng phòng Marketing (mạnh về Digital Marketing),CÔNG TY CỔ PHẦN NHÀ PHƯƠNG NAM VIỆT NAM,Hồ Chí Minh,Lương: Cạnh tranh,09-10-2025,31-10-2025,https://careerviet.vn/vi/tim-viec-lam/truong-phong-marketing-manh-ve-digital-marketing.35C59D8E.html
35C59D74,Kỹ Sư QS MEP,Công ty TNHH Tư vấn Dự án SEAS,Hồ Chí Minh,Lương: Cạnh tranh,09-10-2025,02-11-2025,https://careerviet.vn/vi/tim-viec-lam/ky-su-qs-mep.35C59D74.html
35C59DA8,Giám sát Vệ sinh Công nghiệp - Nguyễn Xiễn Q9,Công Ty Cổ Phần Dịch Vụ Nhà Sạch,Hồ Chí Minh,Lương: 8 Tr - 10 Tr VND,09-10-2025,31-10-2025,https://careerviet.vn/vi/tim-viec-lam/giam-sat-ve-sinh-cong-nghiep-nguyen-xien-q9.35C59DA8.html
35C59C2C,NHÂN VIÊN XUẤT NHẬP KHẨU (Q7 - HCM),CÔNG TY CỔ PHẦN VẬN TẢI ĐỈNH PHONG,Hồ Chí Minh,Lương: Cạnh tranh,09-10-2025,02-11-2025,https://careerviet.vn/vi/tim-viec-lam/nhan-vien-xuat-nhap-khau-q7-hcm.35C59C2C.html
35C59DA1,Quản Lý Khu Vực,FASTCARE - CÔNG TY CP TM DV NHT,Hà Nội,Lương: 18 Tr - 20 Tr VND,09-10-2025,02-11-2025,https://careerviet.vn/vi/tim-viec-lam/qua-n-ly-khu-vu-c.35C59DA1.html
35C59D38,Kỹ Sư Giám Sát Hệ Cơ,Công ty TNHH Tư vấn Dự án SEAS,Hồ Chí Minh,Lương: Cạnh tranh,09-10-2025,02-11-2025,https://careerviet.vn/vi/tim-viec-lam/ky-su-giam-sat-he-co.35C59D38.html
35C59C23,Kỹ thuật viên Vật lý trị liệu và Phục hồi chức năng,Công ty TNHH Phòng khám Đa khoa Quốc tế An Phú,Hồ Chí Minh,Lương: Cạnh tranh,09-10-2025,31-12-2025,https://careerviet.vn/vi/tim-viec-lam/ky-thuat-vien-vat-ly-tri-lieu-va-phuc-hoi-chuc-nang.35C59C23.html
35C5AA30,[Bình Dương] Kỹ Thuật Bảo Trì Rạp Phim (Mới),Beta Group,Bình Dương,Lương: 8 Tr - 12 Tr VND,09-10-2025,31-10-2025,https://careerviet.vn/vi/tim-viec-lam/binh-duong-ky-thuat-bao-tri-rap-phim.35C5AA30.html
35C5AA2F,[Đồng Nai] Giám Sát Rạp Phim Beta Biên Hòa (Mới),Beta Group,Đồng Nai,Lương: 8 Tr - 10 Tr VND,09-10-2025,05-11-2025,https://careerviet.vn/vi/tim-viec-lam/dong-nai-giam-sat-rap-phim-beta-bien-hoa.35C5AA2F.html
35C5AA2E,Kỹ sư QS QC ( Hồ sơ) (Mới),Công ty cổ phần công nghiệp dân dụng công nghiệp Hà Nội,Hà Nội Hà Nam,Lương: 14 Tr - 18 Tr VND,09-10-2025,01-11-2025,https://careerviet.vn/vi/tim-viec-lam/ky-su-qs-qc-ho-so.35C5AA2E.html
35C5AA2D,Nhân viên kinh doanh (Mới),CÔNG TY TNHH VẬN TẢI PHAN KHÁNH,Long An,Lương: 8 Tr - 10 Tr VND,08-10-2025,18-10-2025,https://careerviet.vn/vi/tim-viec-lam/nhan-vien-kinh-doanh.35C5AA2D.html
35C57CB4,Kỹ Thuật Viên Xử Lý Nước Thải - nhà máy Hóc Môn/Long An (Mới),Suntory PepsiCo,Hồ Chí Minh Long An,Lương: Cạnh tranh,08-10-2025,31-10-2025,https://careerviet.vn/vi/tim-viec-lam/ky-thuat-vien-xu-ly-nuoc-thai-nha-may-hoc-mon-long-an.35C57CB4.html
35C57C76,Kỹ Thuật Viên Quản Lý Chất Lượng - nhà máy Hóc Môn/Long An (Mới),Suntory PepsiCo,Hồ Chí Minh Long An,Lương: Cạnh tranh,08-10-2025,31-10-2025,https://careerviet.vn/vi/tim-viec-lam/ky-thuat-vien-quan-ly-chat-luong-nha-may-hoc-mon-long-an.35C57C76.html
35C57C92,Kỹ Thuật Viên Vận Hành Máy Chiết - nhà máy Hóc Môn/Long An (Mới),Suntory PepsiCo,Hồ Chí Minh Long An,Lương: Cạnh tranh,08-10-2025,31-10-2025,https://careerviet.vn/vi/tim-viec-lam/ky-thuat-vien-van-hanh-may-chiet-nha-may-hoc-mon-long-an.35C57C92.html
35C57C79,Kỹ Thuật Viên Vận Hành Máy Thổi  - nhà máy Hóc Môn/Long An (Mới),Suntory PepsiCo,Hồ Chí Minh Long An,Lương: Cạnh tranh,08-10-2025,31-10-2025,https://careerviet.vn/vi/tim-viec-lam/ky-thuat-vien-van-hanh-may-thoi-nha-may-hoc-mon-long-an.35C57C79.html
35C5AA2C,Nhân viên An ninh kỹ thuật (Ocean Edu Phú Thọ) Thu nhập từ 8 triệu/tháng (Mới),Công Ty CP Giáo Dục Đại Dương,Phú Thọ,Lương: 8 Tr - 9 Tr VND,08-10-2025,31-10-2025,https://careerviet.vn/vi/tim-viec-lam/nhan-vien-an-ninh-ky-thuat-ocean-edu-phu-tho-thu-nhap-tu-8-trieu-thang.35C5AA2C.html
35C5AA2B,Nhân viên An ninh kỹ thuật (Ocean Edu Yên Bái 2) Thu nhập từ 8 triệu/tháng (Mới),Công Ty CP Giáo Dục Đại Dương,Yên Bái,Lương: 8 Tr - 9 Tr VND,08-10-2025,31-10-2025,https://careerviet.vn/vi/tim-viec-lam/nhan-vien-an-ninh-ky-thuat-ocean-edu-yen-bai-2-thu-nhap-tu-8-trieu-thang.35C5AA2B.html
35C5AA2A,Nhân viên An ninh kỹ thuật (Ocean Edu Khu Vực Thái Nguyên) Thu nhập từ 8 triệu/tháng (Mới),Công Ty CP Giáo Dục Đại Dương,Thái Nguyên,Lương: 8 Tr - 9 Tr VND,08-10-2025,31-10-2025,https://careerviet.vn/vi/tim-viec-lam/nhan-vien-an-ninh-ky-thuat-ocean-edu-khu-vuc-thai-nguyen-thu-nhap-tu-8-trieu-thang.35C5AA2A.html
35C57FC3,Chuyên Viên Quan Hệ Khách Hàng Doanh Nghiệp,Công ty cổ phần nghiên cứu ngành và tư vấn Việt Nam,Hồ Chí Minh,Lương: 10 Tr - 20 Tr VND,09-10-2025,18-10-2025,https://careerviet.vn/vi/tim-viec-lam/chuyen-vien-quan-he-khach-hang-doanh-nghiep.35C57FC3.html
35C57FC3,Chuyên Viên Quan Hệ Khách Hàng Doanh Nghiệp,Công ty cổ phần nghiên cứu ngành và tư vấn Việt Nam,Hồ Chí Minh,Lương: 10 Tr - 20 Tr VND,09-10-2025,18-10-2025,https://careerviet.vn/vi/tim-viec-lam/chuyen-vien-quan-he-khach-hang-doanh-nghiep.35C57FC3.html
35C57F77,Chuyên Viên Kế Hoạch Sự Kiện - Lĩnh vực Truyền thông,CÔNG TY TNHH THIẾT BỊ ĐIỆN LẠNH REON VIỆT NAM,Hà Nội,Lương: 20 Tr - 30 Tr VND,09-10-2025,19-10-2025,https://careerviet.vn/vi/tim-viec-lam/chuyen-vien-ke-hoach-su-kien-linh-vuc-truyen-thong.35C57F77.html
35C57FD4,Trưởng phòng Hành chính Nhân sự,CÔNG TY TNHH THỜI TRANG GB GIA BẢO - NHÃN HÀNG THỜI TRANG NAM ATINO,Hà Nội,Lương: 30 Tr - 35 Tr VND,09-10-2025,18-10-2025,https://careerviet.vn/vi/tim-viec-lam/truong-phong-hanh-chinh-nhan-su.35C57FD4.html
35C57F6F,Phó Phòng Kinh Doanh OTC Miền Nam,CÔNG TY CỔ PHẦN DƯỢC PHẨM STARMED MIỀN NAM,Hồ Chí Minh,Lương: Cạnh tranh,09-10-2025,18-10-2025,https://careerviet.vn/vi/tim-viec-lam/pho-phong-kinh-doanh-otc-mien-nam.35C57F6F.html
35C57CD1,Kỹ Sư Xây Dựng,CÔNG TY CỔ PHẦN THIẾT KẾ XÂY DỰNG PHÚC AN KHANG,Long An Bình Dương Hồ Chí Minh,Lương: 15 Tr - 20 Tr VND,09-10-2025,17-10-2025,https://careerviet.vn/vi/tim-viec-lam/ky-su-xay-dung.35C57CD1.html
35C57E7A,"Nhân Viên Kinh Doanh (Lương Cứng 10Tr - 20Tr - Thu Nhập Lên Đến 100Tr/tháng) Tại Hà Nội, Đà Nẵng, Hồ Chí Minh",CÔNG TY CP THIẾT BỊ VÀ DỊCH VỤ TCE,Hà Nội Hồ Chí Minh Đà Nẵng,Lương: Lên đến 100 Tr VND,09-10-2025,18-10-2025,https://careerviet.vn/vi/tim-viec-lam/nhan-vien-kinh-doanh-luong-cung-10tr-20tr-thu-nhap-len-den-100tr-thang-tai-ha-noi-da-nang-ho-chi-minh.35C57E7A.html
35C57F1E,TRỢ LÝ KIỂM XƯỞNG,CÔNG TY TNHH COCREATION GRASS CORPORATION VIỆT NAM,Tây Ninh,Lương: 10 Tr - 12 Tr VND,09-10-2025,N/A,https://careerviet.vn/vi/tim-viec-lam/tro-ly-kiem-xuong.35C57F1E.html
35C57F22,CHUYÊN VIÊN THU MUA,CÔNG TY TNHH COCREATION GRASS CORPORATION VIỆT NAM,Tây Ninh,Lương: 10 Tr - 15 Tr VND,09-10-2025,N/A,https://careerviet.vn/vi/tim-viec-lam/chuyen-vien-thu-mua.35C57F22.html
35C57F93,Sales B2B Ngành Logistics,CÔNG TY CỔ PHẦN ĐẦU TƯ VÀ PHÁT TRIỂN KHO VẬN VẠN LỢI,Hồ Chí Minh,Lương: 12 Tr - 20 Tr VND,09-10-2025,18-10-2025,https://careerviet.vn/vi/tim-viec-lam/sales-b2b-nganh-logistics.35C57F93.html
35C57DA3,Kế Toán Viên Đi Làm Ngay,CÔNG TY TNHH MỘT NGÔI SAO THÔNG MINH VIỆT NAM,Hà Nội,Lương: 10 Tr - 13 Tr VND,09-10-2025,31-10-2025,https://careerviet.vn/vi/tim-viec-lam/ke-toan-vien-di-lam-ngay.35C57DA3.html
35C57F2C,KỸ SƯ CÔNG NGHỆ,CÔNG TY TNHH COCREATION GRASS CORPORATION VIỆT NAM,Tây Ninh,Lương: 9 Tr - 12 Tr VND,09-10-2025,N/A,https://careerviet.vn/vi/tim-viec-lam/ky-su-cong-nghe.35C57F2C.html
35C57EC0,Trưởng phòng kế toán tài chính,CÔNG TY TNHH THỰC PHẨM CUỘC SỐNG,Hà Nội,Lương: 30 Tr - 32 Tr VND,09-10-2025,18-10-2025,https://careerviet.vn/vi/tim-viec-lam/truong-phong-ke-toan-tai-chinh.35C57EC0.html
35C57FA9,Chuyên viên Đấu thầu và thực hiện hợp đồng công trình điện công nghiệp,Công ty CP thiết bị điện và xây dựng công nghiệp Việt Nam,Hà Nội,Lương: 10 Tr - 18 Tr VND,09-10-2025,31-10-2025,https://careerviet.vn/vi/tim-viec-lam/chuyen-vien-dau-thau-va-thuc-hien-hop-dong-cong-trinh-dien-cong-nghiep.35C57FA9.html
35C57FC6,Nhân Viên Kinh Doanh -  Ngành điện công nghiệp,Công ty CP thiết bị điện và xây dựng công nghiệp Việt Nam,Hà Nội,Lương: 20 Tr - 30 Tr VND,09-10-2025,31-10-2025,https://careerviet.vn/vi/tim-viec-lam/nhan-vien-kinh-doanh-nganh-dien-cong-nghiep.35C57FC6.html
35C57FD1,Quản đốc sản xuất - Tủ điện công nghiệp,Công ty CP thiết bị điện và xây dựng công nghiệp Việt Nam,Hà Nội,Lương: 18 Tr - 27 Tr VND,09-10-2025,31-10-2025,https://careerviet.vn/vi/tim-viec-lam/quan-doc-san-xuat-tu-dien-cong-nghiep.35C57FD1.html
35C57E65,Kỹ Sư Hiện Trường,CÔNG TY CỔ PHẦN ĐỨC ANH,Hà Nam Bắc Giang Hà Nội,Lương: 18 Tr - 22 Tr VND,09-10-2025,18-10-2025,https://careerviet.vn/vi/tim-viec-lam/ky-su-hien-truong.35C57E65.html
35C57FB8,Trưởng Phòng Kỹ Thuật - Điện công nghiệp,Công ty CP thiết bị điện và xây dựng công nghiệp Việt Nam,Hà Nội,Lương: Cạnh tranh,09-10-2025,31-10-2025,https://careerviet.vn/vi/tim-viec-lam/truong-phong-ky-thuat-dien-cong-nghiep.35C57FB8.html
35C35997,Cán Bộ Kỹ Thuật Giám Sát Công Trình Điện,Công ty CP thiết bị điện và xây dựng công nghiệp Việt Nam,Hà Nội,Lương: 16 Tr - 25 Tr VND,09-10-2025,30-10-2025,https://careerviet.vn/vi/tim-viec-lam/can-bo-ky-thuat-giam-sat-cong-trinh-dien.35C35997.html
35C57EED,Cán bộ hồ sơ,CÔNG TY CỔ PHẦN ĐẦU TƯ VÀ PHÁT TRIỂN LUCKY HOUSE,Quảng Ninh,Lương: 14 Tr - 20 Tr VND,09-10-2025,18-10-2025,https://careerviet.vn/vi/tim-viec-lam/can-bo-ho-so.35C57EED.html
35C57F3C,Kỹ thuật viên phân tích kết quả xét nghiệm SHPT,Công ty Trách nhiệm hữu hạn Khoa học kỹ thuật và Dịch vụ Genome,Hà Nội,Lương: 9 Tr - 12 Tr VND,09-10-2025,31-10-2025,https://careerviet.vn/vi/tim-viec-lam/ky-thuat-vien-phan-tich-ket-qua-xet-nghiem-shpt.35C57F3C.html
35C57F89,Phó Giám đốc phụ trách thi công công trình điện,Công ty CP thiết bị điện và xây dựng công nghiệp Việt Nam,Hà Nội,Lương: 20 Tr - 30 Tr VND,09-10-2025,30-10-2025,https://careerviet.vn/vi/tim-viec-lam/pho-giam-doc-phu-trach-thi-cong-cong-trinh-dien.35C57F89.html
35C57E83,Sales Exectuvie,CÔNG TY TNHH THƯƠNG MẠI QUỐC TẾ CCN VIỆT NAM,Hà Nội,Lương: 7 Tr - 30 Tr VND,09-10-2025,30-10-2025,https://careerviet.vn/vi/tim-viec-lam/sales-exectuvie.35C57E83.html
35C57E99,Kế toán tổng hợp,CÔNG TY TNHH THƯƠNG MẠI QUỐC TẾ CCN VIỆT NAM,Hà Nội,Lương: 10 Tr - 30 Tr VND,09-10-2025,6,https://careerviet.vn/vi/tim-viec-lam/ke-toan-tong-hop.35C57E99.html
35C57F6B,"Nhân Viên Kỹ Thuật Thi Công Hệ Thống Mạng, Camera",CÔNG TY TNHH THƯƠNG MẠI DỊCH VỤ KỸ THUẬT TẦM NHÌN,Hồ Chí Minh,Lương: 8 Tr - 13 Tr VND,09-10-2025,18-10-2025,https://careerviet.vn/vi/tim-viec-lam/nhan-vien-ky-thuat-thi-cong-he-thong-mang-camera.35C57F6B.html
35C57F1C,Human Resources Part Leader (Male Candidate),CS WIND Vietnam,Bà Rịa - Vũng Tàu,Lương: Cạnh Tranh,09-10-2025,18-10-2025,https://careerviet.vn/vi/tim-viec-lam/human-resources-part-leader-male-candidate.35C57F1C.html
35C57DDE,Nhân Viên Thu Mua,CÔNG TY TNHH DECHANG VIỆT NAM,Đồng Nai,Lương: 12 Tr - 18 Tr VND,09-10-2025,18-10-2025,https://careerviet.vn/vi/tim-viec-lam/nhan-vien-thu-mua.35C57DDE.html
35C58057,Thực tập sinh Thiết kế Cơ Khí,CÔNG TY TNHH ĐẦU TƯ ITS,Hồ Chí Minh,Lương: 2 Tr - 2 Tr VND,09-10-2025,3,https://careerviet.vn/vi/tim-viec-lam/thuc-tap-sinh-thiet-ke-co-khi.35C58057.html
35C57DFB,Nhân Viên IE,CÔNG TY TNHH DECHANG VIỆT NAM,Đồng Nai,Lương: 18 Tr - 23 Tr VND,09-10-2025,18-10-2025,https://careerviet.vn/vi/tim-viec-lam/nhan-vien-ie.35C57DFB.html
35C57DDC,Nhân viên điều chỉnh máy ép nhựa,CÔNG TY TNHH DECHANG VIỆT NAM,Đồng Nai,Lương: 12 Tr - 18 Tr VND,09-10-2025,18-10-2025,https://careerviet.vn/vi/tim-viec-lam/nhan-vien-dieu-chinh-may-ep-nhua.35C57DDC.html
35C57DBB,Kỹ sư chất lượng (QE),CÔNG TY TNHH DECHANG VIỆT NAM,Đồng Nai,Lương: 12 Tr - 20 Tr VND,09-10-2025,18-10-2025,https://careerviet.vn/vi/tim-viec-lam/ky-su-chat-luong-qe.35C57DBB.html
35C57DB6,Nhân viên phiên dịch tiếng trung,CÔNG TY TNHH DECHANG VIỆT NAM,Đồng Nai,Lương: 13 Tr - 18 Tr VND,09-10-2025,18-10-2025,https://careerviet.vn/vi/tim-viec-lam/nhan-vien-phien-dich-tieng-trung.35C57DB6.html
35C57DC7,Nhân viên văn phòng,CÔNG TY TNHH DECHANG VIỆT NAM,Đồng Nai,Lương: 9 Tr - 15 Tr VND,09-10-2025,18-10-2025,https://careerviet.vn/vi/tim-viec-lam/nhan-vien-van-phong.35C57DC7.html
35C57DE9,Nhân Viên QE,CÔNG TY TNHH DECHANG VIỆT NAM,Đồng Nai,Lương: 13 Tr - 16 Tr VND,09-10-2025,31-10-2025,https://careerviet.vn/vi/tim-viec-lam/nhan-vien-qe.35C57DE9.html
35C57DC4,Nhân viên PMC,CÔNG TY TNHH DECHANG VIỆT NAM,Đồng Nai,Lương: 15 Tr - 23 Tr VND,09-10-2025,18-10-2025,https://careerviet.vn/vi/tim-viec-lam/nhan-vien-pmc.35C57DC4.html
35C5689E,Trình dược viên OTC Bình Phước,CÔNG TY TNHH DƯỢC PHẨM ĐÔ THÀNH,Bình Phước,Lương: 8 Tr - 15 Tr VND,09-10-2025,17-10-2025,https://careerviet.vn/vi/tim-viec-lam/trinh-duoc-vien-otc-binh-phuoc.35C5689E.html
35C58037,Contact Center Manager,MONEYVEO VIETNAM,Hồ Chí Minh,Lương: Cạnh Tranh,09-10-2025,18-10-2025,https://careerviet.vn/vi/tim-viec-lam/contact-center-manager.35C58037.html
35C57E1C,Nhân Viên ME,CÔNG TY TNHH DECHANG VIỆT NAM,Đồng Nai,Lương: 18 Tr - 23 Tr VND,09-10-2025,18-10-2025,https://careerviet.vn/vi/tim-viec-lam/nhan-vien-me.35C57E1C.html
35C57E14,Nhân Viên IE,CÔNG TY TNHH DECHANG VIỆT NAM,Đồng Nai,Lương: 18 Tr - 23 Tr VND,09-10-2025,18-10-2025,https://careerviet.vn/vi/tim-viec-lam/nhan-vien-ie.35C57E14.html
35C5470A,Trình dược viên OTC Bảo Lộc,CÔNG TY TNHH DƯỢC PHẨM ĐÔ THÀNH,Lâm Đồng,Lương: 8 Tr - 15 Tr VND,09-10-2025,17-10-2025,https://careerviet.vn/vi/tim-viec-lam/trinh-duoc-vien-otc-bao-loc.35C5470A.html
35C57DC2,Chủ quản nhân sự,CÔNG TY TNHH DECHANG VIỆT NAM,Đồng Nai,Lương: 23 Tr - 40 Tr VND,09-10-2025,18-10-2025,https://careerviet.vn/vi/tim-viec-lam/chu-quan-nhan-su.35C57DC2.html
35C57FF1,Giáo Viên Tiếng Anh Part-time Trung Tâm Anh Ngữ (Bình Thạnh),TRƯỜNG QUỐC TẾ BLUE RIDGE / BLUE RIDGE INTERNATIONAL SCHOOL (BRIS),Hồ Chí Minh,Lương: Cạnh Tranh,09-10-2025,31-10-2025,https://careerviet.vn/vi/tim-viec-lam/giao-vien-tieng-anh-part-time-trung-tam-anh-ngu-binh-thanh.35C57FF1.html
35C57DC0,Nhân viên nhân sự,CÔNG TY TNHH DECHANG VIỆT NAM,Đồng Nai,Lương: 12 Tr - 18 Tr VND,09-10-2025,18-10-2025,https://careerviet.vn/vi/tim-viec-lam/nhan-vien-nhan-su.35C57DC0.html
35C57DBD,Assistant Supervisor  - QUẢN LÝ ĐƠN HÀNG - Y/c tiếng Trung,Công Ty TNHH Okia Optical Việt Nam,Long An,Lương: 14 Tr - 18 Tr VND,09-10-2025,31-10-2025,https://careerviet.vn/vi/tim-viec-lam/assistant-supervisor-quan-ly-don-hang-y-c-tieng-trung.35C57DBD.html
35C57F5F,Y sỹ Y học cổ truyền,Bệnh viện đa khoa Hoàn Hảo (Hoàn Hảo KeiMeiKai),Hồ Chí Minh,Lương: Cạnh Tranh,09-10-2025,18-10-2025,https://careerviet.vn/vi/tim-viec-lam/y-sy-y-hoc-co-truyen.35C57F5F.html
35C58004,Nhân Viên Tư Vấn Tuyển Sinh (thử việc full lương),TRƯỜNG QUỐC TẾ BLUE RIDGE / BLUE RIDGE INTERNATIONAL SCHOOL (BRIS),Hồ Chí Minh,Lương: Trên 8 Tr VND,09-10-2025,31-10-2025,https://careerviet.vn/vi/tim-viec-lam/nhan-vien-tu-van-tuyen-sinh-thu-viec-full-luong.35C58004.html
35C57EB3,Nhân Viên Kinh Doanh Dự Án,Công Ty Cổ Phần Tập Đoàn Apollo Silicone,Hồ Chí Minh,Lương: Cạnh Tranh,09-10-2025,18-10-2025,https://careerviet.vn/vi/tim-viec-lam/nhan-vien-kinh-doanh-du-an.35C57EB3.html
35C57D9E,Nhân Viên Bán Hàng Biên Hòa,CÔNG TY CỔ PHẦN VUA NỆM,Đồng Nai,Lương: 8 Tr - 12 Tr VND,09-10-2025,17-10-2025,https://careerviet.vn/vi/tim-viec-lam/nhan-vien-ban-hang-bien-hoa.35C57D9E.html
35C57DDA,Quản Lý Cửa Hàng Huyện Củ Chi,CÔNG TY CỔ PHẦN VUA NỆM,Hồ Chí Minh,Lương: 12 Tr - 15 Tr VND,09-10-2025,N/A,https://careerviet.vn/vi/tim-viec-lam/quan-ly-cua-hang-huyen-cu-chi.35C57DDA.html
35C57DF8,Nhân Viên Bán Hàng Đông Anh Hà Nội,CÔNG TY CỔ PHẦN VUA NỆM,Hà Nội,Lương: 8 Tr - 12 Tr VND,09-10-2025,N/A,https://careerviet.vn/vi/tim-viec-lam/nhan-vien-ban-hang-dong-anh-ha-noi.35C57DF8.html
35C58033,Chuyên viên điều phối dịch vụ MICE,CÔNG TY TNHH Y TẾ VIỆT TIẾN,Hồ Chí Minh,Lương: 10 Tr - 12 Tr VND,09-10-2025,1,https://careerviet.vn/vi/tim-viec-lam/chuyen-vien-dieu-phoi-dich-vu-mice.35C58033.html
35C57DE3,Nhân Viên Bán Hàng Củ Chi,CÔNG TY CỔ PHẦN VUA NỆM,Hồ Chí Minh,Lương: 8 Tr - 12 Tr VND,09-10-2025,19-10-2025,https://careerviet.vn/vi/tim-viec-lam/nhan-vien-ban-hang-cu-chi.35C57DE3.html
35C57DE3,Nhân Viên Bán Hàng Củ Chi,CÔNG TY CỔ PHẦN VUA NỆM,Hồ Chí Minh,Lương: 8 Tr - 12 Tr VND,09-10-2025,N/A,https://careerviet.vn/vi/tim-viec-lam/nhan-vien-ban-hang-cu-chi.35C57DE3.html
35C57F4A,[Long Thành - Đồng Nai] Nhân Viên Bảo Trì Sửa Chữa Máy Móc Thiết Bị,Công Ty TNHH Thiên Long Long Thành,Đồng Nai,Lương: 10 Tr - 12 Tr VND,09-10-2025,19-10-2025,https://careerviet.vn/vi/tim-viec-lam/long-thanh-dong-nai-nhan-vien-bao-tri-sua-chua-may-moc-thiet-bi.35C57F4A.html
35C58061,Quản Lý Cửa Hàng Thanh Hóa,CÔNG TY CỔ PHẦN VUA NỆM,Thanh Hóa,Lương: 12 Tr - 15 Tr VND,09-10-2025,17-10-2025,https://careerviet.vn/vi/tim-viec-lam/quan-ly-cua-hang-thanh-hoa.35C58061.html
35C57D86,Business Intelligence Analyst,CÔNG TY TNHH GALAXY DIGITAL HOLDINGS,Hồ Chí Minh,Lương: Cạnh tranh,09-10-2025,18-10-2025,https://careerviet.vn/vi/tim-viec-lam/business-intelligence-analyst.35C57D86.html
35C57DBA,Finance Planning & Analysis Senior Specialist,Công ty TNHH Điện Máy AQUA Việt Nam,Đồng Nai,Lương: Cạnh tranh,09-10-2025,18-10-2025,https://careerviet.vn/vi/tim-viec-lam/finance-planning-analysis-senior-specialist.35C57DBA.html
35C57D89,Data Engineer,CÔNG TY TNHH GALAXY DIGITAL HOLDINGS,Hồ Chí Minh,Lương: Cạnh tranh,09-10-2025,18-10-2025,https://careerviet.vn/vi/tim-viec-lam/data-engineer.35C57D89.html
35C57D87,"Senior Data Analyst (Banking, Card & Loyalty)",CÔNG TY TNHH GALAXY DIGITAL HOLDINGS,Hồ Chí Minh,Lương: Cạnh tranh,09-10-2025,18-10-2025,https://careerviet.vn/vi/tim-viec-lam/senior-data-analyst-banking-card-loyalty.35C57D87.html
35C57FD2,ILO Preschool Bình Dương - Giáo viên mầm non,ILA Việt Nam,Bình Dương,Lương: Cạnh tranh,09-10-2025,18-10-2025,https://careerviet.vn/vi/tim-viec-lam/ilo-preschool-binh-duong-giao-vien-mam-non.35C57FD2.html
35C57D8F,Nhân viên nhân sự,Công ty TNHH San Lim Furniture Việt Nam,Đồng Nai,Lương: Cạnh tranh,09-10-2025,N/A,https://careerviet.vn/vi/tim-viec-lam/nhan-vien-nhan-su.35C57D8F.html
35C57D88,Data Scientist – Card Products & Loyalty,CÔNG TY TNHH GALAXY DIGITAL HOLDINGS,Hồ Chí Minh,Lương: Cạnh tranh,09-10-2025,18-10-2025,https://careerviet.vn/vi/tim-viec-lam/data-scientist-card-products-loyalty.35C57D88.html
35C57E38,Chuyên viên Đối ngoại (Mảng XKLĐ - Nhật Bản),Công ty TNHH MTV Sen Vàng Việt Nam,Hồ Chí Minh Vĩnh Long,Lương: 15 Tr - 25 Tr VND,09-10-2025,N/A,https://careerviet.vn/vi/tim-viec-lam/chuyen-vien-doi-ngoai-mang-xkld-nhat-ban.35C57E38.html
35C57FE5,Trưởng Phòng Kinh Doanh,CÔNG TY TNHH SX_TM THÁI ANH,Hồ Chí Minh,Lương: Cạnh tranh,09-10-2025,18-10-2025,https://careerviet.vn/vi/tim-viec-lam/truong-phong-kinh-doanh.35C57FE5.html
35C129B7,Nhân viên Tư vấn Tuyển sinh CB Kiên Giang (Phú Quốc),Hệ thống Trung tâm Ngoại ngữ Cambridge,Kiên Giang,Lương: Cạnh tranh,09-10-2025,N/A,https://careerviet.vn/vi/tim-viec-lam/nhan-vien-tu-van-tuyen-sinh-cb-kien-giang-phu-quoc.35C129B7.html
35C57416,Interior Designer Staff,Công Ty TNHH Interwood Việt Nam,Bình Dương,"Lương: 500 - 1,000 USD",09-10-2025,6,https://careerviet.vn/vi/tim-viec-lam/interior-designer-staff.35C57416.html
35C57F81,PHÓ TRƯỞNG CƠ SỞ CHUYÊN MÔN TIỂU HỌC,Hệ thống Trường Hội nhập Quốc tế Bamboo,Hồ Chí Minh,Lương: 16 Tr - 20 Tr VND,09-10-2025,N/A,https://careerviet.vn/vi/tim-viec-lam/pho-truong-co-so-chuyen-mon-tieu-hoc.35C57F81.html
35C57F3A,THIẾT KẾ & TRIỂN KHAI KỸ THUẬT NỘI THẤT,Công Ty CP SXTM Thiết Kế Bình Minh,Đồng Nai Hồ Chí Minh,Lương: 23 Tr - 30 Tr VND,09-10-2025,6,https://careerviet.vn/vi/tim-viec-lam/thiet-ke-trien-khai-ky-thuat-noi-that.35C57F3A.html
35C57F39,TRƯỞNG PHÒNG KINH DOANH – Ngành Hàng Lọc Nước,Công ty Cổ Phần Tập Đoàn Thế Giới Điện Giải,Hồ Chí Minh,Lương: 25 Tr - 30 Tr VND,09-10-2025,18-10-2025,https://careerviet.vn/vi/tim-viec-lam/truong-phong-kinh-doanh-nganh-hang-loc-nuoc.35C57F39.html
35C57F38,Trưởng Phòng Kỹ Thuật Xử Lý Nước,Công ty Cổ Phần Tập Đoàn Thế Giới Điện Giải,Hồ Chí Minh,Lương: Cạnh tranh,09-10-2025,18-10-2025,https://careerviet.vn/vi/tim-viec-lam/truong-phong-ky-thuat-xu-ly-nuoc.35C57F38.html
35C57F51,Brand Marketing Executive,Công Ty Hoàng An Nhiên,Đà Nẵng,Lương: 11 Tr - 13 Tr VND,09-10-2025,17-10-2025,https://careerviet.vn/vi/tim-viec-lam/brand-marketing-executive.35C57F51.html
35C57695,Giám Sát May Mẫu,CÔNG TY TNHH GEN NEX APPAREL,Bến Tre,Lương: Cạnh tranh,09-10-2025,18-10-2025,https://careerviet.vn/vi/tim-viec-lam/giam-sat-may-mau.35C57695.html
35C57A02,Bảo Vệ Công Trình,CÔNG TY TRÁCH NHIỆM HỮU HẠN TÂN HỒ TÚ,Bình Dương,Lương: Cạnh Tranh,09-10-2025,16-10-2025,https://careerviet.vn/vi/tim-viec-lam/bao-ve-cong-trinh.35C57A02.html
35C57F0B,Nhân viên Bán Hàng Thời Trang (Sales Associate),CÔNG TY TNHH SEMIR INTERNATIONAL VIỆT NAM,Hà Nội Hồ Chí Minh,Lương: Cạnh Tranh,09-10-2025,31-10-2025,https://careerviet.vn/vi/tim-viec-lam/nhan-vien-ban-hang-thoi-trang-sales-associate.35C57F0B.html
35C5769A,Nhân Viên CSR (Trách Nhiệm Xã Hội),CÔNG TY TNHH GEN NEX APPAREL,Bến Tre,Lương: Cạnh Tranh,09-10-2025,18-10-2025,https://careerviet.vn/vi/tim-viec-lam/nhan-vien-csr-trach-nhiem-xa-hoi.35C5769A.html
35C57696,"Nhân Viên Thu Mua Vải, Phụ Liệu May Mặc",CÔNG TY TNHH GEN NEX APPAREL,Bến Tre,Lương: Cạnh Tranh,09-10-2025,31-12-2025,https://careerviet.vn/vi/tim-viec-lam/nhan-vien-thu-mua-vai-phu-lieu-may-mac.35C57696.html
35C57A1B,Kỹ Sư Đấu Thầu,CÔNG TY TRÁCH NHIỆM HỮU HẠN TÂN HỒ TÚ,Bình Dương,Lương: Cạnh Tranh,09-10-2025,16-10-2025,https://careerviet.vn/vi/tim-viec-lam/ky-su-dau-thau.35C57A1B.html
35C57F61,Test & Debug Technician/ Kỹ thuật viên,TNHH Sài Gòn Fabrication (Fab-9) Vietnam,Bình Dương,Lương: 8 Tr - 11 Tr VND,09-10-2025,18-10-2025,https://careerviet.vn/vi/tim-viec-lam/test-debug-technician-ky-thuat-vien.35C57F61.html
35C57A05,Kỹ Sư Hiện Trường,CÔNG TY TRÁCH NHIỆM HỮU HẠN TÂN HỒ TÚ,Bình Dương,Lương: Cạnh Tranh,09-10-2025,16-10-2025,https://careerviet.vn/vi/tim-viec-lam/ky-su-hien-truong.35C57A05.html
35C57F4C,CÔNG NHÂN SẢN XUẤT - SẢN XUẤT SỢI LỐP,Công Ty TNHH Công Nghiệp Kolon Bình Dương,Bình Dương,"Lương: 9,5 Tr - 15 Tr VND",09-10-2025,31-12-2025,https://careerviet.vn/vi/tim-viec-lam/cong-nhan-san-xuat-san-xuat-soi-lop.35C57F4C.html
35C57DDB,Phiên dịch Tiếng Nhật,Công ty TNHH Thực phẩm Nissin Việt Nam,Hồ Chí Minh,Lương: Cạnh Tranh,09-10-2025,18-10-2025,https://careerviet.vn/vi/tim-viec-lam/phien-dich-tieng-nhat.35C57DDB.html
35C57F95,"Quản lý dự án Hoàn thiện - Nội thất (Dự án Văn phòng, Resort, Khách sạn)",TTT Corporation,Hồ Chí Minh Hà Nội,Lương: 20 Tr - 30 Tr VND,09-10-2025,3,https://careerviet.vn/vi/tim-viec-lam/quan-ly-du-an-hoan-thien-noi-that-du-an-van-phong-resort-khach-san.35C57F95.html
35C57F9E,Chỉ huy công trường dự án Hoàn thiện - Nội thất,TTT Corporation,Hồ Chí Minh Hà Nội,Lương: 18 Tr - 25 Tr VND,09-10-2025,3,https://careerviet.vn/vi/tim-viec-lam/chi-huy-cong-truong-du-an-hoan-thien-noi-that.35C57F9E.html
35C57F3F,Công nhân bảo trì cơ điện,Công Ty TNHH Công Nghiệp Kolon Bình Dương,Bình Dương,Lương: 8 Tr - 10 Tr VND,09-10-2025,20-11-2025,https://careerviet.vn/vi/tim-viec-lam/cong-nhan-bao-tri-co-dien.35C57F3F.html
