ID,Tên công việc,Tên công ty,Nơi làm việc,Mức lương,Ngày đăng tin,Ngày hết hạn,Link
35C5B882,Chuyên viên Tổng hợp Dự án (Làm việc tại Tây Ninh) (Mới),Công ty CP Thành Thành Công - Biên Hòa,Tây Ninh,Lương: Cạnh tranh,16-10-2025,16-11-2025,https://careerviet.vn/vi/tim-viec-lam/chuyen-vien-tong-hop-du-an-lam-viec-tai-tay-ninh.35C5B882.html
35C5B882,Chuyên viên Tổng hợp Dự án (Làm việc tại Tây Ninh) (Mới),Công ty CP Thành Thành Công - Biên Hòa,Tây Ninh,Lương: Cạnh tranh,16-10-2025,16-11-2025,https://careerviet.vn/vi/tim-viec-lam/chuyen-vien-tong-hop-du-an-lam-viec-tai-tay-ninh.35C5B882.html
35C5B766,Field Application Engineer (Machine Vision) (Mới),CÔNG TY CỔ PHẦN VANPIRE VIỆT NAM,Hồ Chí Minh,"Lương: 800 - 1,000 USD",16-10-2025,17-11-2025,https://careerviet.vn/vi/tim-viec-lam/field-application-engineer-machine-vision.35C5B766.html
35C5B87D,Nhân Viên Hành Chính & Hỗ Trợ Kinh Doanh (Tiếng Trung) (Mới),Headhunter HRchannels Group,Hồ Chí Minh Bình Dương Đồng Nai,Lương: 16 Tr - 20 Tr VND,16-10-2025,16-11-2025,https://careerviet.vn/vi/tim-viec-lam/nhan-vien-hanh-chinh-ho-tro-kinh-doanh-tieng-trung.35C5B87D.html
35C5B86D,Nhân viên Kế Toán Công Nợ (Phải Thu) (Mới),BOSTON PHARMA - Công Ty CP Dược Phẩm Boston Việt Nam,Hồ Chí Minh,Lương: Cạnh tranh,16-10-2025,16-11-2025,https://careerviet.vn/vi/tim-viec-lam/nhan-vien-ke-toan-cong-no-phai-thu.35C5B86D.html
35C59C69,Nhân viên Sales admin,Công Ty Cổ Phần Gỗ An Cường,Hồ Chí Minh,Lương: 10 Tr - 14 Tr VND,16-10-2025,02-11-2025,https://careerviet.vn/vi/tim-viec-lam/nhan-vien-sales-admin.35C59C69.html
35C54B0C,Kỹ sư giám sát xây dựng,CÔNG TY CỔ PHẦN FECON SOUTH,Hồ Chí Minh,Lương: 16 Tr - 20 Tr VND,16-10-2025,25-10-2025,https://careerviet.vn/vi/tim-viec-lam/ky-su-giam-sat-xay-dung.35C54B0C.html
35C5B87A,KỸ SƯ CHUYÊN NGÀNH CƠ (Mới),Công ty Dịch vụ sửa chữa các nhà máy điện EVNGENCO 3,Bình Thuận,Lương: Cạnh tranh,16-10-2025,16-11-2025,https://careerviet.vn/vi/tim-viec-lam/ky-su-chuyen-nganh-co.35C5B87A.html
35C542F8,Kỹ sư dự toán đấu thầu,CÔNG TY CỔ PHẦN FECON SOUTH,Hồ Chí Minh,Lương: 18 Tr - 25 Tr VND,16-10-2025,5,https://careerviet.vn/vi/tim-viec-lam/ky-su-du-toan-dau-thau.35C542F8.html
35C5B879,CÔNG NHÂN CHUYÊN NGÀNH ĐIỆN (Quảng Ninh) (Mới),Công ty Dịch vụ sửa chữa các nhà máy điện EVNGENCO 3,Quảng Ninh,Lương: Cạnh tranh,16-10-2025,16-12-2025,https://careerviet.vn/vi/tim-viec-lam/cong-nhan-chuyen-nganh-dien-quang-ninh.35C5B879.html
35C5B878,KỸ SƯ CHUYÊN NGÀNH ĐIỆN (Quảng Ninh) (Mới),Công ty Dịch vụ sửa chữa các nhà máy điện EVNGENCO 3,Quảng Ninh,Lương: Cạnh tranh,16-10-2025,02-11-2025,https://careerviet.vn/vi/tim-viec-lam/ky-su-chuyen-nganh-dien-quang-ninh.35C5B878.html
35C5B84E,Area Sales Manager (ASM)  ETC + OTC (Mới),Bảo mật,Hồ Chí Minh,Lương: 30 Tr - 35 Tr VND,16-10-2025,15-11-2025,https://careerviet.vn/vi/tim-viec-lam/area-sales-manager-asm-etc-otc.35C5B84E.html
35C5B874,Senior Finance Specialist (Mới),Công Ty TNHH XNK Phát Triển Đông Dương,Hồ Chí Minh,Lương: 18 Tr - 22 Tr VND,16-10-2025,16-11-2025,https://careerviet.vn/vi/tim-viec-lam/senior-finance-specialist.35C5B874.html
35C5B872,Senior Technical Executive (Mới),Saint-Gobain Vietnam,Long An,Lương: Cạnh tranh,16-10-2025,30-11-2025,https://careerviet.vn/vi/tim-viec-lam/senior-technical-executive.35C5B872.html
35C5B871,Kỹ sư giám sát công trình ( Giỏi Tiếng Anh) (Mới),Công ty Cổ Phần Lucky Steel Buildings,Hồ Chí Minh,Lương: Trên 20 Tr VND,16-10-2025,15-11-2025,https://careerviet.vn/vi/tim-viec-lam/ky-su-giam-sat-cong-trinh-gioi-tieng-anh.35C5B871.html
35C5B873,Tiktok Content Creator (Filming & Editing) (Mới),CTY TNHH YAOYAO VIETNAM INFO TECH,Hồ Chí Minh,Lương: 12 Tr - 18 Tr VND,16-10-2025,16-11-2025,https://careerviet.vn/vi/tim-viec-lam/tiktok-content-creator-filming-editing.35C5B873.html
35C5B86A,Nhân viên hành chính nhân sự (Mới),CÔNG TY CỔ PHẦN THIẾT KẾ XÂY DỰNG TWIN,Hồ Chí Minh,Lương: Trên 8 Tr VND,16-10-2025,30-11-2025,https://careerviet.vn/vi/tim-viec-lam/nhan-vien-hanh-chinh-nhan-su.35C5B86A.html
35C5B86F,Trưởng Nhóm Bán Sản Phẩm Tín Chấp - Huế - TA161 (Mới),Ngân Hàng TMCP Việt Nam Thịnh Vượng - VPBANK,Thừa Thiên- Huế,Lương: Cạnh tranh,16-10-2025,30-11-2025,https://careerviet.vn/vi/tim-viec-lam/truong-nhom-ban-san-pham-tin-chap-hue-ta161.35C5B86F.html
35C5B861,Nhân Viên Sale Online (Không đi Thị Trường) (Mới),Công Ty Cổ Phần Công Nghiệp Và Thương Mại Cường Thịnh,Hồ Chí Minh,Lương: 10 Tr - 12 Tr VND,16-10-2025,15-11-2025,https://careerviet.vn/vi/tim-viec-lam/nhan-vien-sale-online-khong-di-thi-truong.35C5B861.html
35C5147E,QUẢN LÝ KINH DOANH DỰ ÁN,CÔNG TY CỔ PHẦN KH SHIELD,Hồ Chí Minh Hà Nội,Lương: 15 Tr - 30 Tr VND,16-10-2025,29-10-2025,https://careerviet.vn/vi/tim-viec-lam/quan-ly-kinh-doanh-du-an.35C5147E.html
35C5B865,Chuyên Viên Kế Toán Tổng Hợp (Mới),FE CREDIT,Hồ Chí Minh,Lương: Cạnh tranh,16-10-2025,15-11-2025,https://careerviet.vn/vi/tim-viec-lam/chuyen-vien-ke-toan-tong-hop.35C5B865.html
35C5B867,Nhân viên phiên dịch tiếng Trung(Mới),Công ty Cổ Phần Lucky Steel Buildings,Hồ Chí Minh,Lương: Trên 15 Tr VND,16-10-2025,20-11-2025,https://careerviet.vn/vi/tim-viec-lam/nhan-vien-phien-dich-tieng-trung.35C5B867.html
35C5B868,Trưởng Nhóm Bán Sản Phẩm Tín Chấp - Thái Nguyên - TA161(Mới),Ngân Hàng TMCP Việt Nam Thịnh Vượng - VPBANK,Thái Nguyên,Lương: Cạnh Tranh,16-10-2025,30-11-2025,https://careerviet.vn/vi/tim-viec-lam/truong-nhom-ban-san-pham-tin-chap-thai-nguyen-ta161.35C5B868.html
35C5B6F2,Personal Assistant(Mới),CareerViet's client,Hồ Chí Minh,Lương: Cạnh Tranh,16-10-2025,09-12-2025,https://careerviet.vn/vi/tim-viec-lam/personal-assistant.35C5B6F2.html
35C5AA08,Kế toán trưởng,CÔNG TY TNHH VẬN TẢI PHAN KHÁNH,Long An,Lương: 22 Tr - 25 Tr VND,16-10-2025,2,https://careerviet.vn/vi/tim-viec-lam/ke-toan-truong.35C5AA08.html
35C5AA64,Giám đốc kinh doanh,CÔNG TY TNHH VẬN TẢI PHAN KHÁNH,Long An,Lương: 22 Tr - 30 Tr VND,16-10-2025,2,https://careerviet.vn/vi/tim-viec-lam/giam-doc-kinh-doanh.35C5AA64.html
35C5B85B,Hành chính nhân sự(Mới),Công ty TNHH X.E Việt Nam,Hà Nội,Lương: 9 Tr - 10 Tr VND,16-10-2025,15-11-2025,https://careerviet.vn/vi/tim-viec-lam/hanh-chinh-nhan-su.35C5B85B.html
35C5B85E,MIỀN TÂY - TRƯỞNG BỘ PHẬN KHÁCH HÀNG CÁ NHÂN(Mới),Ngân Hàng Thương Mại Cổ Phần Nam Á (Nam A Bank),Long An Tây Ninh,Lương: Trên 17 Tr VND,16-10-2025,12-12-2025,https://careerviet.vn/vi/tim-viec-lam/mien-tay-truong-bo-phan-khach-hang-ca-nhan.35C5B85E.html
35C5B855,HCM_Nhân Viên Giao Nhận(Mới),Công ty TNHH Thiên Thủy Mộc,Hồ Chí Minh,Lương: 9 Tr - 10 Tr VND,16-10-2025,15-11-2025,https://careerviet.vn/vi/tim-viec-lam/hcm_nhan-vien-giao-nhan.35C5B855.html
35C5B85D,Kế Toán Công Nợ & Chi Phí(Mới),Tập Đoàn Kim Tín,Hồ Chí Minh,Lương: 12 Tr - 15 Tr VND,16-10-2025,19-11-2025,https://careerviet.vn/vi/tim-viec-lam/ke-toan-cong-no-chi-phi.35C5B85D.html
35C5B85C,System Development Lead (Lark Suite) - Trưởng nhóm Phát triển phần mềm Lark Suite(Mới),CÔNG TY TNHH PRIME COMMERCE VIỆT NAM,Hồ Chí Minh,Lương: Cạnh Tranh,16-10-2025,16-11-2025,https://careerviet.vn/vi/tim-viec-lam/system-development-lead-lark-suite-truong-nhom-phat-trien-phan-mem-lark-suite.35C5B85C.html
35C5B858,"Chỉ Huy Trưởng Công trình xây dựng Cầu, Đường(Mới)",CÔNG TY CỔ PHẦN ĐẦU TƯ VÀ PHÁT TRIỂN LẠC HỒNG,Bắc Cạn Cao Bằng,Lương: 20 Tr - 25 Tr VND,16-10-2025,16-11-2025,https://careerviet.vn/vi/tim-viec-lam/chi-huy-truong-cong-trinh-xay-dung-cau-duong.35C5B858.html
35C5B857,Cán bộ kỹ thuật hiện trường (không yêu cầu kinh nghiệm)(Mới),CÔNG TY CỔ PHẦN ĐẦU TƯ VÀ PHÁT TRIỂN LẠC HỒNG,Hòa Bình Cao Bằng Bắc Cạn,Lương: 12 Tr - 18 Tr VND,16-10-2025,16-11-2025,https://careerviet.vn/vi/tim-viec-lam/can-bo-ky-thuat-hien-truong-khong-yeu-cau-kinh-nghiem.35C5B857.html
35C5B856,"Kỹ sư nội nghiệp (QC, QS) tại Hà Nội(Mới)",CÔNG TY CỔ PHẦN ĐẦU TƯ VÀ PHÁT TRIỂN LẠC HỒNG,Hà Nội,Lương: 15 Tr - 20 Tr VND,16-10-2025,16-11-2025,https://careerviet.vn/vi/tim-viec-lam/ky-su-noi-nghiep-qc-qs-tai-ha-noi.35C5B856.html
35C5B84F,HCM_Trưởng nhóm Tư vân Bán hàng (Thiết bị làm đẹp)(Mới),Công ty TNHH Thiên Thủy Mộc,Hồ Chí Minh,Lương: Cạnh Tranh,16-10-2025,16-11-2025,https://careerviet.vn/vi/tim-viec-lam/hcm_truong-nhom-tu-van-ban-hang-thiet-bi-lam-dep.35C5B84F.html
35C5B854,PHÓ CHỦ QUẢN PHÒNG LAB(Mới),CÔNG TY TNHH KAM HING (VIỆT NAM) DỆT NHUỘM VÀ IN,Đồng Nai,Lương: Cạnh Tranh,16-10-2025,09-11-2025,https://careerviet.vn/vi/tim-viec-lam/pho-chu-quan-phong-lab.35C5B854.html
35C5B84C,"Chuyên Viên Tư Vấn Khóa Học IELTS, KIDS (Senior EC) Thu Nhập Hấp Dẫn Chỉ Tuyển Nữ (TP.Hồ Chí Minh) Đi Làm Ngay(Mới)",CÔNG TY TNHH PHÁT TRIỂN GIÁO DỤC BRITISH ACADEMY VIỆT NAM,Hồ Chí Minh,Lương: 12 Tr - 40 Tr VND,16-10-2025,11-11-2025,https://careerviet.vn/vi/tim-viec-lam/chuyen-vien-tu-van-khoa-hoc-ielts-kids-senior-ec-thu-nhap-hap-dan-chi-tuyen-nu-tp-ho-chi-minh-di-lam-ngay.35C5B84C.html
35C5B851,Giáo viên tiếng Anh dạy IELTS - Part time(Mới),CÔNG TY TNHH PHÁT TRIỂN GIÁO DỤC BRITISH ACADEMY VIỆT NAM,Hồ Chí Minh,Lương: 17 Tr - 30 Tr VND,16-10-2025,11-11-2025,https://careerviet.vn/vi/tim-viec-lam/giao-vien-tieng-anh-day-ielts-part-time.35C5B851.html
35C5B852,Nhân Viên Xử Lý Hồ Sơ (Processing Officer)(Mới),NEW ACE VIỆT NAM,Hồ Chí Minh,Lương: Cạnh Tranh,16-10-2025,16-11-2025,https://careerviet.vn/vi/tim-viec-lam/nhan-vien-xu-ly-ho-so-processing-officer.35C5B852.html
35C5B850,MIỀN TÂY - GIÁM ĐỐC PHÒNG GIAO DỊCH(Mới),Ngân Hàng Thương Mại Cổ Phần Nam Á (Nam A Bank),An Giang,Lương: Cạnh Tranh,16-10-2025,12-12-2025,https://careerviet.vn/vi/tim-viec-lam/mien-tay-giam-doc-phong-giao-dich.35C5B850.html
35C5B84D,Chuyên viên Sale online - Sàn Tiktok Shop(Mới),CÔNG TY TNHH ANTA SPORTS VIỆT NAM,Hồ Chí Minh,Lương: 15 Tr - 18 Tr VND,16-10-2025,31-10-2025,https://careerviet.vn/vi/tim-viec-lam/chuyen-vien-sale-online-san-tiktok-shop.35C5B84D.html
35C5B848,[GREENHN - HCM] KỸ SƯ HIỆN TRƯỜNG(Mới),CÔNG TY CỔ PHẦN TƯ VẤN THIẾT KẾ VÀ XÂY DỰNG GREENHN,Hồ Chí Minh,Lương: 15 Tr - 22 Tr VND,16-10-2025,15-11-2025,https://careerviet.vn/vi/tim-viec-lam/greenhn-hcm-ky-su-hien-truong.35C5B848.html
35C5B81F,Kế toán tổng hợp(Mới),CÔNG TY TNHH HAMOON,Hồ Chí Minh,Lương: 13 Tr - 20 Tr VND,16-10-2025,16-11-2025,https://careerviet.vn/vi/tim-viec-lam/ke-toan-tong-hop.35C5B81F.html
35C5B847,NHÂN VIÊN THIẾT KẾ TẠI HẢI PHÒNG(Mới),Công ty TNHH Phát triển BĐS Novasky,Hải Phòng,Lương: 8 Tr - 12 Tr VND,16-10-2025,20-11-2025,https://careerviet.vn/vi/tim-viec-lam/nhan-vien-thiet-ke-tai-hai-phong.35C5B847.html
35C5B849,Nhân viên Đào tạo(Mới),Tổng Công ty Cổ phần Công trình Viettel,Hà Nội,Lương: 18 Tr - 25 Tr VND,16-10-2025,14-11-2025,https://careerviet.vn/vi/tim-viec-lam/nhan-vien-dao-tao.35C5B849.html
35C5873E,Recruitment Manager,CÔNG TY CỔ PHẦN KẾT NỐI VIỆC,Hồ Chí Minh,Lương: Cạnh Tranh,16-10-2025,31-10-2025,https://careerviet.vn/vi/tim-viec-lam/recruitment-manager.35C5873E.html
35C5B846,Nhân viên Marketing Dự án(Mới),Công ty TNHH Phát triển BĐS Novasky,Hà Nội,Lương: 8 Tr - 13 Tr VND,16-10-2025,20-11-2025,https://careerviet.vn/vi/tim-viec-lam/nhan-vien-marketing-du-an.35C5B846.html
35C5B83F,Nhân viên quay dựng Video (Video Editor) - Nhãn Menard(Mới),Công ty TNHH Thiên Thủy Mộc,Hồ Chí Minh,Lương: 16 Tr - 20 Tr VND,16-10-2025,14-11-2025,https://careerviet.vn/vi/tim-viec-lam/nhan-vien-quay-dung-video-video-editor-nhan-menard.35C5B83F.html
35C5B7B0,Project Officer for Wood & Furniture Manufacturing Processes in SMEs(Mới),The Deutsche Gesellschaft für Internationale Zusammenarbeit (GIZ),Hồ Chí Minh,Lương: Cạnh Tranh,16-10-2025,31-10-2025,https://careerviet.vn/vi/tim-viec-lam/project-officer-for-wood-furniture-manufacturing-processes-in-smes.35C5B7B0.html
35C5B843,[TÂY NINH] GIÁM SÁT TUYỂN DỤNG(Mới),Công Ty TNHH CJ Vina Agri,Long An,Lương: Cạnh Tranh,16-10-2025,15-11-2025,https://careerviet.vn/vi/tim-viec-lam/tay-ninh-giam-sat-tuyen-dung.35C5B843.html
35C5B7E6,[SCT] Chuyên viên Telesale(Mới),PHÒNG KHÁM ĐA KHOA SCT,Hà Nội,Lương: Cạnh Tranh,16-10-2025,16-11-2025,https://careerviet.vn/vi/tim-viec-lam/sct-chuyen-vien-telesale.35C5B7E6.html
35C5B83B,Chuyên viên Kinh doanh Xuất khẩu (Mới),Tập Đoàn Lộc Trời,Hồ Chí Minh,Lương: Cạnh tranh,16-10-2025,16-11-2025,https://careerviet.vn/vi/tim-viec-lam/chuyen-vien-kinh-doanh-xuat-khau.35C5B83B.html
35C5B83B,Chuyên viên Kinh doanh Xuất khẩu (Mới),Tập Đoàn Lộc Trời,Hồ Chí Minh,Lương: Cạnh tranh,16-10-2025,16-11-2025,https://careerviet.vn/vi/tim-viec-lam/chuyen-vien-kinh-doanh-xuat-khau.35C5B83B.html
35C5B841,MIỀN TÂY - KIỂM SOÁT VIÊN (Mới),Ngân Hàng Thương Mại Cổ Phần Nam Á (Nam A Bank),Đồng Tháp,Lương: Trên 17 Tr VND,16-10-2025,12-12-2025,https://careerviet.vn/vi/tim-viec-lam/mien-tay-kiem-soat-vien.35C5B841.html
35C5B842,Senior Trade Marketing Specialist (Service Retail) (Mới),Công Ty CP Vàng Bạc Đá Quý Phú Nhuận - PNJ,Hồ Chí Minh,Lương: Cạnh tranh,16-10-2025,30-11-2025,https://careerviet.vn/vi/tim-viec-lam/senior-trade-marketing-specialist-service-retail.35C5B842.html
35C5B83E,TRƯỞNG PHÒNG MARKETING (Mới),CÔNG TY CỔ PHẦN TẬP ĐOÀN MIK GROUP VIỆT NAM,Hồ Chí Minh Hà Nội,Lương: Cạnh tranh,16-10-2025,16-11-2025,https://careerviet.vn/vi/tim-viec-lam/truong-phong-marketing.35C5B83E.html
35C5B79D,Content Executive (Mới),Công ty TNHH Công nghệ Bất Động Sản REVER,Hồ Chí Minh,Lương: Cạnh tranh,16-10-2025,15-11-2025,https://careerviet.vn/vi/tim-viec-lam/content-executive.35C5B79D.html
35C5B837,Giám đốc Trung tâm Trí tuệ nhân tạo (AI) (Mới),Công ty Cổ phần Tập đoàn Meey Land,Hà Nội,Lương: 70 Tr - 90 Tr VND,16-10-2025,16-11-2025,https://careerviet.vn/vi/tim-viec-lam/giam-doc-trung-tam-tri-tue-nhan-tao-ai.35C5B837.html
35C5B839,Trưởng Phòng Kế Toán Tổng Hợp (Mới),CÔNG TY TNHH THIẾT KẾ HPA & PARTNERS (VIÊT NAM),Hà Nội,Lương: Trên 25 Tr VND,16-10-2025,16-11-2025,https://careerviet.vn/vi/tim-viec-lam/truong-phong-ke-toan-tong-hop.35C5B839.html
35C5B83D,Trưởng Nhóm Bán Sản Phẩm Tín Chấp - Đà Nẵng - TA161 (Mới),Ngân Hàng TMCP Việt Nam Thịnh Vượng - VPBANK,Đà Nẵng,Lương: Cạnh tranh,16-10-2025,30-11-2025,https://careerviet.vn/vi/tim-viec-lam/truong-nhom-ban-san-pham-tin-chap-da-nang-ta161.35C5B83D.html
35C5B83A,Nhân viên dự toán (Mới),CÔNG TY TNHH XÂY DỰNG QUỐC TẾ CHUANG XING,Hà Nam,Lương: 17 Tr - 22 Tr VND,16-10-2025,25-11-2025,https://careerviet.vn/vi/tim-viec-lam/nhan-vien-du-toan.35C5B83A.html
35C5B836,Chuyên Viên Kiểm Soát Nội Bộ (Mới),Công ty Cổ phần Mediamart Việt Nam,Hà Nội,Lương: 15 Tr - 17 Tr VND,16-10-2025,16-11-2025,https://careerviet.vn/vi/tim-viec-lam/chuyen-vien-kiem-soat-noi-bo.35C5B836.html
35C59FD2,Sales Executive,"GS Battery Vietnam Co., Ltd. (Công ty TNHH Ắc quy GS Việt Nam)",Hà Nội,Lương: 18 Tr - 20 Tr VND,16-10-2025,31-10-2025,https://careerviet.vn/vi/tim-viec-lam/sales-executive.35C59FD2.html
35C5B834,Mechanical Design Engineer (Mới),WEC Engineers & Constructors Co. Ltd,Hồ Chí Minh,Lương: Cạnh tranh,16-10-2025,23-11-2025,https://careerviet.vn/vi/tim-viec-lam/mechanical-design-engineer.35C5B834.html
35C5B835,Nhân Viên QC Hóa Lý (Mới),Orioled Hub,Bà Rịa - Vũng Tàu,Lương: Cạnh tranh,16-10-2025,30-11-2025,https://careerviet.vn/vi/tim-viec-lam/nhan-vien-qc-hoa-ly.35C5B835.html
35C5B73D,Chuyên viên Thiết kế nội thất (Mới),TTT Corporation,Hồ Chí Minh,Lương: Cạnh tranh,16-10-2025,17-11-2025,https://careerviet.vn/vi/tim-viec-lam/chuyen-vien-thiet-ke-noi-that.35C5B73D.html
35C5B833,Trưởng nhóm vận hành hệ thống phụ trợ (Mới),Công ty Cổ phần thực phẩm và đồ uống Barett,Hưng Yên,Lương: 12 Tr - 25 Tr VND,16-10-2025,15-11-2025,https://careerviet.vn/vi/tim-viec-lam/truong-nhom-van-hanh-he-thong-phu-tro.35C5B833.html
35C5B82E,Chuyên viên Thẩm định giá (Mới),Công ty cổ phần Định giá và Dịch vụ tài chính Hoàng Cầu,Hồ Chí Minh Bình Dương Đồng Nai,Lương: 12 Tr - 25 Tr VND,16-10-2025,30-11-2025,https://careerviet.vn/vi/tim-viec-lam/chuyen-vien-tham-dinh-gia.35C5B82E.html
35C5B82F,Chuyên viên hành chính nhân sự (Mới),CÔNG TY TNHH DỊCH VỤ PSO,Bình Dương,Lương: 8 Tr - 12 Tr VND,16-10-2025,31-10-2025,https://careerviet.vn/vi/tim-viec-lam/chuyen-vien-hanh-chinh-nhan-su.35C5B82F.html
35C5B7F7,Phó Giám đốc Kinh doanh dự án (Chủ đầu tư BĐS) (Mới),Công ty Cổ phần Tập đoàn KITA Group,Hồ Chí Minh,Lương: Cạnh tranh,16-10-2025,15-11-2025,https://careerviet.vn/vi/tim-viec-lam/pho-giam-doc-kinh-doanh-du-an-chu-dau-tu-bds.35C5B7F7.html
35C5B831,Trưởng nhóm phụ trợ (Mới),Công ty Cổ phần thực phẩm và đồ uống Barett,Hưng Yên,Lương: 12 Tr - 25 Tr VND,16-10-2025,15-11-2025,https://careerviet.vn/vi/tim-viec-lam/truong-nhom-phu-tro.35C5B831.html
35C5B81B,GIÁM ĐỐC KINH DOANH (Mới),CÔNG TY LITTLE GARDEN - LG CLINIC,Hồ Chí Minh,Lương: Cạnh tranh,16-10-2025,15-11-2025,https://careerviet.vn/vi/tim-viec-lam/giam-doc-kinh-doanh.35C5B81B.html
35C5B82D,Phụ trách hành chính nhân sự(Mới),Công ty TNHH Minh Hương P.N.D (thương hiệu thời trang mặc nhà cao cấp Sunfly),Hà Nội,Lương: 15 Tr - 17 Tr VND,16-10-2025,30-11-2025,https://careerviet.vn/vi/tim-viec-lam/phu-trach-hanh-chinh-nhan-su.35C5B82D.html
35C5B810,Giám đốc nguồn nhân lực(Mới),Công ty Cổ Phần Bất Động Sản SeaHoldings,Hồ Chí Minh,Lương: 30 Tr - 40 Tr VND,16-10-2025,30-11-2025,https://careerviet.vn/vi/tim-viec-lam/giam-doc-nguon-nhan-luc.35C5B810.html
35C5B82C,Kế toán công nợ phải thu(Mới),Công ty TNHH Cơ Điện Lạnh EEP Việt Nam,Hà Nội,Lương: 12 Tr - 15 Tr VND,16-10-2025,09-11-2025,https://careerviet.vn/vi/tim-viec-lam/ke-toan-cong-no-phai-thu.35C5B82C.html
35C5B826,[NINH BÌNH] Giám Sát Rạp Chiếu Phim(Mới),CÔNG TY TNHH LOTTECINEMA VIỆT NAM,Ninh Bình,Lương: 8 Tr - 10 Tr VND,16-10-2025,15-11-2025,https://careerviet.vn/vi/tim-viec-lam/ninh-binh-giam-sat-rap-chieu-phim.35C5B826.html
35C5B827,Trưởng bộ phận Điện – Tự động hóa(Mới),Công ty CP Thành Thành Công - Biên Hòa,Tây Ninh,Lương: Cạnh Tranh,16-10-2025,16-11-2025,https://careerviet.vn/vi/tim-viec-lam/truong-bo-phan-dien-tu-dong-hoa.35C5B827.html
35C5B825,Chuyên viên kho vật tư kỹ thuật(Mới),Công ty CP Thành Thành Công - Biên Hòa,Tây Ninh,Lương: Cạnh Tranh,16-10-2025,16-11-2025,https://careerviet.vn/vi/tim-viec-lam/chuyen-vien-kho-vat-tu-ky-thuat.35C5B825.html
35C5B822,Chuyên viên Pháp lý Đầu tư(Mới),Phu Dong Group,Hồ Chí Minh,Lương: 11 Tr - 15 Tr VND,16-10-2025,16-11-2025,https://careerviet.vn/vi/tim-viec-lam/chuyen-vien-phap-ly-dau-tu.35C5B822.html
35C5B824,Trưởng phòng Kỹ thuật công nghệ(Mới),Công ty CP Thành Thành Công - Biên Hòa,Tây Ninh,Lương: Cạnh Tranh,16-10-2025,16-11-2025,https://careerviet.vn/vi/tim-viec-lam/truong-phong-ky-thuat-cong-nghe.35C5B824.html
35C5B823,Đắk Nông - Chuyên viên Thẩm định giá(Mới),Ngân hàng TMCP Lộc Phát Việt Nam (LPBank),Dak Nông,Lương: Cạnh Tranh,16-10-2025,14-12-2025,https://careerviet.vn/vi/tim-viec-lam/dak-nong-chuyen-vien-tham-dinh-gia.35C5B823.html
35C565E2,Kỹ sư dự toán Cơ điện,Công Ty Cổ Phần ZME,Hà Nội,Lương: 15 Tr - 20 Tr VND,16-10-2025,08-11-2025,https://careerviet.vn/vi/tim-viec-lam/ky-su-du-toan-co-dien.35C565E2.html
35C5B81A,Trưởng ban pháp chế(Mới),CÔNG TY CỔ PHẦN THƯƠNG MẠI VÀ XUẤT NHẬP KHẨU VẬT TƯ GIAO THÔNG,Hà Nội,Lương: 30 Tr - 50 Tr VND,16-10-2025,30-11-2025,https://careerviet.vn/vi/tim-viec-lam/truong-ban-phap-che.35C5B81A.html
35C5B820,Điều phối Dự án MEP(Mới),Công Ty Cổ Phần ZME,Hà Nội,Lương: 30 Tr - 35 Tr VND,16-10-2025,30-11-2025,https://careerviet.vn/vi/tim-viec-lam/dieu-phoi-du-an-mep.35C5B820.html
35C5B821,Trưởng Line Retort(Mới),Công ty CP Thành Thành Công - Biên Hòa,Tây Ninh,Lương: Cạnh Tranh,16-10-2025,16-11-2025,https://careerviet.vn/vi/tim-viec-lam/truong-line-retort.35C5B821.html
35C5B81E,Tổ trưởng Bảo trì(Mới),Công ty CP Thành Thành Công - Biên Hòa,Tây Ninh,Lương: Cạnh Tranh,16-10-2025,16-11-2025,https://careerviet.vn/vi/tim-viec-lam/to-truong-bao-tri.35C5B81E.html
35C5B81D,Trưởng phòng Chính sách Hệ thống(Mới),Bảo mật,Hà Nội,Lương: 35 Tr - 45 Tr VND,16-10-2025,20-11-2025,https://careerviet.vn/vi/tim-viec-lam/truong-phong-chinh-sach-he-thong.35C5B81D.html
35C5B81C,Thủ kho(Mới),CÔNG TY CỔ PHẦN THƯƠNG MẠI DỊCH VỤ XÂY DỰNG E&C,Hồ Chí Minh,Lương: 10 Tr - 14 Tr VND,16-10-2025,16-11-2025,https://careerviet.vn/vi/tim-viec-lam/thu-kho.35C5B81C.html
35C5B815,IT Helpdesk(Mới),CÔNG TY LITTLE GARDEN - LG CLINIC,Hồ Chí Minh,Lương: 15 Tr - 20 Tr VND,16-10-2025,15-11-2025,https://careerviet.vn/vi/tim-viec-lam/it-helpdesk.35C5B815.html
35C5B817,Nhân viên duyệt màu (Kiểm tra màu)(Mới),Công Ty TNHH Transtech Việt Nam,Đồng Nai,Lương: 9 Tr - 15 Tr VND,16-10-2025,30-11-2025,https://careerviet.vn/vi/tim-viec-lam/nhan-vien-duyet-mau-kiem-tra-mau.35C5B817.html
35C5B816,Sales Supervisor (MT Channel)(Mới),Công ty CP Thành Thành Công - Biên Hòa,Hồ Chí Minh,Lương: Cạnh Tranh,16-10-2025,16-11-2025,https://careerviet.vn/vi/tim-viec-lam/sales-supervisor-mt-channel.35C5B816.html
35C57861,Supply Chain Director (Retail),CÔNG TY CỔ PHẦN KING FOOD MARKET,Hồ Chí Minh,Lương: Cạnh Tranh,16-10-2025,Hôm nay,https://careerviet.vn/vi/tim-viec-lam/supply-chain-director-retail.35C57861.html
35C5B49A,Trưởng Phòng Thương Hiệu (Brand Manager)(Mới),Công ty CP Phát Triển Hùng Hậu,Hồ Chí Minh,Lương: Cạnh Tranh,16-10-2025,30-11-2025,https://careerviet.vn/vi/tim-viec-lam/truong-phong-thuong-hieu-brand-manager.35C5B49A.html
35C569B3,Giám Sát MEP,ERAS GROUP,Bình Thuận,Lương: Cạnh Tranh,16-10-2025,09-11-2025,https://careerviet.vn/vi/tim-viec-lam/giam-sat-mep.35C569B3.html
35C580CC,"[Nam Từ Liêm, Hà Nội] Nhân Viên Bán Hàng/Kinh Doanh Kênh Truyền Thống (GT)",Coca-Cola Beverages Vietnam,Hà Nội,Lương: 10 Tr - 15 Tr VND,16-10-2025,31-10-2025,https://careerviet.vn/vi/tim-viec-lam/nam-tu-liem-ha-noi-nhan-vien-ban-hang-kinh-doanh-kenh-truyen-thong-gt.35C580CC.html
35C5AD82,"NHÂN VIÊN THIẾT KẾ NỘI THẤT (THIẾT KẾ, TRIỂN KHAI 2D, 3D)",Công Ty TNHH Thương Mại Trang Trí Nội Thất Thành Vinh,Hồ Chí Minh,Lương: 12 Tr - 18 Tr VND,16-10-2025,10-11-2025,https://careerviet.vn/vi/tim-viec-lam/nhan-vien-thiet-ke-noi-that-thiet-ke-trien-khai-2d-3d.35C5AD82.html
35C599E5,Nhân Viên Tư Vấn Spa,CÔNG TY TNHH ĐẦU TƯ VÀ PHÁT TRIỂN DƯỠNG VIỆT NAM,Hà Nội Hồ Chí Minh,Lương: Trên 20 Tr VND,16-10-2025,01-11-2025,https://careerviet.vn/vi/tim-viec-lam/nhan-vien-tu-van-spa.35C599E5.html
35C53427,NHÂN VIÊN QAQC - LÀM VIỆC TẠI ĐÀ LẠT - GẤP,Công Ty TNHH Xây Dựng và Nội Thất Cao Cấp Alliance,Hồ Chí Minh Lâm Đồng,Lương: Cạnh Tranh,16-10-2025,13-11-2025,https://careerviet.vn/vi/tim-viec-lam/nhan-vien-qaqc-lam-viec-tai-da-lat-gap.35C53427.html
35C57FBB,Thực tập sinh bán hàng  - Nam Định,NANOCO GROUP,Nam Định,Lương: Cạnh Tranh,16-10-2025,1,https://careerviet.vn/vi/tim-viec-lam/thuc-tap-sinh-ban-hang-nam-dinh.35C57FBB.html
35C58F37,"[Gia Lâm, Hà Nội] Nhân Viên Bán Hàng/Kinh Doanh Kênh Truyền Thống (GT)",Coca-Cola Beverages Vietnam,Hà Nội,Lương: 10 Tr - 15 Tr VND,16-10-2025,31-10-2025,https://careerviet.vn/vi/tim-viec-lam/gia-lam-ha-noi-nhan-vien-ban-hang-kinh-doanh-kenh-truyen-thong-gt.35C58F37.html
35C56EB3,[Hòa Bình] Giám Sát Bán Hàng,Coca-Cola Beverages Vietnam,Hưng Yên,Lương: Cạnh Tranh,16-10-2025,10-11-2025,https://careerviet.vn/vi/tim-viec-lam/hoa-binh-giam-sat-ban-hang.35C56EB3.html
35C54B8A,[Trà Vinh] Nhân Viên Bán Hàng/Kinh Doanh - Kênh Sỉ,Coca-Cola Beverages Vietnam,Trà Vinh,Lương: Cạnh Tranh,16-10-2025,25-10-2025,https://careerviet.vn/vi/tim-viec-lam/tra-vinh-nhan-vien-ban-hang-kinh-doanh-kenh-si.35C54B8A.html
35C599E5,Nhân Viên Tư Vấn Spa,CÔNG TY TNHH ĐẦU TƯ VÀ PHÁT TRIỂN DƯỠNG VIỆT NAM,Hà Nội Hồ Chí Minh,Lương: Trên 20 Tr VND,16-10-2025,01-11-2025,https://careerviet.vn/vi/tim-viec-lam/nhan-vien-tu-van-spa.35C599E5.html
35C599E5,Nhân Viên Tư Vấn Spa,CÔNG TY TNHH ĐẦU TƯ VÀ PHÁT TRIỂN DƯỠNG VIỆT NAM,Hà Nội Hồ Chí Minh,Lương: Trên 20 Tr VND,16-10-2025,01-11-2025,https://careerviet.vn/vi/tim-viec-lam/nhan-vien-tu-van-spa.35C599E5.html
35C53427,NHÂN VIÊN QAQC - LÀM VIỆC TẠI ĐÀ LẠT - GẤP,Công Ty TNHH Xây Dựng và Nội Thất Cao Cấp Alliance,Hồ Chí Minh Lâm Đồng,Lương: Cạnh tranh,16-10-2025,13-11-2025,https://careerviet.vn/vi/tim-viec-lam/nhan-vien-qaqc-lam-viec-tai-da-lat-gap.35C53427.html
