ID,Tên công việc,Tên công ty,Nơi làm việc,Mức lương,Ngày đăng tin,Ngày hết hạn,Link
35C57304,Chuyên Viên Đào Tạo Và Phát Triển Chương Trình,Công Ty CP Quản Lý Giáo Dục Và Đầu Tư E M G,Hồ Chí Minh,Lương: Cạnh Tranh,16-10-2025,11-11-2025,https://careerviet.vn/vi/tim-viec-lam/chuyen-vien-dao-tao-va-phat-trien-chuong-trinh.35C57304.html
35C523A9,Nhân viên xúc tiến đầu tư Tiếng Hàn (Sale IA),CÔNG TY TNHH RSQUARE VIỆT NAM,Hồ Chí Minh,Lương: 10 Tr - 15 Tr VND,16-10-2025,05-11-2025,https://careerviet.vn/vi/tim-viec-lam/nhan-vien-xuc-tien-dau-tu-tieng-han-sale-ia.35C523A9.html
35C4FD04,Kế toán trưởng,Công ty TNHH Phát triển Công nghệ BATCO Việt Nam,Hà Nội,Lương: 18 Tr - 25 Tr VND,16-10-2025,4,https://careerviet.vn/vi/tim-viec-lam/ke-toan-truong.35C4FD04.html
35C54355,Chuyên Viên Quan Hệ Khách Hàng Cá Nhân/Doanh Nghiệp,Ngân hàng TMCP Phát triển TP.HCM (HDBank),Hải Phòng Hải Dương Bắc Ninh,Lương: Cạnh Tranh,16-10-2025,6,https://careerviet.vn/vi/tim-viec-lam/chuyen-vien-quan-he-khach-hang-ca-nhan-doanh-nghiep.35C54355.html
35C54313,Nhân viên Tư vấn tuyển sinh / Educational Consultant,CÔNG TY CỔ PHẦN CÔNG NGHỆ PREP,Hà Nội,Lương: 18 Tr - 30 Tr VND,16-10-2025,6,https://careerviet.vn/vi/tim-viec-lam/nhan-vien-tu-van-tuyen-sinh-educational-consultant.35C54313.html
35C5641B,Giám sát thi công nội thất,Công Ty TNHH Thương Mại Dịch Vụ Trí Lực Việt,Hà Nội,Lương: Cạnh Tranh,16-10-2025,09-11-2025,https://careerviet.vn/vi/tim-viec-lam/giam-sat-thi-cong-noi-that.35C5641B.html
35C53BFA,[Tuyển gấp] Chuyên viên kinh doanh thị trường - Khung trần Vĩnh Tường + Tấm xi măng DuraFlex,Bảo mật,Gia Lai,Lương: Cạnh Tranh,16-10-2025,3,https://careerviet.vn/vi/tim-viec-lam/tuyen-gap-chuyen-vien-kinh-doanh-thi-truong-khung-tran-vinh-tuong-tam-xi-mang-duraflex.35C53BFA.html
35C5303C,Nhân Viên Kỹ Thuật Vận Hành,CÔNG TY CỔ PHẦN EUROWINDOW HOLDING,Hà Nội,Lương: Cạnh Tranh,16-10-2025,11-11-2025,https://careerviet.vn/vi/tim-viec-lam/nhan-vien-ky-thuat-van-hanh.35C5303C.html
35C53366,Chuyên viên Báo cáo thống kê - QLTC - MSB - 3K019,Ngân hàng Thương mại Cổ phần Hàng Hải Việt Nam (MSB),Hà Nội,Lương: 12 Tr - 16 Tr VND,16-10-2025,12-11-2025,https://careerviet.vn/vi/tim-viec-lam/chuyen-vien-bao-cao-thong-ke-qltc-msb-3k019.35C53366.html
35C5264D,Trưởng Nhóm Kinh Doanh,Công ty Cổ phần Hóa dầu và Thiết bị Công nghiệp Hà Nội,Hà Nội,Lương: 15 Tr - 20 Tr VND,16-10-2025,06-11-2025,https://careerviet.vn/vi/tim-viec-lam/truong-nhom-kinh-doanh.35C5264D.html
35C56366,Trưởng Phòng Marketing,CÔNG TY TNHH CÔNG NGHỆ ĐIỆN TỬ BVT VIỆT NAM,Long An,Lương: 18 Tr - 20 Tr VND,16-10-2025,07-11-2025,https://careerviet.vn/vi/tim-viec-lam/truong-phong-marketing.35C56366.html
35C56F76,Kỹ sư bán hàng (Sales Account Manager),CÔNG TY CỔ PHẦN TƯ VẤN VÀ DỊCH VỤ CÔNG NGHỆ ASIC,Hà Nội,"Lương: 1,000 - 2,000 USD",16-10-2025,10-11-2025,https://careerviet.vn/vi/tim-viec-lam/ky-su-ban-hang-sales-account-manager.35C56F76.html
35C5366E,SEO Manager,CÔNG TY TNHH TK MEDIA,Hà Nội Đà Nẵng Hồ Chí Minh,Lương: 16 Tr - 20 Tr VND,16-10-2025,14-11-2025,https://careerviet.vn/vi/tim-viec-lam/seo-manager.35C5366E.html
35C53C6E,Trưởng nhóm thiết kế cơ điện,GTEL ICT,Hà Nội,Lương: 20 Tr - 25 Tr VND,16-10-2025,3,https://careerviet.vn/vi/tim-viec-lam/truong-nhom-thiet-ke-co-dien.35C53C6E.html
35C523A8,CAD Garment / Nhân viên kỹ thuật CAD,Công Ty TNHH MTV Jordan Manufacturing Việt Nam,Long An,Lương: Cạnh Tranh,16-10-2025,05-11-2025,https://careerviet.vn/vi/tim-viec-lam/cad-garment-nhan-vien-ky-thuat-cad.35C523A8.html
35C52345,Nhân viên bán hàng,CÔNG TY TNHH THƯƠNG MẠI KỸ THUẬT DỊCH VỤ Ý THIÊN,Bình Dương,Lương: Cạnh Tranh,16-10-2025,05-11-2025,https://careerviet.vn/vi/tim-viec-lam/nhan-vien-ban-hang.35C52345.html
35C52566,Nhân viên Dự Toán/ Kỹ Sư Dự Toán,CÔNG TY TNHH THƯƠNG MẠI XÂY DỰNG ĐOÀN LỰC,Hồ Chí Minh,Lương: 14 Tr - 16 Tr VND,16-10-2025,06-11-2025,https://careerviet.vn/vi/tim-viec-lam/nhan-vien-du-toan-ky-su-du-toan.35C52566.html
35C542BC,Giám Sát Thi Công Cơ Điện,CÔNG TY CỔ PHẦN ĐẦU TƯ XÂY DỰNG - FACCO,Hà Nội Hưng Yên Bắc Giang,Lương: 20 Tr - 30 Tr VND,16-10-2025,5,https://careerviet.vn/vi/tim-viec-lam/giam-sat-thi-cong-co-dien.35C542BC.html
35C5B7DD,Kỹ thuật viên Cơ Khí (CN Nặng)(Mới),"ADC PLASTIC,. JSC",Hưng Yên,"Lương: 10,5 Tr - 16,5 Tr VND",16-10-2025,31-12-2025,https://careerviet.vn/vi/tim-viec-lam/ky-thuat-vien-co-khi-cn-nang.35C5B7DD.html
35C5B7DB,NHÂN VIÊN IT (SYSTEM ENGINEER) TẠI CỦ CHI(Mới),CÔNG TY CP SAIGON AUTO SUPPORTING INDUSTRY,Hồ Chí Minh,Lương: Cạnh Tranh,16-10-2025,16-11-2025,https://careerviet.vn/vi/tim-viec-lam/nhan-vien-it-system-engineer-tai-cu-chi.35C5B7DB.html
35C5B7DA,NHÂN VIÊN KINH DOANH TẠI KHÁNH HÒA - NGÀNH HÀNG SỮA OATSIDE(Mới),CÔNG TY TNHH THƯƠNG MẠI TỔNG HỢP TUẤN VIỆT,Khánh Hòa,Lương: 12 Tr - 18 Tr VND,16-10-2025,30-11-2025,https://careerviet.vn/vi/tim-viec-lam/nhan-vien-kinh-doanh-tai-khanh-hoa-nganh-hang-sua-oatside.35C5B7DA.html
35C5B7D9,Regional Sales Manager (RSM) – Kênh Bình 19–20L(Mới),CÔNG TY CỔ PHẦN THƯƠNG MẠI SATORI,Hồ Chí Minh,Lương: 20 Tr - 50 Tr VND,16-10-2025,31-10-2025,https://careerviet.vn/vi/tim-viec-lam/regional-sales-manager-rsm-kenh-binh-19-20l.35C5B7D9.html
35C53764,Thủ kho,Công ty Cổ phần Đồng phục Phương Thảo,Hà Nội,Lương: 12 Tr - 15 Tr VND,16-10-2025,14-11-2025,https://careerviet.vn/vi/tim-viec-lam/thu-kho.35C53764.html
35C4F4B0,Quản lý sản xuất cơ khí,CÔNG TY TNHH SẢN XUẤT THIẾT BỊ CÔNG NGHIỆP THIÊN NAM,Hồ Chí Minh,Lương: 20 Tr - 25 Tr VND,16-10-2025,14-11-2025,https://careerviet.vn/vi/tim-viec-lam/quan-ly-san-xuat-co-khi.35C4F4B0.html
35C53297,Kỹ Sư Cơ Điện,Công Ty TNHH Quản Lý Xây Dựng ITC,Hồ Chí Minh,Lương: Trên 13 Tr VND,16-10-2025,14-11-2025,https://careerviet.vn/vi/tim-viec-lam/ky-su-co-dien.35C53297.html
35C53296,Kiến Trúc Sư/Architect,Công Ty TNHH Quản Lý Xây Dựng ITC,Hồ Chí Minh,Lương: Trên 8 Tr VND,16-10-2025,14-11-2025,https://careerviet.vn/vi/tim-viec-lam/kien-truc-su-architect.35C53296.html
35C53298,Kỹ sư giám sát công trình (Xây dựng dân dụng),Công Ty TNHH Quản Lý Xây Dựng ITC,Hồ Chí Minh,Lương: Trên 13 Tr VND,16-10-2025,14-11-2025,https://careerviet.vn/vi/tim-viec-lam/ky-su-giam-sat-cong-trinh-xay-dung-dan-dung.35C53298.html
35C5365F,Sales Engineer,Công ty TNHH Thương Mại & Dịch Vụ Công Nghiệp Hoàng Nam,Hồ Chí Minh,Lương: 10 Tr - 20 Tr VND,16-10-2025,14-11-2025,https://careerviet.vn/vi/tim-viec-lam/sales-engineer.35C5365F.html
35C536E9,Nhân Viên Điện Công Trình,CÔNG TY TNHH SURMAN VIỆT NAM,Đồng Nai,Lương: Trên 13 Tr VND,16-10-2025,14-11-2025,https://careerviet.vn/vi/tim-viec-lam/nhan-vien-dien-cong-trinh.35C536E9.html
35C5374A,[Đồng Nai] Sales Trainee,INSEE,Đồng Nai,Lương: Cạnh Tranh,16-10-2025,14-11-2025,https://careerviet.vn/vi/tim-viec-lam/dong-nai-sales-trainee.35C5374A.html
35C536CA,Phiên dịch hiện trường (tiếng Trung),CÔNG TY CỔ PHẦN XÂY DỰNG VÀ CƠ KHÍ DELTA E&C,Hà Nam,Lương: 15 Tr - 20 Tr VND,16-10-2025,14-11-2025,https://careerviet.vn/vi/tim-viec-lam/phien-dich-hien-truong-tieng-trung.35C536CA.html
35C536CA,Phiên dịch hiện trường (tiếng Trung),CÔNG TY CỔ PHẦN XÂY DỰNG VÀ CƠ KHÍ DELTA E&C,Hà Nam,Lương: 15 Tr - 20 Tr VND,16-10-2025,14-11-2025,https://careerviet.vn/vi/tim-viec-lam/phien-dich-hien-truong-tieng-trung.35C536CA.html
35C536BF,Giám sát Vệ sinh Công nghiệp - HCM,Công Ty Cổ Phần Dịch Vụ Nhà Sạch,Hồ Chí Minh,Lương: 8 Tr - 10 Tr VND,16-10-2025,14-11-2025,https://careerviet.vn/vi/tim-viec-lam/giam-sat-ve-sinh-cong-nghiep-hcm.35C536BF.html
35C53718,Sale Engineer/ Kỹ sư Bán hàng - MIỀN BẮC- Hà Nội,RAWLPLUG VIETNAM COMPANY LIMITED,Hà Nội,Lương: Cạnh tranh,16-10-2025,14-11-2025,https://careerviet.vn/vi/tim-viec-lam/sale-engineer-ky-su-ban-hang-mien-bac-ha-noi.35C53718.html
35C536F2,Nhân Viên Thủ Kho,Công Ty Cổ Phần Nhựa An Phát Xanh,Hải Dương,Lương: 8 Tr - 10 Tr VND,16-10-2025,14-11-2025,https://careerviet.vn/vi/tim-viec-lam/nhan-vien-thu-kho.35C536F2.html
35C53715,Executive Assistant,CareerViet's client,Đồng Nai,Lương: 15 Tr - 25 Tr VND,16-10-2025,14-11-2025,https://careerviet.vn/vi/tim-viec-lam/executive-assistant.35C53715.html
35C536E0,Chuyên viên/Trưởng nhóm Kinh doanh (Sơ cấp và Chuyển nhượng),VINHOMES - Tập đoàn Vingroup,Hà Nội,Lương: Cạnh tranh,16-10-2025,14-11-2025,https://careerviet.vn/vi/tim-viec-lam/chuyen-vien-truong-nhom-kinh-doanh-so-cap-va-chuyen-nhuong.35C536E0.html
35C5371F,"Chuyên viên chính Giám sát, Kiểm tra và Cơ cấu tín dụng Khách hàng Doanh nghiệp vừa và nhỏ",Ngân Hàng TMCP Tiên Phong (TPBank),Hà Nội,Lương: Cạnh tranh,16-10-2025,14-11-2025,https://careerviet.vn/vi/tim-viec-lam/chuyen-vien-chinh-giam-sat-kiem-tra-va-co-cau-tin-dung-khach-hang-doanh-nghiep-vua-va-nho.35C5371F.html
35C5375A,[Nova Hotels & Resorts World] Kế Toán Thanh Toán - Phải Trả,Nova Hotels & Resorts World,Hồ Chí Minh,Lương: Cạnh tranh,16-10-2025,14-11-2025,https://careerviet.vn/vi/tim-viec-lam/nova-hotels-resorts-world-ke-toan-thanh-toan-phai-tra.35C5375A.html
35C53759,[Nova Hotels & Resorts World] Kế Toán Tổng Hợp,Nova Hotels & Resorts World,Hồ Chí Minh,Lương: Cạnh tranh,16-10-2025,14-11-2025,https://careerviet.vn/vi/tim-viec-lam/nova-hotels-resorts-world-ke-toan-tong-hop.35C53759.html
35C536F0,Nhân Viên Quy Trình Sản Xuất Nhuộm,CT CP Tập Đoàn Thái Tuấn,Long An,Lương: 7 Tr - 11 Tr VND,16-10-2025,14-11-2025,https://careerviet.vn/vi/tim-viec-lam/nhan-vien-quy-trinh-san-xuat-nhuom.35C536F0.html
35C53722,Medical Sales Representative (HCM),DIAG,Hồ Chí Minh,Lương: Cạnh tranh,16-10-2025,14-11-2025,https://careerviet.vn/vi/tim-viec-lam/medical-sales-representative-hcm.35C53722.html
35C53755,Nhân Viên Kế Hoạch Sản Xuất Kiêm Kế Toán Xưởng,CÔNG TY TNHH DRAHO VIỆT NAM,Hà Nội,Lương: 12 Tr - 15 Tr VND,16-10-2025,14-11-2025,https://careerviet.vn/vi/tim-viec-lam/nhan-vien-ke-hoach-san-xuat-kiem-ke-toan-xuong.35C53755.html
35C536E1,Nhân viên Business Analyst có kinh nghiệm HIS,BỆNH VIỆN ĐA KHOA PHƯƠNG ĐÔNG,Hà Nội,Lương: 10 Tr - 25 Tr VND,16-10-2025,14-11-2025,https://careerviet.vn/vi/tim-viec-lam/nhan-vien-business-analyst-co-kinh-nghiem-his.35C536E1.html
35C536F8,Nhân Viên Kinh Doanh Thiết Bị Xử Lý Nước Thải,CÔNG TY TNHH SẢN XUẤT CÔNG NGHIỆP TIẾN HƯNG,Hồ Chí Minh,Lương: Cạnh tranh,16-10-2025,14-11-2025,https://careerviet.vn/vi/tim-viec-lam/nhan-vien-kinh-doanh-thiet-bi-xu-ly-nuoc-thai.35C536F8.html
35C536D9,Bác sĩ Ngoại tiết niệu,Bệnh viện đa khoa Hoàn Hảo (Hoàn Hảo KeiMeiKai),Hồ Chí Minh,Lương: Cạnh tranh,16-10-2025,14-11-2025,https://careerviet.vn/vi/tim-viec-lam/bac-si-ngoai-tiet-nieu.35C536D9.html
35C53753,Trưởng nhóm Đào tạo và phát triển nhân tài,Tập Đoàn Karofi Holding,Hà Nội,Lương: Cạnh tranh,16-10-2025,14-11-2025,https://careerviet.vn/vi/tim-viec-lam/truong-nhom-dao-tao-va-phat-trien-nhan-tai.35C53753.html
35C536E2,Quản trị hệ thống System Admin,CTy TNHH Phần Mềm Nhân Hòa,Hà Nội,Lương: 15 Tr - 25 Tr VND,16-10-2025,14-11-2025,https://careerviet.vn/vi/tim-viec-lam/quan-tri-he-thong-system-admin.35C536E2.html
35C53703,CHUYÊN VIÊN ĐÀO TẠO / FIELD TRAINER,Công Ty Cổ Phần Tầm Nhìn Quốc Tế Aladdin,Hồ Chí Minh,Lương: Cạnh tranh,16-10-2025,14-11-2025,https://careerviet.vn/vi/tim-viec-lam/chuyen-vien-dao-tao-field-trainer.35C53703.html
35C53758,Chuyên Viên Quan Hệ Khách Hàng Doanh Nghiệp  - Chi Nhánh Đồng Nai,Indovina Bank Ltd.,Đồng Nai,Lương: Cạnh tranh,16-10-2025,14-11-2025,https://careerviet.vn/vi/tim-viec-lam/chuyen-vien-quan-he-khach-hang-doanh-nghiep-chi-nhanh-dong-nai.35C53758.html
35C536D6,Kế Toán Tổng Hợp,CÔNG TY CỔ PHẦN XUẤT NHẬP KHẨU MQ,Hồ Chí Minh,Lương: Trên 12 Tr VND,16-10-2025,14-11-2025,https://careerviet.vn/vi/tim-viec-lam/ke-toan-tong-hop.35C536D6.html
35C53733,Quality Engineer - PCBA,CÔNG TY TNHH COMPUTIME (VIỆT NAM),Bình Dương,Lương: Cạnh Tranh,16-10-2025,14-11-2025,https://careerviet.vn/vi/tim-viec-lam/quality-engineer-pcba.35C53733.html
35C536D8,Chuyên Viên Booking KOL/KOC,CÔNG TY TNHH THƯƠNG MẠI QUỐC TẾ NASI VIỆT NAM,Hồ Chí Minh,Lương: 10 Tr - 20 Tr VND,16-10-2025,14-11-2025,https://careerviet.vn/vi/tim-viec-lam/chuyen-vien-booking-kol-koc.35C536D8.html
35C5375C,[BIÊN HÒA] QUẢN LÝ NHÀ HÀNG,Công Ty Cổ Phần Tầm Nhìn Quốc Tế Aladdin,Đồng Nai,Lương: 15 Tr - 20 Tr VND,16-10-2025,14-11-2025,https://careerviet.vn/vi/tim-viec-lam/bien-hoa-quan-ly-nha-hang.35C5375C.html
35C5371E,Trưởng phòng Digital Marketing,Công ty TNHH PNK,Hà Nội,Lương: 20 Tr - 25 Tr VND,16-10-2025,14-11-2025,https://careerviet.vn/vi/tim-viec-lam/truong-phong-digital-marketing.35C5371E.html
35C5370D,QUẢN LÍ SẢN XUẤT - DÂY CHUYỀN NHUỘM SỢI,"Kyungbang Vietnam CO., LTD",Bình Dương,Lương: 10 Tr - 20 Tr VND,16-10-2025,14-11-2025,https://careerviet.vn/vi/tim-viec-lam/quan-li-san-xuat-day-chuyen-nhuom-soi.35C5370D.html
35C53748,Chuyên Viên Kế Toán Doanh Thu Công Nợ,Công ty TNHH Thương Mại VHC,Hà Nội,Lương: 9 Tr - 11 Tr VND,16-10-2025,14-11-2025,https://careerviet.vn/vi/tim-viec-lam/chuyen-vien-ke-toan-doanh-thu-cong-no.35C53748.html
35C536DC,Bác sĩ siêu âm,Bệnh viện đa khoa Hoàn Hảo (Hoàn Hảo KeiMeiKai),Hồ Chí Minh,Lương: Cạnh Tranh,16-10-2025,14-11-2025,https://careerviet.vn/vi/tim-viec-lam/bac-si-sieu-am.35C536DC.html
35C536E4,Kế toán Kho Sài Gòn,Công ty TNHH Dịch Vụ Quốc Tế Bắc Nam,Hồ Chí Minh,Lương: 8 Tr - 10 Tr VND,16-10-2025,14-11-2025,https://careerviet.vn/vi/tim-viec-lam/ke-toan-kho-sai-gon.35C536E4.html
35C536E7,Nhân Viên Thiết Kế Đồ Họa_Graphic Designer (Tại Gần Sân Bay Nội Bài),Công ty TNHH Dịch Vụ Quốc Tế Bắc Nam,Hà Nội,Lương: 8 Tr - 12 Tr VND,16-10-2025,14-11-2025,https://careerviet.vn/vi/tim-viec-lam/nhan-vien-thiet-ke-do-hoa_graphic-designer-tai-gan-san-bay-noi-bai.35C536E7.html
35C536D7,Bác sĩ Chẩn đoán hình ảnh,Bệnh viện đa khoa Hoàn Hảo (Hoàn Hảo KeiMeiKai),Hồ Chí Minh,Lương: Cạnh Tranh,16-10-2025,14-11-2025,https://careerviet.vn/vi/tim-viec-lam/bac-si-chan-doan-hinh-anh.35C536D7.html
35C536EA,Nhân viên chăm sóc khách hàng Cearline (Page),Công ty TNHH Dịch Vụ Quốc Tế Bắc Nam,Hà Nội,Lương: 7 Tr - 9 Tr VND,16-10-2025,14-11-2025,https://careerviet.vn/vi/tim-viec-lam/nhan-vien-cham-soc-khach-hang-cearline-page.35C536EA.html
35C53711,KẾ TOÁN TỔNG HỢP-QUẢN TRỊ NỘI BỘ,Công Ty TNHH Hiệp Long,Bình Dương,Lương: 17 Tr - 22 Tr VND,16-10-2025,14-11-2025,https://careerviet.vn/vi/tim-viec-lam/ke-toan-tong-hop-quan-tri-noi-bo.35C53711.html
35C53716,NHÂN VIÊN THIẾT KẾ ĐỒ GỖ,Công Ty TNHH Hiệp Long,Bình Dương,Lương: Cạnh Tranh,16-10-2025,14-11-2025,https://careerviet.vn/vi/tim-viec-lam/nhan-vien-thiet-ke-do-go.35C53716.html
35C536F7,Nhân Viên Kinh Doanh Thiết Bị Xử Lý Nước Thải,CÔNG TY TNHH SẢN XUẤT CÔNG NGHIỆP TIẾN HƯNG,Hồ Chí Minh,Lương: Cạnh Tranh,16-10-2025,14-11-2025,https://careerviet.vn/vi/tim-viec-lam/nhan-vien-kinh-doanh-thiet-bi-xu-ly-nuoc-thai.35C536F7.html
35C53717,Nhân Viên Kinh Doanh,Công ty TNHH Di Đại Hưng,Hồ Chí Minh,Lương: 10 Tr - 20 Tr VND,16-10-2025,14-11-2025,https://careerviet.vn/vi/tim-viec-lam/nhan-vien-kinh-doanh.35C53717.html
35C536EC,Nhân viên chăm sóc khách hàng Ngân hàng Quân đội MB bank Không áp doanh số,BellSystem24-Việt Nam,Hà Nội,"Lương: 7,5 Tr - 9 Tr VND",16-10-2025,14-11-2025,https://careerviet.vn/vi/tim-viec-lam/nhan-vien-cham-soc-khach-hang-ngan-hang-quan-doi-mb-bank-khong-ap-doanh-so.35C536EC.html
35C5369D,Nhân viên hỗ trợ chất lượng (US Company),SAMTEC VIETNAM COMPANY LIMITED,Đồng Nai,Lương: Cạnh Tranh,16-10-2025,14-11-2025,https://careerviet.vn/vi/tim-viec-lam/nhan-vien-ho-tro-chat-luong-us-company.35C5369D.html
35C536DF,Chuyên viên Tuyển dụng Quốc tế - International Talent Acquisition Specialist,Tập Đoàn Karofi Holding,Hà Nội,"Lương: 750 - 1,200 USD",16-10-2025,14-11-2025,https://careerviet.vn/vi/tim-viec-lam/chuyen-vien-tuyen-dung-quoc-te-international-talent-acquisition-specialist.35C536DF.html
35C5371D,Chuyên viên tuyển dụng phòng nhân sự,Viện Thẩm mỹ y khoa Dr Hải Lê,Hà Nội,Lương: 10 Tr - 15 Tr VND,16-10-2025,14-11-2025,https://careerviet.vn/vi/tim-viec-lam/chuyen-vien-tuyen-dung-phong-nhan-su.35C5371D.html
35C536F9,Nhân Viên Kỹ Thuật,CÔNG TY TNHH SẢN XUẤT CÔNG NGHIỆP TIẾN HƯNG,Hồ Chí Minh,Lương: Cạnh Tranh,16-10-2025,14-11-2025,https://careerviet.vn/vi/tim-viec-lam/nhan-vien-ky-thuat.35C536F9.html
35C536AE,Nhân viên kinh tế xây dựng (Xây dựng dân dụng),Công Ty TNHH Quản Lý Xây Dựng ITC,Hồ Chí Minh,Lương: Trên 12 Tr VND,16-10-2025,14-11-2025,https://careerviet.vn/vi/tim-viec-lam/nhan-vien-kinh-te-xay-dung-xay-dung-dan-dung.35C536AE.html
35C536D0,Tuyển MC đi làm ngay,Viện Thẩm mỹ y khoa Dr Hải Lê,Hà Nội,Lương: 10 Tr - 14 Tr VND,16-10-2025,14-11-2025,https://careerviet.vn/vi/tim-viec-lam/tuyen-mc-di-lam-ngay.35C536D0.html
35C53707,Giám đốc Khối Tài chính Kế toán (chủ đầu tư),Tập Đoàn Tân Á Đại Thành,Hà Nội,Lương: Cạnh Tranh,16-10-2025,14-11-2025,https://careerviet.vn/vi/tim-viec-lam/giam-doc-khoi-tai-chinh-ke-toan-chu-dau-tu.35C53707.html
35C02D3B,PHÓ PHÒNG KỸ THUẬT,CÔNG TY CỔ PHẦN TẬP ĐOÀN KỸ THUẬT VÀ CÔNG NGHIỆP VIỆT NAM TẠI HỒ CHÍ MINH,Bình Dương,Lương: 16 Tr - 22 Tr VND,16-10-2025,14-11-2025,https://careerviet.vn/vi/tim-viec-lam/pho-phong-ky-thuat.35C02D3B.html
35C536C0,Nhân viên lái xe  (lái xe cho Sếp),Công ty Trách nhiệm hữu hạn Khoa học kỹ thuật và Dịch vụ Genome,Hà Nội,Lương: 11 Tr - 13 Tr VND,16-10-2025,14-11-2025,https://careerviet.vn/vi/tim-viec-lam/nhan-vien-lai-xe-lai-xe-cho-sep.35C536C0.html
35C536B1,Nhân Viên Tài Xế (Cashew BH2),Công ty TNHH Olam Việt Nam,Đồng Nai,Lương: Cạnh Tranh,16-10-2025,14-11-2025,https://careerviet.vn/vi/tim-viec-lam/nhan-vien-tai-xe-cashew-bh2.35C536B1.html
35C53732,Chuyên viên C&B,CÔNG TY LIÊN DOANH VẬN CHUYỂN QUỐC TẾ HẢI VÂN,Hà Nội,Lương: 12 Tr - 15 Tr VND,16-10-2025,14-11-2025,https://careerviet.vn/vi/tim-viec-lam/chuyen-vien-c-b.35C53732.html
35C536B4,Phụ trách Tài chính,Công Ty Cổ phần Quốc tế Thái Bình Dương,Hà Nội,Lương: 25 Tr - 35 Tr VND,16-10-2025,14-11-2025,https://careerviet.vn/vi/tim-viec-lam/phu-trach-tai-chinh.35C536B4.html
35C536B0,Chỉ Huy Công Trình Nội Thất,CÔNG TY CỔ PHẦN XÂY DỰNG VÀ THƯƠNG MẠI HQS,Hồ Chí Minh,Lương: Cạnh Tranh,16-10-2025,14-11-2025,https://careerviet.vn/vi/tim-viec-lam/chi-huy-cong-trinh-noi-that.35C536B0.html
35C536CC,Nhân Viên Kiểm Đếm (Kho Cảng),Công Ty TNHH Interflour Việt Nam,Bà Rịa - Vũng Tàu,Lương: Cạnh Tranh,16-10-2025,14-11-2025,https://careerviet.vn/vi/tim-viec-lam/nhan-vien-kiem-dem-kho-cang.35C536CC.html
35C57694,Nhân Viên Thanh Quyết Toán - Thu Nhập Hấp Dẫn,Công Ty Cổ Phần Eurowindow,Hà Nội,Lương: 15 Tr - 20 Tr VND,16-10-2025,14-11-2025,https://careerviet.vn/vi/tim-viec-lam/nhan-vien-thanh-quyet-toan-thu-nhap-hap-dan.35C57694.html
35C57694,Nhân Viên Thanh Quyết Toán - Thu Nhập Hấp Dẫn,Công Ty Cổ Phần Eurowindow,Hà Nội,Lương: 15 Tr - 20 Tr VND,16-10-2025,14-11-2025,https://careerviet.vn/vi/tim-viec-lam/nhan-vien-thanh-quyet-toan-thu-nhap-hap-dan.35C57694.html
35C5763F,Business Development,CÔNG TY CỔ PHẦN GREEN SPEED,Hồ Chí Minh,Lương: Cạnh tranh,16-10-2025,14-11-2025,https://careerviet.vn/vi/tim-viec-lam/business-development.35C5763F.html
35C57761,Marketing Automation Executive,CÔNG TY TNHH THỜI TRANG VÀ MỸ PHẨM ÂU CHÂU,Hồ Chí Minh,Lương: Cạnh tranh,16-10-2025,14-11-2025,https://careerviet.vn/vi/tim-viec-lam/marketing-automation-executive.35C57761.html
35C57637,Lái Xe Tải Lạnh 1.5T,CÔNG TY TNHH THỰC PHẨM CUỘC SỐNG,Hà Nội,Lương: 11 Tr - 12 Tr VND,16-10-2025,14-11-2025,https://careerviet.vn/vi/tim-viec-lam/lai-xe-tai-lanh-1-5t.35C57637.html
35C57658,"Nhân Viên Test, Tân Trang thiết bị Viettel Tại Cổ Nhuế, Bắc Từ Liêm, Hà Nội",CÔNG TY CỔ PHẦN TRUYỀN THÔNG KIM CƯƠNG,Hà Nội,Lương: 7 Tr - 10 Tr VND,16-10-2025,14-11-2025,https://careerviet.vn/vi/tim-viec-lam/nhan-vien-test-tan-trang-thiet-bi-viettel-tai-co-nhue-bac-tu-liem-ha-noi.35C57658.html
35C5754F,Văn Phòng Đại Diện Daesang Wellifie - Phiên dịch viên,CÔNG TY TNHH DAESANG VIỆT NAM,Hà Nội,Lương: Cạnh tranh,16-10-2025,14-11-2025,https://careerviet.vn/vi/tim-viec-lam/van-phong-dai-dien-daesang-wellifie-phien-dich-vien.35C5754F.html
35C57780,Maintenance Technician/Facilities Staff,CÔNG TY TNHH THAI CORP INTERNATIONAL (VIỆT NAM),Hồ Chí Minh,Lương: 7 Tr - 11 Tr VND,16-10-2025,14-11-2025,https://careerviet.vn/vi/tim-viec-lam/maintenance-technician-facilities-staff.35C57780.html
35C5769C,Kỹ Sư Xây Dựng Cầu Đường,CÔNG TY CỔ PHẦN IDC ĐÔNG DƯƠNG,Hồ Chí Minh,Lương: 17 Tr - 22 Tr VND,16-10-2025,14-11-2025,https://careerviet.vn/vi/tim-viec-lam/ky-su-xay-dung-cau-duong.35C5769C.html
35C57594,Chuyên viên An toàn lao động - ALPHANAM GROUP,Alphanam Group,Bạc Liêu KV Đông Nam Bộ,Lương: 22 Tr - 28 Tr VND,16-10-2025,14-11-2025,https://careerviet.vn/vi/tim-viec-lam/chuyen-vien-an-toan-lao-dong-alphanam-group.35C57594.html
35C57659,Giám sát Bán hàng tại Quảng Bình,CÔNG TY TNHH THƯƠNG MẠI TỔNG HỢP TUẤN VIỆT,Quảng Bình,Lương: 25 Tr - 35 Tr VND,16-10-2025,14-11-2025,https://careerviet.vn/vi/tim-viec-lam/giam-sat-ban-hang-tai-quang-binh.35C57659.html
35C5767A,Business Solution Executive (Transportation),ITL Freight Management,Hồ Chí Minh,Lương: Cạnh tranh,16-10-2025,14-11-2025,https://careerviet.vn/vi/tim-viec-lam/business-solution-executive-transportation.35C5767A.html
35C576BC,Kỹ sư embedded,TECOTEC Technology,Hà Nội,Lương: Trên 12 Tr VND,16-10-2025,14-11-2025,https://careerviet.vn/vi/tim-viec-lam/ky-su-embedded.35C576BC.html
35C575AF,Chuyên viên tài chính,CÔNG TY CỔ PHẦN ĐẦU TƯ BẤT ĐỘNG SẢN TOÀN CẦU,Hà Nội,Lương: Cạnh tranh,16-10-2025,14-11-2025,https://careerviet.vn/vi/tim-viec-lam/chuyen-vien-tai-chinh.35C575AF.html
35C575F1,Nhân viên vận hành máy dệt bo,Công ty Cổ phần Đồng phục Phương Thảo,Hà Nội,Lương: 7 Tr - 9 Tr VND,16-10-2025,14-11-2025,https://careerviet.vn/vi/tim-viec-lam/nhan-vien-van-hanh-may-det-bo.35C575F1.html
35C575CF,Trưởng phòng kinh doanh,CÔNG TY TNHH SẢN XUẤT XÂY DỰNG ÁNH DƯƠNG XANH,Hồ Chí Minh,Lương: 15 Tr - 25 Tr VND,16-10-2025,14-11-2025,https://careerviet.vn/vi/tim-viec-lam/truong-phong-kinh-doanh.35C575CF.html
35C5756C,Nhân Viên Kỹ Thuật Tòa Nhà,TỔNG CÔNG TY CỔ PHẦN THƯƠNG MẠI XÂY DỰNG,Hà Nội,Lương: 8 Tr - 11 Tr VND,16-10-2025,14-11-2025,https://careerviet.vn/vi/tim-viec-lam/nhan-vien-ky-thuat-toa-nha.35C5756C.html
35C5754E,Kế toán trưởng,TỔNG CÔNG TY CỔ PHẦN THƯƠNG MẠI XÂY DỰNG,Hà Nội,Lương: 30 Tr - 40 Tr VND,16-10-2025,14-11-2025,https://careerviet.vn/vi/tim-viec-lam/ke-toan-truong.35C5754E.html
35C5756F,"Nhân viên IT (Làm việc tại Hoà Khánh Tây, Đức Hoà, Long An)",Công ty cổ phần Nafoods Miền Nam,Long An,Lương: 9 Tr - 14 Tr VND,16-10-2025,14-11-2025,https://careerviet.vn/vi/tim-viec-lam/nhan-vien-it-lam-viec-tai-hoa-khanh-tay-duc-hoa-long-an.35C5756F.html
35C5775E,Nhân viên sản xuất,Levents Global,Hồ Chí Minh,Lương: Cạnh tranh,16-10-2025,14-11-2025,https://careerviet.vn/vi/tim-viec-lam/nhan-vien-san-xuat.35C5775E.html
35C5771C,中文翻译 Biên Phiên Dịch Tiếng Trung,Công Ty TNHH Tập Đoàn Rita Võ,Bình Dương,Lương: 10 Tr - 15 Tr VND,16-10-2025,14-11-2025,https://careerviet.vn/vi/tim-viec-lam/bien-phien-dich-tieng-trung.35C5771C.html
35C57656,"Nhân Viên Telesale Bán Gói Cước Viettel tại TP Vinh, Nghệ An",CÔNG TY CỔ PHẦN TRUYỀN THÔNG KIM CƯƠNG,Nghệ An,Lương: 7 Tr - 12 Tr VND,16-10-2025,14-11-2025,https://careerviet.vn/vi/tim-viec-lam/nhan-vien-telesale-ban-goi-cuoc-viettel-tai-tp-vinh-nghe-an.35C57656.html
35C57614,Trưởng bộ phận kho CFS và kho Ngoại quan,Công ty TNHH Khải Minh Group,Hải Phòng,Lương: 20 Tr - 25 Tr VND,16-10-2025,14-11-2025,https://careerviet.vn/vi/tim-viec-lam/truong-bo-phan-kho-cfs-va-kho-ngoai-quan.35C57614.html
35C57697,Cần Thơ - Chuyên viên Quan hệ Khách hàng Doanh nghiệp,Ngân hàng TMCP Lộc Phát Việt Nam (LPBank),Cần Thơ,Lương: Cạnh Tranh,16-10-2025,14-11-2025,https://careerviet.vn/vi/tim-viec-lam/can-tho-chuyen-vien-quan-he-khach-hang-doanh-nghiep.35C57697.html
35C575F2,Chuyên Viên Chuyển Đổi Số,Công Ty Tài Chính TNHH Một Thành Viên Quốc Tế Việt Nam JACCS,Hồ Chí Minh,Lương: 11 Tr - 17 Tr VND,16-10-2025,14-11-2025,https://careerviet.vn/vi/tim-viec-lam/chuyen-vien-chuyen-doi-so.35C575F2.html
