ID,Tên công việc,Tên công ty,Nơi làm việc,Mức lương,Ngày đăng tin,Ngày hết hạn,Link
35C582E1,Chuyên Viên Chính/Chuyên Viên Cao Cấp KHDN Vi Mô - Khu vực Miền Nam và Tây Nguyên,Ngân Hàng TMCP Việt Nam Thịnh Vượng - VPBANK,Dak Lak Long An Gia Lai,Lương: Cạnh tranh,10-10-2025,20-11-2025,https://careerviet.vn/vi/tim-viec-lam/chuyen-vien-chinh-chuyen-vien-cao-cap-khdn-vi-mo-khu-vuc-mien-nam-va-tay-nguyen.35C582E1.html
35C582E1,Chuyên Viên Chính/Chuyên Viên Cao Cấp KHDN Vi Mô - Khu vực Miền Nam và Tây Nguyên,Ngân Hàng TMCP Việt Nam Thịnh Vượng - VPBANK,Dak Lak Long An Gia Lai,Lương: Cạnh tranh,10-10-2025,20-11-2025,https://careerviet.vn/vi/tim-viec-lam/chuyen-vien-chinh-chuyen-vien-cao-cap-khdn-vi-mo-khu-vuc-mien-nam-va-tay-nguyen.35C582E1.html
35C581B1,Giám đốc Quan hệ Khách Hàng Ưu Tiên - Hà Nội,Ngân Hàng TMCP Quốc Dân (NCB),Hà Nội,Lương: Cạnh tranh,10-10-2025,19-10-2025,https://careerviet.vn/vi/tim-viec-lam/giam-doc-quan-he-khach-hang-uu-tien-ha-noi.35C581B1.html
35C582BF,[H3] NHÂN VIÊN TELESALE TÍN DỤNG NGÂN HÀNG QUỐC TẾ,BELLSYSTEM24 - CÔNG TY CỔ PHẦN BELLSYSTEM24 VIỆT NAM,Hồ Chí Minh,Lương: 10 Tr - 40 Tr VND,10-10-2025,31-10-2025,https://careerviet.vn/vi/tim-viec-lam/h3-nhan-vien-telesale-tin-dung-ngan-hang-quoc-te.35C582BF.html
35C581E7,Trưởng bộ phận Quản lý phân khúc AF - TA050,Ngân Hàng TMCP Việt Nam Thịnh Vượng - VPBANK,Hà Nội,Lương: Cạnh tranh,10-10-2025,31-10-2025,https://careerviet.vn/vi/tim-viec-lam/truong-bo-phan-quan-ly-phan-khuc-af-ta050.35C581E7.html
35C581FA,Chuyên viên Quản lý Chất lượng,Công Ty Cổ Phần Giải Pháp Thanh Toán Việt Nam (VNPAY),Hà Nội,Lương: Cạnh tranh,10-10-2025,31-10-2025,https://careerviet.vn/vi/tim-viec-lam/chuyen-vien-quan-ly-chat-luong.35C581FA.html
35C582DD,Chuyên Gia – Thúc Đẩy Kinh Doanh Tài Trợ Thương Mại,Ngân Hàng TMCP Việt Nam Thịnh Vượng - VPBANK,Hồ Chí Minh,Lương: Cạnh tranh,10-10-2025,19-10-2025,https://careerviet.vn/vi/tim-viec-lam/chuyen-gia-thuc-day-kinh-doanh-tai-tro-thuong-mai.35C582DD.html
35C58197,"[Hà Nội, Hồ Chí Minh]  Kỹ sư Điện -  Thiết kế & Giám sát Truyền tải điện (Dự án Solar Farm)",Tổng Công ty Cổ phần Công trình Viettel,Hà Nội Hồ Chí Minh,Lương: 25 Tr - 35 Tr VND,10-10-2025,Hôm nay,https://careerviet.vn/vi/tim-viec-lam/ha-noi-ho-chi-minh-ky-su-dien-thiet-ke-giam-sat-truyen-tai-dien-du-an-solar-farm.35C58197.html
35C582E3,Chuyên Viên Chính/Chuyên Viên Cao Cấp KHDN Vi Mô - Khu vực Miền Bắc,Ngân Hàng TMCP Việt Nam Thịnh Vượng - VPBANK,Quảng Ninh Hải Dương Hưng Yên,Lương: Cạnh tranh,10-10-2025,19-10-2025,https://careerviet.vn/vi/tim-viec-lam/chuyen-vien-chinh-chuyen-vien-cao-cap-khdn-vi-mo-khu-vuc-mien-bac.35C582E3.html
35C581F5,Nhân viên Quản lý sản phẩm (Product Owner),Công Ty Cổ Phần Giải Pháp Thanh Toán Việt Nam (VNPAY),Hà Nội,Lương: Cạnh tranh,10-10-2025,31-10-2025,https://careerviet.vn/vi/tim-viec-lam/nhan-vien-quan-ly-san-pham-product-owner.35C581F5.html
35C582CF,"Senior Expert, Distribution Administration (Reporting, Compensation & Payment)",NGÂN HÀNG TMCP KỸ THƯƠNG VIỆT NAM (TECHCOMBANK),Hà Nội,Lương: Cạnh tranh,10-10-2025,19-10-2025,https://careerviet.vn/vi/tim-viec-lam/senior-expert-distribution-administration-reporting-compensation-payment.35C582CF.html
35C58212,"[Hà Nội, Hồ Chí Minh]  Kỹ sư Điện -  Giám sát và lắp đặt thiết bị Solar Farm",Tổng Công ty Cổ phần Công trình Viettel,Hà Nội Hồ Chí Minh,Lương: 20 Tr - 30 Tr VND,10-10-2025,Hôm nay,https://careerviet.vn/vi/tim-viec-lam/ha-noi-ho-chi-minh-ky-su-dien-giam-sat-va-lap-dat-thiet-bi-solar-farm.35C58212.html
35C582C5,Chuyên Gia Thiết Kế Giải Pháp Số,NGÂN HÀNG TMCP NGOẠI THƯƠNG VIỆT NAM (VIETCOMBANK),Hà Nội,Lương: Cạnh tranh,10-10-2025,N/A,https://careerviet.vn/vi/tim-viec-lam/chuyen-gia-thiet-ke-giai-phap-so.35C582C5.html
35C582C1,Bình Định - Chuyên viên Quan hệ Khách hàng cá nhân,Ngân hàng TMCP Lộc Phát Việt Nam (LPBank),Bình Định,Lương: Cạnh tranh,10-10-2025,02-11-2025,https://careerviet.vn/vi/tim-viec-lam/binh-dinh-chuyen-vien-quan-he-khach-hang-ca-nhan.35C582C1.html
35C582CE,"Director, Distribution Planning (Techcom Life)",NGÂN HÀNG TMCP KỸ THƯƠNG VIỆT NAM (TECHCOMBANK),Hà Nội,Lương: Cạnh tranh,10-10-2025,19-10-2025,https://careerviet.vn/vi/tim-viec-lam/director-distribution-planning-techcom-life.35C582CE.html
35C582C7,Chuyên Viên  Sản Phẩm Thanh Toán,NGÂN HÀNG TMCP NGOẠI THƯƠNG VIỆT NAM (VIETCOMBANK),Hà Nội,Lương: Cạnh tranh,10-10-2025,N/A,https://careerviet.vn/vi/tim-viec-lam/chuyen-vien-san-pham-thanh-toan.35C582C7.html
35C581FE,Data Scientist,Công Ty Cổ Phần Giải Pháp Thanh Toán Việt Nam (VNPAY),Hà Nội,Lương: Cạnh tranh,10-10-2025,30-11-2025,https://careerviet.vn/vi/tim-viec-lam/data-scientist.35C581FE.html
35C58243,"[Hà Nội, Hồ Chí Minh] Chỉ huy trưởng công trường Solar Farm",Tổng Công ty Cổ phần Công trình Viettel,Hà Nội Hồ Chí Minh,Lương: 30 Tr - 35 Tr VND,10-10-2025,Hôm nay,https://careerviet.vn/vi/tim-viec-lam/ha-noi-ho-chi-minh-chi-huy-truong-cong-truong-solar-farm.35C58243.html
35C58200,Giám đốc Quan hệ Khách hàng Ưu tiên / Cá nhân - Khu vực Hồ Chí Minh,Ngân Hàng TMCP Quốc Dân (NCB),Hồ Chí Minh,Lương: Cạnh tranh,10-10-2025,19-10-2025,https://careerviet.vn/vi/tim-viec-lam/giam-doc-quan-he-khach-hang-uu-tien-ca-nhan-khu-vuc-ho-chi-minh.35C58200.html
35C582DC,Chuyên Gia – Phân Khúc Và Định Vị Giá Trị Khách Hàng,Ngân Hàng TMCP Việt Nam Thịnh Vượng - VPBANK,Hà Nội Hồ Chí Minh,Lương: Cạnh tranh,10-10-2025,19-10-2025,https://careerviet.vn/vi/tim-viec-lam/chuyen-gia-phan-khuc-va-dinh-vi-gia-tri-khach-hang.35C582DC.html
35C581F6,Chuyên Viên Kế Toán Kiểm Soát Tập Đoàn,CÔNG TY CỔ PHẦN TẬP ĐOÀN ĐẦU TƯ I.P.A,Hà Nội,Lương: Cạnh tranh,10-10-2025,31-10-2025,https://careerviet.vn/vi/tim-viec-lam/chuyen-vien-ke-toan-kiem-soat-tap-doan.35C581F6.html
35C5815B,Chuyên Viên Thiết Kế Cơ Điện (MEP),"Công Ty Cổ Phần Dịch Vụ, Thương Mại Và Đầu Tư Sao Thủy",Hà Nội,Lương: Cạnh Tranh,10-10-2025,19-10-2025,https://careerviet.vn/vi/tim-viec-lam/chuyen-vien-thiet-ke-co-dien-mep.35C5815B.html
35C582DF,"Chuyên Gia (Quản Trị Modelling, Ngân Sách, Hiệu Suất)",Ngân Hàng TMCP Việt Nam Thịnh Vượng - VPBANK,Hà Nội,Lương: Cạnh Tranh,10-10-2025,19-10-2025,https://careerviet.vn/vi/tim-viec-lam/chuyen-gia-quan-tri-modelling-ngan-sach-hieu-suat.35C582DF.html
35C58173,Key Account Management Executive,Công Ty Cổ Phần Giải Pháp Thanh Toán Việt Nam (VNPAY),Hồ Chí Minh,Lương: Cạnh Tranh,10-10-2025,30-10-2025,https://careerviet.vn/vi/tim-viec-lam/key-account-management-executive.35C58173.html
35C58163,Chuyên viên Thẩm định Khách hàng cá nhân - Retail Customer Appraisal Specialist - Khối Thẩm định (HO25.395),Ngân Hàng TMCP Quân Đội,Hà Nội,Lương: Cạnh Tranh,10-10-2025,19-10-2025,https://careerviet.vn/vi/tim-viec-lam/chuyen-vien-tham-dinh-khach-hang-ca-nhan-retail-customer-appraisal-specialist-khoi-tham-dinh-ho25-395.35C58163.html
35C580F3,Product Risk Management Senior /Officer - Ha Noi - TA133,Ngân Hàng TMCP Việt Nam Thịnh Vượng - VPBANK,Hà Nội,Lương: Cạnh Tranh,10-10-2025,30-10-2025,https://careerviet.vn/vi/tim-viec-lam/product-risk-management-senior-officer-ha-noi-ta133.35C580F3.html
35C5812E,Giám đốc Trung tâm KHDN - Bảo Lộc - TA168,Ngân Hàng TMCP Việt Nam Thịnh Vượng - VPBANK,Lâm Đồng,Lương: Cạnh Tranh,10-10-2025,30-10-2025,https://careerviet.vn/vi/tim-viec-lam/giam-doc-trung-tam-khdn-bao-loc-ta168.35C5812E.html
35C58160,Chuyên viên Phát triển kinh doanh - Business Development Officer - Khối Doanh nghiệp vừa và nhỏ  (HO25.394),Ngân Hàng TMCP Quân Đội,Hồ Chí Minh,Lương: Cạnh Tranh,10-10-2025,19-10-2025,https://careerviet.vn/vi/tim-viec-lam/chuyen-vien-phat-trien-kinh-doanh-business-development-officer-khoi-doanh-nghiep-vua-va-nho-ho25-394.35C58160.html
35AB0C4B,Accountant,Shoefabrik Co. Ltd,Hồ Chí Minh,Lương: Cạnh Tranh,10-10-2025,19-10-2025,https://careerviet.vn/vi/tim-viec-lam/accountant.35AB0C4B.html
35C581F8,Chủ Quản Nhân Sự,CÔNG TY TNHH COCREATION GRASS CORPORATION VIỆT NAM,Tây Ninh,Lương: 18 Tr - 30 Tr VND,10-10-2025,N/A,https://careerviet.vn/vi/tim-viec-lam/chu-quan-nhan-su.35C581F8.html
35C58276,Sales Executive,Linde Vietnam Company Limited,Bà Rịa - Vũng Tàu,Lương: Cạnh Tranh,10-10-2025,20-10-2025,https://careerviet.vn/vi/tim-viec-lam/sales-executive.35C58276.html
35C58123,123476 - Sales and Marketing Manager - F&B,"RGF HR Agent Vietnam Co., LTD",Hồ Chí Minh,Lương: 45 Tr - 55 Tr VND,10-10-2025,N/A,https://careerviet.vn/vi/tim-viec-lam/123476-sales-and-marketing-manager-f-b.35C58123.html
35C5812D,123536 - CAD Operator - Construction,"RGF HR Agent Vietnam Co., LTD",Hồ Chí Minh,Lương: Lên đến 30 Tr VND,10-10-2025,N/A,https://careerviet.vn/vi/tim-viec-lam/123536-cad-operator-construction.35C5812D.html
35C5822C,MECHANICAL TESTING ENGINEER,Action Composites Hightech Industries,Đồng Nai,Lương: Cạnh Tranh,10-10-2025,31-10-2025,https://careerviet.vn/vi/tim-viec-lam/mechanical-testing-engineer.35C5822C.html
35C580CC,"[Nam Từ Liêm, Hà Nội] Nhân Viên Bán Hàng/Kinh Doanh Kênh Truyền Thống (GT)",Coca-Cola Beverages Vietnam,Hà Nội,Lương: 10 Tr - 15 Tr VND,10-10-2025,31-10-2025,https://careerviet.vn/vi/tim-viec-lam/nam-tu-liem-ha-noi-nhan-vien-ban-hang-kinh-doanh-kenh-truyen-thong-gt.35C580CC.html
35C580C6,Security Staff,Wanek Furniture,Bình Dương,Lương: Cạnh Tranh,10-10-2025,20-11-2025,https://careerviet.vn/vi/tim-viec-lam/security-staff.35C580C6.html
35C581BD,Kỹ sư Hỗ trợ kỹ thuật/Technical Support Engineer,Daikin Air Conditioning (Vietnam) Joint Stock Company,Hà Nội,Lương: Cạnh Tranh,10-10-2025,20-10-2025,https://careerviet.vn/vi/tim-viec-lam/ky-su-ho-tro-ky-thuat-technical-support-engineer.35C581BD.html
35C5820D,"[Đan Phượng, Hoài Đức, Hà Nội] Nhân Viên Bán Hàng/Kinh Doanh Kênh Truyền Thống (GT)",Coca-Cola Beverages Vietnam,Hà Nội,Lương: 10 Tr - 15 Tr VND,10-10-2025,31-10-2025,https://careerviet.vn/vi/tim-viec-lam/dan-phuong-hoai-duc-ha-noi-nhan-vien-ban-hang-kinh-doanh-kenh-truyen-thong-gt.35C5820D.html
35C5808F,Graphic Designer & Video Editor,Wanek Furniture,Bình Dương,Lương: Cạnh Tranh,10-10-2025,19-11-2025,https://careerviet.vn/vi/tim-viec-lam/graphic-designer-video-editor.35C5808F.html
35C582B6,Trade Planning & Pricing Strategic Manager (Retail),CÔNG TY CỔ PHẦN KING FOOD MARKET,Hồ Chí Minh,Lương: Cạnh Tranh,10-10-2025,31-12-2025,https://careerviet.vn/vi/tim-viec-lam/trade-planning-pricing-strategic-manager-retail.35C582B6.html
35C5820E,Chuyên viên/Chuyên viên cao cấp quan hệ khách hàng Doanh nghiệp - KV Tây Nam Bộ,Ngân hàng TMCP Phát triển TP.HCM (HDBank),Trà Vinh Sóc Trăng Cà Mau,Lương: Trên 13 Tr VND,10-10-2025,N/A,https://careerviet.vn/vi/tim-viec-lam/chuyen-vien-chuyen-vien-cao-cap-quan-he-khach-hang-doanh-nghiep-kv-tay-nam-bo.35C5820E.html
35C581EC,[Hồ Chí Minh] Nhân Viên Bán Hàng Kênh Khách Hàng Trọng Điểm​ - Kênh Trực Tiếp,Coca-Cola Beverages Vietnam,Hồ Chí Minh,Lương: Cạnh Tranh,10-10-2025,31-10-2025,https://careerviet.vn/vi/tim-viec-lam/ho-chi-minh-nhan-vien-ban-hang-kenh-khach-hang-trong-diem-kenh-truc-tiep.35C581EC.html
35C5820C,Chuyên viên/Chuyên viên cao cấp quan hệ khách hàng cá nhân KV Tây Nam Bộ,Ngân hàng TMCP Phát triển TP.HCM (HDBank),Vĩnh Long Bạc Liêu Trà Vinh,Lương: Trên 11 Tr VND,10-10-2025,31-10-2025,https://careerviet.vn/vi/tim-viec-lam/chuyen-vien-chuyen-vien-cao-cap-quan-he-khach-hang-ca-nhan-kv-tay-nam-bo.35C5820C.html
35C58104,123423 - [1-year Contract] Finance and Accounting Assistant Manager - Apparel,"RGF HR Agent Vietnam Co., LTD",Hồ Chí Minh,Lương: Cạnh Tranh,10-10-2025,N/A,https://careerviet.vn/vi/tim-viec-lam/123423-1-year-contract-finance-and-accounting-assistant-manager-apparel.35C58104.html
35C581C1,Kỹ thuật viên,"Thermtrol Co., Ltd.",Bình Dương,Lương: Cạnh Tranh,10-10-2025,18-10-2025,https://careerviet.vn/vi/tim-viec-lam/ky-thuat-vien.35C581C1.html
35C5810A,Chuyên Viên Tổng Hợp Chứng Từ Thanh Khoản (Bộ phận Thuế Xuất Nhập Khẩu),Công Ty Cổ Phần Sữa Việt Nam (Vinamilk),Hồ Chí Minh,Lương: Cạnh Tranh,10-10-2025,31-10-2025,https://careerviet.vn/vi/tim-viec-lam/chuyen-vien-tong-hop-chung-tu-thanh-khoan-bo-phan-thue-xuat-nhap-khau.35C5810A.html
35C58145,Kế toán tổng hợp,CÔNG TY TNHH NÔNG NGHIỆP LIFARM,Hồ Chí Minh,Lương: 12 Tr - 15 Tr VND,10-10-2025,30-10-2025,https://careerviet.vn/vi/tim-viec-lam/ke-toan-tong-hop.35C58145.html
35C58125,Giám sát công trình nội thất gỗ (Long Biên),Công ty Cổ Phần Đầu tư và Phát triển Tập đoàn Đông Ngô,Hà Nội,Lương: 19 Tr - 23 Tr VND,10-10-2025,31-10-2025,https://careerviet.vn/vi/tim-viec-lam/giam-sat-cong-trinh-noi-that-go-long-bien.35C58125.html
35C581A4,Kỹ sư kiểm tra mẫu và công thức nhuộm vải,CÔNG TY TNHH CLEANDYE VIỆT NAM,Hồ Chí Minh,Lương: 10 Tr - 15 Tr VND,10-10-2025,N/A,https://careerviet.vn/vi/tim-viec-lam/ky-su-kiem-tra-mau-va-cong-thuc-nhuom-vai.35C581A4.html
35C582E8,Kỹ sư Điện – Team Bảo dưỡng & Sửa chữa trạm GIS,CÔNG TY CỔ PHẦN THƯƠNG MẠI DỊCH VỤ KỸ THUẬT  CHẤN HƯNG,Hồ Chí Minh,Lương: Cạnh Tranh,10-10-2025,19-10-2025,https://careerviet.vn/vi/tim-viec-lam/ky-su-dien-team-bao-duong-sua-chua-tram-gis.35C582E8.html
35C581A3,Senior Sales Executive | ISO & Business Assurance Solutions (based in Hanoi),TÜV SÜD Vietnam,Hà Nội,Lương: Trên 25 Tr VND,10-10-2025,19-10-2025,https://careerviet.vn/vi/tim-viec-lam/senior-sales-executive-iso-business-assurance-solutions-based-in-hanoi.35C581A3.html
35C582EB,Kỹ sư Cơ khí – Team Bảo dưỡng & Sửa chữa trong lĩnh vực Dầu khí,CÔNG TY CỔ PHẦN THƯƠNG MẠI DỊCH VỤ KỸ THUẬT  CHẤN HƯNG,Hồ Chí Minh,Lương: Cạnh tranh,10-10-2025,19-10-2025,https://careerviet.vn/vi/tim-viec-lam/ky-su-co-khi-team-bao-duong-sua-chua-trong-linh-vuc-dau-khi.35C582EB.html
35C582EB,Kỹ sư Cơ khí – Team Bảo dưỡng & Sửa chữa trong lĩnh vực Dầu khí,CÔNG TY CỔ PHẦN THƯƠNG MẠI DỊCH VỤ KỸ THUẬT  CHẤN HƯNG,Hồ Chí Minh,Lương: Cạnh tranh,10-10-2025,19-10-2025,https://careerviet.vn/vi/tim-viec-lam/ky-su-co-khi-team-bao-duong-sua-chua-trong-linh-vuc-dau-khi.35C582EB.html
35C58118,Giám sát công trình nội thất gỗ (Quảng Ninh),Công ty Cổ Phần Đầu tư và Phát triển Tập đoàn Đông Ngô,Quảng Ninh,Lương: 19 Tr - 23 Tr VND,10-10-2025,31-10-2025,https://careerviet.vn/vi/tim-viec-lam/giam-sat-cong-trinh-noi-that-go-quang-ninh.35C58118.html
35C3F7C2,CFA (Garment),Công Ty TNHH Bodynits Tiền Giang,Tiền Giang,Lương: 7 Tr - 11 Tr VND,10-10-2025,19-10-2025,https://careerviet.vn/vi/tim-viec-lam/cfa-garment.35C3F7C2.html
35C5807D,NHÂN VIÊN KẾ HOẠCH SẢN XUẤT (Nghành SX Bánh-Thực phẩm),Hỷ Lâm Môn,Hồ Chí Minh,Lương: 10 Tr - 14 Tr VND,10-10-2025,31-10-2025,https://careerviet.vn/vi/tim-viec-lam/nhan-vien-ke-hoach-san-xuat-nghanh-sx-banh-thuc-pham.35C5807D.html
35C58224,Nhân Viên Quản Lý Chất Lượng – QC,Công ty TNHH Gold Coin Feedmill Đồng Nai - Chi Nhánh Long An,Long An,Lương: 9 Tr - 13 Tr VND,10-10-2025,19-10-2025,https://careerviet.vn/vi/tim-viec-lam/nhan-vien-quan-ly-chat-luong-qc.35C58224.html
35C58175,Quản Lý Chuỗi Cửa Hàng,CÔNG TY TNHH THỜI TRANG PANDEMOS,Hồ Chí Minh,Lương: Cạnh tranh,10-10-2025,19-10-2025,https://careerviet.vn/vi/tim-viec-lam/quan-ly-chuoi-cua-hang.35C58175.html
35C5825A,Trợ lý Giám đốc Kinh doanh Hàn Quốc,Công ty TNHH MTV Công Nghiệp D&A Việt Nam,Long An,Lương: 15 Tr - 20 Tr VND,10-10-2025,19-10-2025,https://careerviet.vn/vi/tim-viec-lam/tro-ly-giam-doc-kinh-doanh-han-quoc.35C5825A.html
35C58190,Nhân viên Kế toán (Long An),Công Ty Cổ Phần Tập Đoàn Trần Anh Long An,Long An,Lương: Cạnh tranh,10-10-2025,20-10-2025,https://careerviet.vn/vi/tim-viec-lam/nhan-vien-ke-toan-long-an.35C58190.html
35C590A6,HR Supervisor (Chinese),HR Vietnam’s ESS Client,Bình Dương,"Lương: 800 - 1,000 USD",10-10-2025,29-10-2025,https://careerviet.vn/vi/tim-viec-lam/hr-supervisor-chinese.35C590A6.html
35C590A0,SALES EXECUTIVE,HR Vietnam’s ESS Client,Bình Dương Đồng Nai Bình Thuận,Lương: Cạnh tranh,10-10-2025,29-10-2025,https://careerviet.vn/vi/tim-viec-lam/sales-executive.35C590A0.html
35C590F8,Giám Sát Nhà Hàng,Công ty TNHH Sản xuất Thương mại & Dịch vụ Hoa Xinh,Hồ Chí Minh,Lương: 9 Tr - 11 Tr VND,10-10-2025,25-10-2025,https://careerviet.vn/vi/tim-viec-lam/giam-sat-nha-hang.35C590F8.html
35C58F21,NHÂN  VIÊN  KINH  DOANH,CÔNG TY CỔ PHẦN TỔNG CÔNG TY TOÀN MỸ,Lâm Đồng Sóc Trăng Bà Rịa - Vũng Tàu,Lương: Cạnh tranh,10-10-2025,N/A,https://careerviet.vn/vi/tim-viec-lam/nhan-vien-kinh-doanh.35C58F21.html
35C58F7E,Nhân viên tuyển dụng đào tạo,Công ty cổ phần Alumax Việt Nam,Hà Nội,Lương: 10 Tr - 15 Tr VND,10-10-2025,2,https://careerviet.vn/vi/tim-viec-lam/nhan-vien-tuyen-dung-dao-tao.35C58F7E.html
35C58EF5,Nhân viên kinh doanh,CÔNG TY CỔ PHẦN THIẾT BỊ ĐIỆN VINSHINE,Hải Phòng,Lương: 10 Tr - 20 Tr VND,10-10-2025,N/A,https://careerviet.vn/vi/tim-viec-lam/nhan-vien-kinh-doanh.35C58EF5.html
35C59025,Chuyên Viên Kinh Doanh,CÔNG TY CỔ PHẦN THƯƠNG MẠI BM,Hà Nội,Lương: Trên 30 Tr VND,10-10-2025,29-10-2025,https://careerviet.vn/vi/tim-viec-lam/chuyen-vien-kinh-doanh.35C59025.html
35C590C9,CHUYÊN VIÊN KINH DOANH BĐS – HÀ NỘI - HƯNG YÊN- THANH HOÁ | Thu nhập 40tr++,Công ty TNHH Kinh doanh và Dịch vụ Bất động sản Realhomes,Hà Nội Hưng Yên Thanh Hóa,Lương: 25 Tr - 45 Tr VND,10-10-2025,31-10-2025,https://careerviet.vn/vi/tim-viec-lam/chuyen-vien-kinh-doanh-bds-ha-noi-hung-yen-thanh-hoa-thu-nhap-40tr.35C590C9.html
35C5915E,Nhân Viên Sales Online Nha Khoa,Công ty Cổ Phần Nha Khoa Quốc Tế Win Smile,Hà Nội,Lương: 15 Tr - 35 Tr VND,10-10-2025,31-10-2025,https://careerviet.vn/vi/tim-viec-lam/nhan-vien-sales-online-nha-khoa.35C5915E.html
35C59150,Nhân viên Kinh Doanh Thị Trường,Công ty Cổ Phần Nha Khoa Quốc Tế Win Smile,Hà Nội Đà Nẵng,Lương: 15 Tr - 25 Tr VND,10-10-2025,31-10-2025,https://careerviet.vn/vi/tim-viec-lam/nhan-vien-kinh-doanh-thi-truong.35C59150.html
35C590C2,NHÂN VIÊN TELESALE (LÀM TẠI ROYAL CITY),Công ty TNHH Kinh doanh và Dịch vụ Bất động sản Realhomes,Hà Nội Hưng Yên,Lương: 4 Tr - 10 Tr VND,10-10-2025,31-10-2025,https://careerviet.vn/vi/tim-viec-lam/nhan-vien-telesale-lam-tai-royal-city.35C590C2.html
35C58FFB,Trưởng phòng Tổ chức sản xuất,Công Ty Cổ Phần Tập Đoàn Việt Ba,Hà Nội,Lương: 15 Tr - 25 Tr VND,10-10-2025,31-10-2025,https://careerviet.vn/vi/tim-viec-lam/truong-phong-to-chuc-san-xuat.35C58FFB.html
35C58F19,Nhân viên kinh doanh nội thất,Công Ty TNHH Kiến Trúc Xây Dựng Việt An (Vacons),Hồ Chí Minh,Lương: 8 Tr - 15 Tr VND,10-10-2025,30-10-2025,https://careerviet.vn/vi/tim-viec-lam/nhan-vien-kinh-doanh-noi-that.35C58F19.html
35C58F58,Chuyên viên C&B,Công ty Cổ phần Nha khoa quốc tế Sing,Hà Nội,Lương: 13 Tr - 16 Tr VND,10-10-2025,22-10-2025,https://careerviet.vn/vi/tim-viec-lam/chuyen-vien-c-b.35C58F58.html
35C5919B,HSSE Supervisor,Công Ty TNHH LF Logistics (Việt Nam),Bình Dương,Lương: Cạnh Tranh,10-10-2025,26-10-2025,https://careerviet.vn/vi/tim-viec-lam/hsse-supervisor.35C5919B.html
35C59068,Công nhân bảo trì điện,Công Ty TNHH POSCO - Việt Nam,Bà Rịa - Vũng Tàu,Lương: 8 Tr - 10 Tr VND,10-10-2025,25-10-2025,https://careerviet.vn/vi/tim-viec-lam/cong-nhan-bao-tri-dien.35C59068.html
35C59006,Điều Dưỡng/ Hộ Sinh / Y Sĩ Lấy Máu Tại Chi Nhánh,DIAG,Hồ Chí Minh,Lương: 11 Tr - 13 Tr VND,10-10-2025,26-10-2025,https://careerviet.vn/vi/tim-viec-lam/dieu-duong-ho-sinh-y-si-lay-mau-tai-chi-nhanh.35C59006.html
35C58FCF,Giám sát Kỹ thuật/ Nhân viên kỹ thuật (Nhơn Trạch - Đồng Nai),"CBRE (Vietnam) Co.,ltd",Đồng Nai,"Lương: 9,5 Tr - 15 Tr VND",10-10-2025,30-10-2025,https://careerviet.vn/vi/tim-viec-lam/giam-sat-ky-thuat-nhan-vien-ky-thuat-nhon-trach-dong-nai.35C58FCF.html
35C59064,Công nhân vận hành CAL,Công Ty TNHH POSCO - Việt Nam,Bà Rịa - Vũng Tàu,Lương: 10 Tr - 15 Tr VND,10-10-2025,25-10-2025,https://careerviet.vn/vi/tim-viec-lam/cong-nhan-van-hanh-cal.35C59064.html
35C59061,Công nhân vận hành  cẩu trục,Công Ty TNHH POSCO - Việt Nam,Bà Rịa - Vũng Tàu,Lương: 8 Tr - 10 Tr VND,10-10-2025,25-10-2025,https://careerviet.vn/vi/tim-viec-lam/cong-nhan-van-hanh-cau-truc.35C59061.html
35C590D7,Phụ trách Dịch Vụ Khách Hàng - Tiếng Trung,Công ty Cổ phần Sản xuất – Xây dựng – Thương mại và Nông nghiệp Hải Vương (Sikico Group),Hồ Chí Minh,Lương: Trên 25 Tr VND,10-10-2025,31-10-2025,https://careerviet.vn/vi/tim-viec-lam/phu-trach-dich-vu-khach-hang-tieng-trung.35C590D7.html
35C59130,Corporate Sales Intern (3-month Internship),DIAG,Hồ Chí Minh,"Lương: 3,5 Tr - 5 Tr VND",10-10-2025,31-10-2025,https://careerviet.vn/vi/tim-viec-lam/corporate-sales-intern-3-month-internship.35C59130.html
35C586F5,Nhân viên kinh doanh,CÔNG TY CỔ PHẦN THÔNG GIÓ CÔNG NGHIỆP BREEZE,Hồ Chí Minh Đà Nẵng,Lương: Cạnh Tranh,10-10-2025,27-10-2025,https://careerviet.vn/vi/tim-viec-lam/nhan-vien-kinh-doanh.35C586F5.html
35C59111,[PHƯỜNG TÂN ĐỊNH - HCM] KẾ TOÁN QUẢN LÝ NỘI BỘ,CÔNG TY CỔ PHẦN TẬP ĐOÀN UNIS,Hồ Chí Minh,Lương: 10 Tr - 12 Tr VND,10-10-2025,31-10-2025,https://careerviet.vn/vi/tim-viec-lam/phuong-tan-dinh-hcm-ke-toan-quan-ly-noi-bo.35C59111.html
35C5906A,Trợ Lý Giám Đốc - Tiếng Nhật N2,Công Ty TNHH Bánh kẹo Art Tango,Hồ Chí Minh,Lương: Cạnh Tranh,10-10-2025,26-10-2025,https://careerviet.vn/vi/tim-viec-lam/tro-ly-giam-doc-tieng-nhat-n2.35C5906A.html
35C5906E,Kế Toán Biết Tiếng Trung/ 会中文的会计,CÔNG TY TNHH DỊCH VỤ QUẢNG CÁO PHOENIX NETWORK,Hồ Chí Minh,Lương: 15 Tr - 20 Tr VND,10-10-2025,26-10-2025,https://careerviet.vn/vi/tim-viec-lam/ke-toan-biet-tieng-trung.35C5906E.html
35C5900B,Procurement Specialist ( Chinese Speaking),Bảo mật,Hồ Chí Minh,Lương: Cạnh Tranh,10-10-2025,31-10-2025,https://careerviet.vn/vi/tim-viec-lam/procurement-specialist-chinese-speaking.35C5900B.html
35C58F5B,Tài xế xe tải,CÔNG TY TNHH MỘT THÀNH VIÊN DỊCH VỤ VẬN TẢI HOÀNG KIM,Hồ Chí Minh,Lương: 9 Tr - 11 Tr VND,10-10-2025,31-10-2025,https://careerviet.vn/vi/tim-viec-lam/tai-xe-xe-tai.35C58F5B.html
35C5909E,Process Quality Engineer,CÔNG TY PEC MANUFACTURING VIET NAM,Hồ Chí Minh,Lương: Cạnh Tranh,10-10-2025,26-10-2025,https://careerviet.vn/vi/tim-viec-lam/process-quality-engineer.35C5909E.html
35C58FAA,Nhân viên giao nhận,CÔNG TY TNHH MỘT THÀNH VIÊN DỊCH VỤ VẬN TẢI HOÀNG KIM,Hồ Chí Minh,Lương: 8 Tr - 10 Tr VND,10-10-2025,31-10-2025,https://careerviet.vn/vi/tim-viec-lam/nhan-vien-giao-nhan.35C58FAA.html
35C23983,QUẢN LÝ DỰ ÁN NỘI THẤT (Project Manager),CÔNG TY CỔ PHẦN ĐẦU TƯ VÀ PHÁT TRIỂN TRẦN GIA,Hà Nội,Lương: 15 Tr - 20 Tr VND,10-10-2025,30-10-2025,https://careerviet.vn/vi/tim-viec-lam/quan-ly-du-an-noi-that-project-manager.35C23983.html
35C590FF,Quản đốc Phân xưởng Cơ điện - Động lực Nhà máy Đông Mai,CÔNG TY CP BIA & NGK HẠ LONG,Quảng Ninh,Lương: Cạnh Tranh,10-10-2025,26-10-2025,https://careerviet.vn/vi/tim-viec-lam/quan-doc-phan-xuong-co-dien-dong-luc-nha-may-dong-mai.35C590FF.html
35C590B4,CHUYÊN VIÊN KẾ TOÁN THUẾ,CÔNG TY CỔ PHẦN SẢN XUẤT THƯƠNG MẠI AP BEVERAGE,Hồ Chí Minh,Lương: 15 Tr - 17 Tr VND,10-10-2025,25-10-2025,https://careerviet.vn/vi/tim-viec-lam/chuyen-vien-ke-toan-thue.35C590B4.html
35C59182,Nhân viên kinh doanh dự án,CÔNG TY CỔ PHẦN ĐẦU TƯ VÀ PHÁT TRIỂN TRẦN GIA,Hà Nội,Lương: 10 Tr - 30 Tr VND,10-10-2025,30-10-2025,https://careerviet.vn/vi/tim-viec-lam/nhan-vien-kinh-doanh-du-an.35C59182.html
35C59181,Nhân Viên Thiết Kế Autocad Nội Thất ( Được đào tạo),CÔNG TY CỔ PHẦN ĐẦU TƯ VÀ PHÁT TRIỂN TRẦN GIA,Hà Nội,Lương: 8 Tr - 15 Tr VND,10-10-2025,31-10-2025,https://careerviet.vn/vi/tim-viec-lam/nhan-vien-thiet-ke-autocad-noi-that-duoc-dao-tao.35C59181.html
35C5917A,KỸ SƯ HIỆN TRƯỜNG - HCM,CÔNG TY CỔ PHẦN TƯ VẤN THIẾT KẾ VÀ XÂY DỰNG GREENHN,Hồ Chí Minh,Lương: 15 Tr - 22 Tr VND,10-10-2025,25-10-2025,https://careerviet.vn/vi/tim-viec-lam/ky-su-hien-truong-hcm.35C5917A.html
35C5917D,Nhân Viên Kỹ Thuật Hiện Trường Nội Thất,CÔNG TY CỔ PHẦN ĐẦU TƯ VÀ PHÁT TRIỂN TRẦN GIA,Hà Nội,Lương: 10 Tr - 20 Tr VND,10-10-2025,31-10-2025,https://careerviet.vn/vi/tim-viec-lam/nhan-vien-ky-thuat-hien-truong-noi-that.35C5917D.html
35C5914D,KỸ SƯ DỊCH VỤ KỸ THUẬT (SERVICE ENGINEER),Công ty TNHH Sao Đỏ Việt Nam - Chi nhánh CMS,Hồ Chí Minh,Lương: 10 Tr - 20 Tr VND,10-10-2025,5,https://careerviet.vn/vi/tim-viec-lam/ky-su-dich-vu-ky-thuat-service-engineer.35C5914D.html
