ID,Tên công việc,Tên công ty,Nơi làm việc,Mức lương,Ngày đăng tin,Ngày hết hạn,Link
35C5A013,"[Hưng Yên] Trưởng Nhóm Thiết Kế (Tiếng Anh, Tiếng Nhật) - Có Xe Đưa Đón",CÔNG TY TNHH MEKTEC MANUFACTURING (VIỆT NAM),Hưng Yên,Lương: 650 - 900 USD,17-10-2025,31-10-2025,https://careerviet.vn/vi/tim-viec-lam/hung-yen-truong-nhom-thiet-ke-tieng-anh-tieng-nhat-co-xe-dua-don.35C5A013.html
35C5A01D,"Kế Toán Tổng Hợp/  Kế Toán Ngân Hàng, Công Nợ",Công ty Cổ phần Medcomtech,Hà Nội,Lương: Trên 14 Tr VND,17-10-2025,03-11-2025,https://careerviet.vn/vi/tim-viec-lam/ke-toan-tong-hop-ke-toan-ngan-hang-cong-no.35C5A01D.html
35C59F97,Nhân viên kỹ thuật,CÔNG TY CỔ PHẦN TẬP ĐOÀN N&G,Hà Nội,Lương: Cạnh tranh,17-10-2025,03-11-2025,https://careerviet.vn/vi/tim-viec-lam/nhan-vien-ky-thuat.35C59F97.html
35C5A018,[ Gấp] Kế Toán Trưởng,CÔNG TY TNHH HÒA QUẦN,Hà Nội,Lương: 25 Tr - 28 Tr VND,17-10-2025,03-11-2025,https://careerviet.vn/vi/tim-viec-lam/gap-ke-toan-truong.35C5A018.html
35C59FA2,Kỹ sư trưởng – vận hành Khu công nghiệp và đô thị,CÔNG TY CỔ PHẦN TẬP ĐOÀN N&G,Hà Nội,Lương: Cạnh tranh,17-10-2025,03-11-2025,https://careerviet.vn/vi/tim-viec-lam/ky-su-truong-van-hanh-khu-cong-nghiep-va-do-thi.35C59FA2.html
35C5A020,Trưởng nhóm pháp chế,CÔNG TY CỔ PHẦN ĐẦU TƯ BẤT ĐỘNG SẢN TOÀN CẦU,Hà Nội,Lương: 25 Tr - 35 Tr VND,17-10-2025,03-11-2025,https://careerviet.vn/vi/tim-viec-lam/truong-nhom-phap-che.35C5A020.html
35C59F83,IT Helpdesk,CÔNG TY TNHH THIỀN,Hà Nội,"Lương: 800 - 1,100 USD",17-10-2025,28-11-2025,https://careerviet.vn/vi/tim-viec-lam/it-helpdesk.35C59F83.html
35C59FD0,[LVV] Nhân viên tư vấn tuyển sinh khoá học cho người đi làm,MindX Technology School,Hồ Chí Minh,Lương: 8 Tr - 30 Tr VND,17-10-2025,31-12-2025,https://careerviet.vn/vi/tim-viec-lam/lvv-nhan-vien-tu-van-tuyen-sinh-khoa-hoc-cho-nguoi-di-lam.35C59FD0.html
35C5A014,"Kế toán trưởng nhà máy - LV tại Mễ Trì, Nam Từ Liêm, HN, TN 30-40 triệu",CÔNG TY CỔ PHẦN PHÁT TRIỂN CƠ ĐIỆN LẠNH HOÀNG ĐẠT,Hà Nội,Lương: 30 Tr - 40 Tr VND,17-10-2025,01-11-2025,https://careerviet.vn/vi/tim-viec-lam/ke-toan-truong-nha-may-lv-tai-me-tri-nam-tu-liem-hn-tn-30-40-trieu.35C5A014.html
35C59F4A,Nhân viên pháp chế - Hợp đồng đấu thầu,CÔNG TY CỔ PHẦN XÂY DỰNG VÀ CƠ KHÍ DELTA E&C,Hà Nội,Lương: 15 Tr - 20 Tr VND,17-10-2025,01-11-2025,https://careerviet.vn/vi/tim-viec-lam/nhan-vien-phap-che-hop-dong-dau-thau.35C59F4A.html
35C59E4D,Chuyên Viên Kiểm Soát Xây Dựng - Alphanam Group,Alphanam Group,Hà Nội Bạc Liêu KV Đông Nam Bộ,Lương: 25 Tr - 30 Tr VND,17-10-2025,03-12-2025,https://careerviet.vn/vi/tim-viec-lam/chuyen-vien-kiem-soat-xay-dung-alphanam-group.35C59E4D.html
35C59FAA,Thủ kho Nguyên phụ liệu thời trang,Công Ty Cổ Phần Tập Đoàn Thời Trang Việt Nam,Hà Nội,Lương: 9 Tr - 12 Tr VND,17-10-2025,03-11-2025,https://careerviet.vn/vi/tim-viec-lam/thu-kho-nguyen-phu-lieu-thoi-trang.35C59FAA.html
35C5A024,Trưởng Phòng Đấu Thầu - CĐT Xây dựng,CÔNG TY CỔ PHẦN ĐẦU TƯ DANCO,Hà Nội,Lương: 30 Tr - 35 Tr VND,17-10-2025,30-11-2025,https://careerviet.vn/vi/tim-viec-lam/truong-phong-dau-thau-cdt-xay-dung.35C5A024.html
35C5A01F,[Thuận An] Tư Vấn Tuyển Sinh,MindX Technology School,Bình Dương,Lương: 7 Tr - 15 Tr VND,17-10-2025,27-11-2025,https://careerviet.vn/vi/tim-viec-lam/thuan-an-tu-van-tuyen-sinh.35C5A01F.html
35C59FCF,Nhân viên tư vấn tuyển sinh khoá học cho người đi làm,MindX Technology School,Hồ Chí Minh,Lương: 8 Tr - 30 Tr VND,17-10-2025,31-12-2025,https://careerviet.vn/vi/tim-viec-lam/nhan-vien-tu-van-tuyen-sinh-khoa-hoc-cho-nguoi-di-lam.35C59FCF.html
35C59F18,Chuyên viên tư vấn Khách hàng cá nhân (UB),NGÂN HÀNG TRÁCH NHIỆM HỮU HẠN MỘT THÀNH VIÊN VIỆT NAM HIỆN ĐẠI,Hà Nội,Lương: Cạnh tranh,17-10-2025,31-10-2025,https://careerviet.vn/vi/tim-viec-lam/chuyen-vien-tu-van-khach-hang-ca-nhan-ub.35C59F18.html
35C59ED0,Kiểm soát viên khu vực Ninh Kiều – TP Cần Thơ,NGÂN HÀNG TRÁCH NHIỆM HỮU HẠN MỘT THÀNH VIÊN VIỆT NAM HIỆN ĐẠI,Cần Thơ,Lương: Cạnh tranh,17-10-2025,31-10-2025,https://careerviet.vn/vi/tim-viec-lam/kiem-soat-vien-khu-vuc-ninh-kieu-tp-can-tho.35C59ED0.html
35C59F13,Chuyên viên khách hàng cá nhân,NGÂN HÀNG TRÁCH NHIỆM HỮU HẠN MỘT THÀNH VIÊN VIỆT NAM HIỆN ĐẠI,Đà Nẵng Quảng Ninh,Lương: Cạnh tranh,17-10-2025,25-10-2025,https://careerviet.vn/vi/tim-viec-lam/chuyen-vien-khach-hang-ca-nhan.35C59F13.html
35C59F41,Trưởng phòng kinh doanh nhượng quyền,Công Ty Cổ Phần Tập Đoàn Thời Trang Việt Nam,Hà Nội Nghệ An,Lương: 25 Tr - 40 Tr VND,17-10-2025,03-11-2025,https://careerviet.vn/vi/tim-viec-lam/truong-phong-kinh-doanh-nhuong-quyen.35C59F41.html
35C59E2E,Nhân viên Trợ lý (Biết tiếng Trung),CÔNG TY TNHH VIỆT NAM PAIHO,Hồ Chí Minh,Lương: Cạnh Tranh,17-10-2025,31-10-2025,https://careerviet.vn/vi/tim-viec-lam/nhan-vien-tro-ly-biet-tieng-trung.35C59E2E.html
35C59E8C,Nhân viên Kinh doanh ngành ống nhựa,Tập Đoàn Tân Á Đại Thành,Thái Bình,Lương: 10 Tr - 20 Tr VND,17-10-2025,31-10-2025,https://careerviet.vn/vi/tim-viec-lam/nhan-vien-kinh-doanh-nganh-ong-nhua.35C59E8C.html
35C5A093,Trưởng phòng khám Mai May,Công ty Cổ phần Chăm sóc sức khỏe Mai May,Hồ Chí Minh,Lương: 25 Tr - 50 Tr VND,17-10-2025,31-10-2025,https://careerviet.vn/vi/tim-viec-lam/truong-phong-kham-mai-may.35C5A093.html
35C59FEE,Chuyên viên kỹ thuật thiết bị,CÔNG TY CỔ PHẦN TẬP ĐOÀN HTM,Hồ Chí Minh,Lương: Cạnh Tranh,17-10-2025,03-11-2025,https://careerviet.vn/vi/tim-viec-lam/chuyen-vien-ky-thuat-thiet-bi.35C59FEE.html
35C59FBD,"NHÂN VIÊN BẢO HÀNH - CCN TRẢNG É, KHÁNH HÒA",NANOCO GROUP,Khánh Hòa,Lương: Cạnh Tranh,17-10-2025,02-11-2025,https://careerviet.vn/vi/tim-viec-lam/nhan-vien-bao-hanh-ccn-trang-e-khanh-hoa.35C59FBD.html
35C59F1E,Chuyên viên Kỹ thuật công nghệ,Tập Đoàn Kim Tín,KV Bắc Trung Bộ Hưng Yên,Lương: 15 Tr - 35 Tr VND,17-10-2025,02-11-2025,https://careerviet.vn/vi/tim-viec-lam/chuyen-vien-ky-thuat-cong-nghe.35C59F1E.html
35C59F59,Phiên Dịch Tiếng Nhật N2,Công Ty TNHH YKK Việt Nam,Đồng Nai,Lương: 11 Tr - 14 Tr VND,17-10-2025,31-10-2025,https://careerviet.vn/vi/tim-viec-lam/phien-dich-tieng-nhat-n2.35C59F59.html
35C59F7F,Trưởng Nhóm QA Vải,"Công ty TNHH, Liên Doanh Vĩnh Hưng (TMI Việt Nam)",Hồ Chí Minh,Lương: 13 Tr - 17 Tr VND,17-10-2025,03-11-2025,https://careerviet.vn/vi/tim-viec-lam/truong-nhom-qa-vai.35C59F7F.html
35C59ED4,TRADE MARKETING ANALYST (FMCG),CÔNG TY CỔ PHẦN THƯƠNG MẠI DỊCH VỤ SẢN XUẤT HƯƠNG THỦY,Hồ Chí Minh,Lương: 13 Tr - 18 Tr VND,17-10-2025,03-11-2025,https://careerviet.vn/vi/tim-viec-lam/trade-marketing-analyst-fmcg.35C59ED4.html
35C59F15,Kế Toán Trưởng,CÔNG TY CỔ PHẦN DỊCH VỤ Y TẾ BỆNH VIỆN ÂU CƠ,Đồng Nai,Lương: Cạnh Tranh,17-10-2025,30-11-2025,https://careerviet.vn/vi/tim-viec-lam/ke-toan-truong.35C59F15.html
35C59F78,Sale B2B,Công Ty TNHH Điện Lạnh Miền Tây,Hồ Chí Minh,Lương: Lên đến 50 Tr VND,17-10-2025,30-10-2025,https://careerviet.vn/vi/tim-viec-lam/sale-b2b.35C59F78.html
35C59F6D,Nhân viên Bảo hành Bảo trì,Công Ty TNHH Điện Lạnh Miền Tây,Hồ Chí Minh,Lương: 10 Tr - 15 Tr VND,17-10-2025,28-10-2025,https://careerviet.vn/vi/tim-viec-lam/nhan-vien-bao-hanh-bao-tri.35C59F6D.html
35C59F72,Nhân Viên Thi Công Điện,Công Ty TNHH Điện Lạnh Miền Tây,Hồ Chí Minh,Lương: 9 Tr - 13 Tr VND,17-10-2025,31-10-2025,https://careerviet.vn/vi/tim-viec-lam/nhan-vien-thi-cong-dien.35C59F72.html
35C59F6E,Nhân viên thiết kế hệ thống điện lạnh,Công Ty TNHH Điện Lạnh Miền Tây,Hồ Chí Minh,Lương: 13 Tr - 20 Tr VND,17-10-2025,31-10-2025,https://careerviet.vn/vi/tim-viec-lam/nhan-vien-thiet-ke-he-thong-dien-lanh.35C59F6E.html
35C59E50,"Nhân viên chăm sóc khách hàng Viettel Post tại Lai Xá, Hoài Đức, Hà Nội. H1",CÔNG TY CỔ PHẦN TRUYỀN THÔNG KIM CƯƠNG,Hà Nội,Lương: 7 Tr - 10 Tr VND,17-10-2025,01-11-2025,https://careerviet.vn/vi/tim-viec-lam/nhan-vien-cham-soc-khach-hang-viettel-post-tai-lai-xa-hoai-duc-ha-noi-h1.35C59E50.html
35C59E4B,"Nhân viên tổng đài ngân hàng quân đội MB  tại Đống Đa, Hà Nội H1",CÔNG TY CỔ PHẦN TRUYỀN THÔNG KIM CƯƠNG,Hà Nội,Lương: 8 Tr - 12 Tr VND,17-10-2025,25-10-2025,https://careerviet.vn/vi/tim-viec-lam/nhan-vien-tong-dai-ngan-hang-quan-doi-mb-tai-dong-da-ha-noi-h1.35C59E4B.html
35C59E23,Tuyển Dụng Nhân Viên CSKH Viettel 198 Tại Hòa Lạc,CÔNG TY CỔ PHẦN TRUYỀN THÔNG KIM CƯƠNG,Hà Nội,Lương: 6 Tr - 12 Tr VND,17-10-2025,31-10-2025,https://careerviet.vn/vi/tim-viec-lam/tuyen-dung-nhan-vien-cskh-viettel-198-tai-hoa-lac.35C59E23.html
35C59E58,Chuyên Viên Quản Lý Đại Lý (Bất Động Sản),TẬP ĐOÀN BRG – CÔNG TY CP,Hà Nội,Lương: Cạnh Tranh,17-10-2025,30-11-2025,https://careerviet.vn/vi/tim-viec-lam/chuyen-vien-quan-ly-dai-ly-bat-dong-san.35C59E58.html
35C592FA,"Tổng đài CSKH Ngân hàng quân đội MB tại Cát Linh,Đống Đa, Hà Nội (Xoay ca).H1",CÔNG TY CỔ PHẦN TRUYỀN THÔNG KIM CƯƠNG,Hà Nội,Lương: 8 Tr - 12 Tr VND,17-10-2025,N/A,https://careerviet.vn/vi/tim-viec-lam/tong-dai-cskh-ngan-hang-quan-doi-mb-tai-cat-linh-dong-da-ha-noi-xoay-ca-h1.35C592FA.html
35C59FCC,Chuyên viên/ Chuyên viên cao cấp Chính sách nhân sự,Ngân Hàng Thương Mại Cổ Phần Bảo Việt,Hà Nội,Lương: Cạnh Tranh,17-10-2025,03-11-2025,https://careerviet.vn/vi/tim-viec-lam/chuyen-vien-chuyen-vien-cao-cap-chinh-sach-nhan-su.35C59FCC.html
35C59E93,Giám đốc kinh doanh khu vực quốc tế,"ADC PLASTIC,. JSC",Hà Nội,Lương: 40 Tr - 70 Tr VND,17-10-2025,03-11-2025,https://careerviet.vn/vi/tim-viec-lam/giam-doc-kinh-doanh-khu-vuc-quoc-te.35C59E93.html
35C59E65,Nhân Viên Tư Vấn Bán Hàng Dịch Vụ Viettel Giờ Hành Chính Tân Bình Hồ Chí Minh,CÔNG TY CỔ PHẦN TRUYỀN THÔNG KIM CƯƠNG,Hồ Chí Minh,Lương: 8 Tr - 12 Tr VND,17-10-2025,04-11-2025,https://careerviet.vn/vi/tim-viec-lam/nhan-vien-tu-van-ban-hang-dich-vu-viettel-gio-hanh-chinh-tan-binh-ho-chi-minh.35C59E65.html
35C58F07,"Tổng đài CSKH Viettel Post tại Lai xá ,Hoài Đức, Hà Nội. H1",CÔNG TY CỔ PHẦN TRUYỀN THÔNG KIM CƯƠNG,Hà Nội,Lương: 7 Tr - 10 Tr VND,17-10-2025,25-10-2025,https://careerviet.vn/vi/tim-viec-lam/tong-dai-cskh-viettel-post-tai-lai-xa-hoai-duc-ha-noi-h1.35C58F07.html
35C59EEC,[HCM] Chuyên viên Kế toán,Công ty cổ phần HaMo Holdings,Hồ Chí Minh,Lương: 14 Tr - 18 Tr VND,17-10-2025,5,https://careerviet.vn/vi/tim-viec-lam/hcm-chuyen-vien-ke-toan.35C59EEC.html
35C59E73,[MAP] Nhân viên kế toán vật tư,Công ty Cổ phần Tập đoàn Minh Anh,Hà Nội,Lương: 10 Tr - 15 Tr VND,17-10-2025,31-10-2025,https://careerviet.vn/vi/tim-viec-lam/map-nhan-vien-ke-toan-vat-tu.35C59E73.html
35C59E6F,[AMM] Nhân Viên Sản Xuất Media,Công ty Cổ phần Tập đoàn Minh Anh,Hà Nội,Lương: 10 Tr - 15 Tr VND,17-10-2025,30-11-2025,https://careerviet.vn/vi/tim-viec-lam/amm-nhan-vien-san-xuat-media.35C59E6F.html
35C59E8D,Chuyên viên bán hàng mảng phân bón hữu cơ (Greenma),Công Ty Cổ Phần Tập Đoàn TH,KV Tây Nguyên Đồng Bằng Sông Cửu Long,Lương: Cạnh Tranh,17-10-2025,30-11-2025,https://careerviet.vn/vi/tim-viec-lam/chuyen-vien-ban-hang-mang-phan-bon-huu-co-greenma.35C59E8D.html
35C59E64,Chuyên viên kinh doanh quốc tế,"ADC PLASTIC,. JSC",Hà Nội,Lương: 15 Tr - 40 Tr VND,17-10-2025,03-11-2025,https://careerviet.vn/vi/tim-viec-lam/chuyen-vien-kinh-doanh-quoc-te.35C59E64.html
35C59E6D,Nhân Viên Tổng Đài Chăm Sóc Khách Hàng Viettel Cẩm Lệ Đà Nẵng,CÔNG TY CỔ PHẦN TRUYỀN THÔNG KIM CƯƠNG,Đà Nẵng,Lương: 6 Tr - 9 Tr VND,17-10-2025,04-11-2025,https://careerviet.vn/vi/tim-viec-lam/nhan-vien-tong-dai-cham-soc-khach-hang-viettel-cam-le-da-nang.35C59E6D.html
35C59F37,Công Ty Kim Cương Tuyển NV CSKH Viettel Làm Việc Văn PhòngTại Hòa Lạc Hà Nội,CÔNG TY CỔ PHẦN TRUYỀN THÔNG KIM CƯƠNG,Hà Nội,Lương: 6 Tr - 12 Tr VND,17-10-2025,N/A,https://careerviet.vn/vi/tim-viec-lam/cong-ty-kim-cuong-tuyen-nv-cskh-viettel-lam-viec-van-phongtai-hoa-lac-ha-noi.35C59F37.html
35C5A017,[HCM] Bác Sĩ Nội Tổng Quát,Công ty cổ phần Dripcare Global Holding,Hồ Chí Minh,Lương: Cạnh tranh,17-10-2025,07-11-2025,https://careerviet.vn/vi/tim-viec-lam/hcm-bac-si-noi-tong-quat.35C5A017.html
35C5A017,[HCM] Bác Sĩ Nội Tổng Quát,Công ty cổ phần Dripcare Global Holding,Hồ Chí Minh,Lương: Cạnh tranh,17-10-2025,07-11-2025,https://careerviet.vn/vi/tim-viec-lam/hcm-bac-si-noi-tong-quat.35C5A017.html
35C5A05D,Nhân viên bán hàng showroom Bảo Lộc,Công ty CP Toshiko Việt Nam,Lâm Đồng,Lương: 10 Tr - 15 Tr VND,17-10-2025,03-11-2025,https://careerviet.vn/vi/tim-viec-lam/nhan-vien-ban-hang-showroom-bao-loc.35C5A05D.html
35C5A002,Lễ Tân Phòng Khám (Hà Nội),Công ty cổ phần Dripcare Global Holding,Hà Nội,Lương: 10 Tr - 12 Tr VND,17-10-2025,07-11-2025,https://careerviet.vn/vi/tim-viec-lam/le-tan-phong-kham-ha-noi.35C5A002.html
35C5A00E,Kỹ Thuật Viên Cổ-Vai-Gáy,Công ty cổ phần Dripcare Global Holding,Hà Nội,Lương: 10 Tr - 15 Tr VND,17-10-2025,30-10-2025,https://careerviet.vn/vi/tim-viec-lam/ky-thuat-vien-co-vai-gay.35C5A00E.html
35C5A08A,Chuyên Viên/ CVCC Nhân Sự Tổng Hợp,CÔNG TY CỔ PHẦN CHỨNG KHOÁN ASEAN,Hà Nội,Lương: Cạnh tranh,17-10-2025,31-10-2025,https://careerviet.vn/vi/tim-viec-lam/chuyen-vien-cvcc-nhan-su-tong-hop.35C5A08A.html
35C59740,"Nhân viên tổng đài CSKH ngân hàng quân đội MB  tại Đống Đa, Hà Nội H1",CÔNG TY CỔ PHẦN TRUYỀN THÔNG KIM CƯƠNG,Hà Nội,Lương: 8 Tr - 12 Tr VND,17-10-2025,25-10-2025,https://careerviet.vn/vi/tim-viec-lam/nhan-vien-tong-dai-cskh-ngan-hang-quan-doi-mb-tai-dong-da-ha-noi-h1.35C59740.html
35C5A03F,Chuyên viên Logistic (Quản lý đối tác kho vận & vận chuyển),CÔNG TY TNHH ANTA SPORTS VIỆT NAM,Hà Nội,Lương: 16 Tr - 20 Tr VND,17-10-2025,31-10-2025,https://careerviet.vn/vi/tim-viec-lam/chuyen-vien-logistic-quan-ly-doi-tac-kho-van-van-chuyen.35C5A03F.html
35C59BFF,"Nhân Viên Trực Tổng Đài Viettel Post tại Hoài Đức, Hà Nội.H1",CÔNG TY CỔ PHẦN TRUYỀN THÔNG KIM CƯƠNG,Hà Nội,Lương: 7 Tr - 10 Tr VND,17-10-2025,24-10-2025,https://careerviet.vn/vi/tim-viec-lam/nhan-vien-truc-tong-dai-viettel-post-tai-hoai-duc-ha-noi-h1.35C59BFF.html
35C59F0C,Chuyên Viên Kế Toán Quản Trị,CÔNG TY CỔ PHẦN TẬP ĐOÀN MIK GROUP VIỆT NAM,Hà Nội,Lương: Cạnh tranh,17-10-2025,03-11-2025,https://careerviet.vn/vi/tim-viec-lam/chuyen-vien-ke-toan-quan-tri.35C59F0C.html
35C59F06,Nhân viên Kế Toán Thanh Toán,Công ty Cổ phần IntelLife,Hà Nội,Lương: 10 Tr - 14 Tr VND,17-10-2025,31-10-2025,https://careerviet.vn/vi/tim-viec-lam/nhan-vien-ke-toan-thanh-toan.35C59F06.html
35C59E32,CHUYÊN VIÊN PHÁT TRIỂN DỰ ÁN (Chuyên viên đầu tư),Tập đoàn Hà Đô,Hà Nội,Lương: Cạnh tranh,17-10-2025,03-11-2025,https://careerviet.vn/vi/tim-viec-lam/chuyen-vien-phat-trien-du-an-chuyen-vien-dau-tu.35C59E32.html
35C59E86,Senior BackEnd Developer (Java),LOTTE FINANCE VIETNAM,Hà Nội,Lương: Cạnh tranh,17-10-2025,30-11-2025,https://careerviet.vn/vi/tim-viec-lam/senior-backend-developer-java.35C59E86.html
35C59F04,Trưởng Phòng Kế Toán,CÔNG TY CỔ PHẦN TẬP ĐOÀN MIK GROUP VIỆT NAM,Hà Nội,Lương: Cạnh tranh,17-10-2025,03-11-2025,https://careerviet.vn/vi/tim-viec-lam/truong-phong-ke-toan.35C59F04.html
35C5A01C,Chuyên Viên Quản Lý & Vận Hành Toà Nhà,CÔNG TY CỔ PHẦN THƯƠNG MẠI VÀ XUẤT NHẬP KHẨU VẬT TƯ GIAO THÔNG,Hà Nội,Lương: Cạnh tranh,17-10-2025,31-10-2025,https://careerviet.vn/vi/tim-viec-lam/chuyen-vien-quan-ly-van-hanh-toa-nha.35C5A01C.html
35C59FBA,Chủ nhiệm lớp Anh ngữ (Ocean Edu Vinh 3),Công Ty CP Giáo Dục Đại Dương,Nghệ An,Lương: Trên 13 Tr VND,17-10-2025,03-11-2025,https://careerviet.vn/vi/tim-viec-lam/chu-nhiem-lop-anh-ngu-ocean-edu-vinh-3.35C59FBA.html
35C59EF7,Giám sát Tư vấn tuyển sinh/Telesales Supervisor,Công ty CP Công nghệ giáo dục Trường học trực tuyến (ONSCHOOL),Hồ Chí Minh,Lương: 17 Tr - 22 Tr VND,17-10-2025,31-10-2025,https://careerviet.vn/vi/tim-viec-lam/giam-sat-tu-van-tuyen-sinh-telesales-supervisor.35C59EF7.html
35C59E69,[PHENIKAA UNI] Phó Viện trưởng - Viện Nghiên cứu tiên tiến Phenikaa,ĐẠI HỌC PHENIKAA,Hà Nội,Lương: Cạnh tranh,17-10-2025,30-10-2025,https://careerviet.vn/vi/tim-viec-lam/phenikaa-uni-pho-vien-truong-vien-nghien-cuu-tien-tien-phenikaa.35C59E69.html
35C5A035,Chuyên Viên Nghiên Cứu Và Phân Tích Thị Trường,CÔNG TY CỔ PHẦN CASPER VIỆT NAM,Hà Nội,Lương: 16 Tr - 22 Tr VND,17-10-2025,31-10-2025,https://careerviet.vn/vi/tim-viec-lam/chuyen-vien-nghien-cuu-va-phan-tich-thi-truong.35C5A035.html
35C5A041,Hồ Chí Minh - Nhân viên kinh doanh trả góp ô tô,LOTTE FINANCE VIETNAM,Hồ Chí Minh,Lương: 7 Tr - 12 Tr VND,17-10-2025,01-11-2025,https://careerviet.vn/vi/tim-viec-lam/ho-chi-minh-nhan-vien-kinh-doanh-tra-gop-o-to.35C5A041.html
35C59E7A,Trưởng nhóm tài chính nguồn vốn,CÔNG TY CỔ PHẦN DƯỢC LIỆU VIỆT NAM (VIETMEC),Hà Nội,Lương: 35 Tr - 40 Tr VND,17-10-2025,31-10-2025,https://careerviet.vn/vi/tim-viec-lam/truong-nhom-tai-chinh-nguon-von.35C59E7A.html
35C59FFC,[PHENIKAA UNI] Giảng viên ngành Hệ thống Thông tin Quản lý,ĐẠI HỌC PHENIKAA,Hà Nội,Lương: Cạnh Tranh,17-10-2025,30-10-2025,https://careerviet.vn/vi/tim-viec-lam/phenikaa-uni-giang-vien-nganh-he-thong-thong-tin-quan-ly.35C59FFC.html
35C5A07C,Nhân viên Hành chính tổng hợp,CÔNG TY CỔ PHẦN CÔNG NGHIỆP WELDCOM,Hà Nội,Lương: 12 Tr - 15 Tr VND,17-10-2025,31-10-2025,https://careerviet.vn/vi/tim-viec-lam/nhan-vien-hanh-chinh-tong-hop.35C5A07C.html
35C59FA4,Chủ nhiệm lớp Anh ngữ (Ocean Edu Vĩnh Tường),Công Ty CP Giáo Dục Đại Dương,Nam Định,Lương: Trên 13 Tr VND,17-10-2025,03-11-2025,https://careerviet.vn/vi/tim-viec-lam/chu-nhiem-lop-anh-ngu-ocean-edu-vinh-tuong.35C59FA4.html
35C59FF1,CHUYÊN VIÊN TƯ VẤN GIÁO DỤC (OCEAN EDU XUÂN TRƯỜNG) - THU NHẬP HẤP DẪN TỪ 15 TRIỆU/THÁNG,Công Ty CP Giáo Dục Đại Dương,Nam Định,Lương: Cạnh Tranh,17-10-2025,03-11-2025,https://careerviet.vn/vi/tim-viec-lam/chuyen-vien-tu-van-giao-duc-ocean-edu-xuan-truong-thu-nhap-hap-dan-tu-15-trieu-thang.35C59FF1.html
35C59FA7,Chủ nhiệm lớp Anh ngữ (Ocean Edu Thái Bình),Công Ty CP Giáo Dục Đại Dương,Thái Bình,Lương: Trên 13 Tr VND,17-10-2025,03-11-2025,https://careerviet.vn/vi/tim-viec-lam/chu-nhiem-lop-anh-ngu-ocean-edu-thai-binh.35C59FA7.html
35C5A07A,NHÂN VIÊN KINH DOANH DỰ ÁN,CÔNG TY CỔ PHẦN XHOME SÀI GÒN,Hồ Chí Minh,Lương: 9 Tr - 11 Tr VND,17-10-2025,03-11-2025,https://careerviet.vn/vi/tim-viec-lam/nhan-vien-kinh-doanh-du-an.35C5A07A.html
35C5A02C,Trưởng nhóm Kho - Long An,Công Ty Cổ Phần Thép Việt Xô Hà Nội,Long An,Lương: 11 Tr - 13 Tr VND,17-10-2025,31-10-2025,https://careerviet.vn/vi/tim-viec-lam/truong-nhom-kho-long-an.35C5A02C.html
35C59FD4,CHUYÊN VIÊN TƯ VẤN GIÁO DỤC (OCEAN EDU GIAO THỦY) - THU NHẬP HẤP DẪN TỪ 15 TRIỆU/THÁNG,Công Ty CP Giáo Dục Đại Dương,Nam Định,Lương: Cạnh Tranh,17-10-2025,03-11-2025,https://careerviet.vn/vi/tim-viec-lam/chuyen-vien-tu-van-giao-duc-ocean-edu-giao-thuy-thu-nhap-hap-dan-tu-15-trieu-thang.35C59FD4.html
35C59FE7,CHUYÊN VIÊN TƯ VẤN GIÁO DỤC (OCEAN EDU HẢI HẬU) - THU NHẬP HẤP DẪN TỪ 15 TRIỆU/THÁNG,Công Ty CP Giáo Dục Đại Dương,Nam Định,Lương: Cạnh Tranh,17-10-2025,03-11-2025,https://careerviet.vn/vi/tim-viec-lam/chuyen-vien-tu-van-giao-duc-ocean-edu-hai-hau-thu-nhap-hap-dan-tu-15-trieu-thang.35C59FE7.html
35C59FAE,Chủ nhiệm lớp Anh ngữ (Ocean Edu Kiến Xương),Công Ty CP Giáo Dục Đại Dương,Thái Bình,Lương: Trên 13 Tr VND,17-10-2025,03-11-2025,https://careerviet.vn/vi/tim-viec-lam/chu-nhiem-lop-anh-ngu-ocean-edu-kien-xuong.35C59FAE.html
35C59FAB,"Chuyên viên Tuyển dụng Khối Công Nghệ (R&D, Kỹ thuật, IT) - Talent Acquisition Specialist",Tập Đoàn Karofi Holding,Hà Nội,Lương: 15 Tr - 18 Tr VND,17-10-2025,31-10-2025,https://careerviet.vn/vi/tim-viec-lam/chuyen-vien-tuyen-dung-khoi-cong-nghe-r-d-ky-thuat-it-talent-acquisition-specialist.35C59FAB.html
35C59F56,Trưởng Ca Xưởng Ép Nhựa (Nhà Máy Karofi Hưng Yên ),Tập Đoàn Karofi Holding,Hưng Yên,Lương: 14 Tr - 16 Tr VND,17-10-2025,01-12-2025,https://careerviet.vn/vi/tim-viec-lam/truong-ca-xuong-ep-nhua-nha-may-karofi-hung-yen.35C59F56.html
35C59FB0,Chủ nhiệm lớp Anh ngữ (Ocean Edu Phù Cừ),Công Ty CP Giáo Dục Đại Dương,Hưng Yên,Lương: Trên 13 Tr VND,17-10-2025,03-11-2025,https://careerviet.vn/vi/tim-viec-lam/chu-nhiem-lop-anh-ngu-ocean-edu-phu-cu.35C59FB0.html
35C59FBC,Chủ nhiệm lớp Anh ngữ (Ocean Edu Hà Tĩnh 2),Công Ty CP Giáo Dục Đại Dương,Hà Tĩnh,Lương: Trên 13 Tr VND,17-10-2025,03-11-2025,https://careerviet.vn/vi/tim-viec-lam/chu-nhiem-lop-anh-ngu-ocean-edu-ha-tinh-2.35C59FBC.html
35C59F8E,Chuyên Viên Vận Hành Sàn Thương Mại Điện Tử,Công Ty TNHH Thương Mại Vạn An,Hà Nội,Lương: 12 Tr - 15 Tr VND,17-10-2025,31-10-2025,https://careerviet.vn/vi/tim-viec-lam/chuyen-vien-van-hanh-san-thuong-mai-dien-tu.35C59F8E.html
35C59F12,Giám Đốc Hành Chính Nhân Sự (Có Kinh Nghiệm Vận Hành Hệ Thống),CÔNG TY CỔ PHẦN DƯỢC LIỆU VIỆT NAM (VIETMEC),Hà Nội,"Lương: 1,500 - 2,000 USD",17-10-2025,31-10-2025,https://careerviet.vn/vi/tim-viec-lam/giam-doc-hanh-chinh-nhan-su-co-kinh-nghiem-van-hanh-he-thong.35C59F12.html
35C59F0F,Phó tổng giám đốc kinh doanh ETC - thầu toàn quốc,CÔNG TY CỔ PHẦN DƯỢC LIỆU VIỆT NAM (VIETMEC),Hà Nội Hồ Chí Minh,Lương: 40 Tr - 70 Tr VND,17-10-2025,31-10-2025,https://careerviet.vn/vi/tim-viec-lam/pho-tong-giam-doc-kinh-doanh-etc-thau-toan-quoc.35C59F0F.html
35C59F82,Nhân viên kế hoạch sản xuất-Đồng Nai,Công Ty Cổ Phần Thép Việt Xô Hà Nội,Đồng Nai,Lương: 9 Tr - 10 Tr VND,17-10-2025,31-10-2025,https://careerviet.vn/vi/tim-viec-lam/nhan-vien-ke-hoach-san-xuat-dong-nai.35C59F82.html
35C48BE1,"Chuyên viên/CVC/CVCC Khách Hàng Doanh Nghiệp - Cần Thơ, An Giang, Kiên Giang, Tiền Giang, Cà Mau",Ngân hàng Thương mại cổ phần Đông Nam Á (SeABank),Cần Thơ An Giang Kiên Giang,Lương: 10 Tr - 35 Tr VND,17-10-2025,03-11-2025,https://careerviet.vn/vi/tim-viec-lam/chuyen-vien-cvc-cvcc-khach-hang-doanh-nghiep-can-tho-an-giang-kien-giang-tien-giang-ca-mau.35C48BE1.html
35C59FFB,Trưởng phòng Kinh doanh Hồ Chí Minh,Công Ty Cổ Phần Phương Tiện Điện Thông Minh Selex,Hồ Chí Minh,Lương: 25 Tr - 35 Tr VND,17-10-2025,03-11-2025,https://careerviet.vn/vi/tim-viec-lam/truong-phong-kinh-doanh-ho-chi-minh.35C59FFB.html
35C59FEF,CHUYÊN VIÊN TƯ VẤN GIÁO DỤC (OCEAN EDU NAM TRỰC) - THU NHẬP HẤP DẪN TỪ 15 TRIỆU/THÁNG,Công Ty CP Giáo Dục Đại Dương,Nam Định,Lương: Cạnh Tranh,17-10-2025,03-11-2025,https://careerviet.vn/vi/tim-viec-lam/chuyen-vien-tu-van-giao-duc-ocean-edu-nam-truc-thu-nhap-hap-dan-tu-15-trieu-thang.35C59FEF.html
35C59EFE,Kế Toán Kho (Nhà máy Tecomen Hưng Yên),Tập Đoàn Karofi Holding,Hưng Yên,Lương: 9 Tr - 11 Tr VND,17-10-2025,01-12-2025,https://careerviet.vn/vi/tim-viec-lam/ke-toan-kho-nha-may-tecomen-hung-yen.35C59EFE.html
35C59F28,Chuyên viên Khách hàng Cá Nhân - Hà Nội,Ngân hàng Thương mại cổ phần Đông Nam Á (SeABank),Hà Nội,Lương: Cạnh Tranh,17-10-2025,30-11-2025,https://careerviet.vn/vi/tim-viec-lam/chuyen-vien-khach-hang-ca-nhan-ha-noi.35C59F28.html
35C59E4C,ĐẦU BẾP CO.OPMART BẢO LỘC,Liên Hiệp HTX Thương Mại TPHCM - SAIGON CO.OP,Lâm Đồng,Lương: Cạnh Tranh,17-10-2025,31-10-2025,https://careerviet.vn/vi/tim-viec-lam/dau-bep-co-opmart-bao-loc.35C59E4C.html
35C571E5,Sales Manager/ Relationship Manager (fitness/healthcare/ beauty),California Wellness Group,Hồ Chí Minh,Lương: 15 Tr - 30 Tr VND,17-10-2025,N/A,https://careerviet.vn/vi/tim-viec-lam/sales-manager-relationship-manager-fitness-healthcare-beauty.35C571E5.html
35C59ED5,Trưởng Phòng Sản Xuất - Hà Nam/ Production Manager - Ha Nam,Tan Hiep Phat Group,Hà Nam,Lương: Cạnh Tranh,17-10-2025,03-11-2025,https://careerviet.vn/vi/tim-viec-lam/truong-phong-san-xuat-ha-nam-production-manager-ha-nam.35C59ED5.html
35C5A074,Chuyên viên quản lý tài sản,Công Ty Cổ Phần Tập Đoàn Sunshine Sài Gòn,Hồ Chí Minh,Lương: 10 Tr - 18 Tr VND,17-10-2025,25-10-2025,https://careerviet.vn/vi/tim-viec-lam/chuyen-vien-quan-ly-tai-san.35C5A074.html
35C5A083,Corporate Business Development Expert,FE CREDIT,Hồ Chí Minh,Lương: Cạnh Tranh,17-10-2025,31-10-2025,https://careerviet.vn/vi/tim-viec-lam/corporate-business-development-expert.35C5A083.html
35C59EE0,Accountant Associate,Công ty TNHH Olam Việt Nam,Hồ Chí Minh,Lương: Cạnh Tranh,17-10-2025,31-10-2025,https://careerviet.vn/vi/tim-viec-lam/accountant-associate.35C59EE0.html
