﻿keyword,title,link,company,salary,Nơi làm việc,thời gian đăng,Kinh nghiệm làm việc tối thiểu
ke-toan,Nhân Viên Kế Toán Thuế _ Hà Nội _ Thu Nhập 12 - 15 Triệu,https://www.topcv.vnhttps://www.topcv.vn/viec-lam/nhan-vien-ke-toan-thue-ha-noi-thu-nhap-12-15-trieu/1847020.html?ta_source=JobSearchList_LinkDetail&u_sr_id=ubYpy5tMsZRXLHoBj2AUCAlNMYAvmrE5BVaHrxLS_1756804252,CÔNG TY CỔ PHẦN XÂY DỰNG VÀ NỘI THẤT BẮC YÊN THÁI,12 - 15 triệu,Hà Nội,1 tuần trước,3 năm
ke-toan,"Kế Toán Tổng Hợp - 2 Năm Kinh Nghiệm Trở Lên - Làm Việc Tại Bắc Ninh - Phúc Lợi Tốt, Lương Cứng Upto...",https://www.topcv.vnhttps://www.topcv.vn/viec-lam/ke-toan-tong-hop-2-nam-kinh-nghiem-tro-len-lam-viec-tai-bac-ninh-phuc-loi-tot-luong-cung-upto-19-trieu/1801549.html?ta_source=JobSearchList_LinkDetail&u_sr_id=ubYpy5tMsZRXLHoBj2AUCAlNMYAvmrE5BVaHrxLS_1756804252,CÔNG TY CỔ PHẦN SẢN XUẤT ĐẦU TƯ THƯƠNG MẠI QUỐC TẾ MINH PHÚ,15 - 19 triệu,Bắc Ninh,1 tuần trước,2 năm
ke-toan,Nhân Viên Kế Toán Tổng Hợp - Lương Upto 15tr - Tại Hà Nội,https://www.topcv.vnhttps://www.topcv.vn/viec-lam/nhan-vien-ke-toan-tong-hop-luong-upto-15tr-tai-ha-noi/1831948.html?ta_source=JobSearchList_LinkDetail&u_sr_id=ubYpy5tMsZRXLHoBj2AUCAlNMYAvmrE5BVaHrxLS_1756804252,Công ty cổ phần công nghệ Thái Hưng Khang,13 - 15 triệu,Hà Nội,1 tuần trước,2 năm
ke-toan,Kế Toán Tổng Hợp - 3 Năm Kinh Nghiệm Tại Hồ Chí Minh,https://www.topcv.vnhttps://www.topcv.vn/viec-lam/ke-toan-tong-hop-3-nam-kinh-nghiem-tai-ho-chi-minh/1842793.html?ta_source=JobSearchList_LinkDetail&u_sr_id=ubYpy5tMsZRXLHoBj2AUCAlNMYAvmrE5BVaHrxLS_1756804252,CÔNG TY CỔ PHẦN THƯƠNG MẠI ĐIỆN TỬ ISUCCESS,14 - 16 triệu,Hồ Chí Minh,2 tuần trước,3 năm
ke-toan,"Chuyên Viên Kế Toán Thuế - Quận 7, Hồ Chí Minh",https://www.topcv.vnhttps://www.topcv.vn/brand/chuyenphatnhanhthuanphongcnhcm/tuyen-dung/chuyen-vien-ke-toan-thue-quan-7-ho-chi-minh-j1842228.html?ta_source=JobSearchList_LinkDetail&u_sr_id=ubYpy5tMsZRXLHoBj2AUCAlNMYAvmrE5BVaHrxLS_1756804252,Công ty chuyển phát nhanh Thuận Phong chi nhánh Hồ Chí Minh (J&T Express),20 - 25 triệu,Hồ Chí Minh,2 tuần trước,2 năm
ke-toan,"Kế Toán Tổng Hợp - Lương Thoả Thuận, Đi Làm Ngay",https://www.topcv.vnhttps://www.topcv.vn/viec-lam/ke-toan-tong-hop-luong-thoa-thuan-di-lam-ngay/1857275.html?ta_source=JobSearchList_LinkDetail&u_sr_id=ubYpy5tMsZRXLHoBj2AUCAlNMYAvmrE5BVaHrxLS_1756804252,CÔNG TY CỔ PHẦN SÁCH VÀ THIẾT BỊ TRƯỜNG HỌC THÀNH PHỐ HỒ CHÍ MINH,Thoả thuận,Hồ Chí Minh,3 ngày trước,1 năm
ke-toan,Kế Toán Tổng Hợp - Thu Nhập Hấp Dẫn  - Đi Làm Ngay Ưu Tiên Khu Vực  Tại Tây Hồ -  Bắc Từ Liên - Cầu...,https://www.topcv.vnhttps://www.topcv.vn/viec-lam/ke-toan-tong-hop-thu-nhap-hap-dan-di-lam-ngay-uu-tien-khu-vuc-tai-tay-ho-bac-tu-lien-cau-giay-ha-noi/1507977.html?ta_source=JobSearchList_LinkDetail&u_sr_id=ubYpy5tMsZRXLHoBj2AUCAlNMYAvmrE5BVaHrxLS_1756804252,CÔNG TY CỔ PHẦN ĐẦU TƯ & THƯƠNG MẠI QUỐC TẾ TÂM VIỆT,Thoả thuận,Hà Nội,1 tuần trước,2 năm
ke-toan,Kế Toán Thuế - Lương Up To 30 Triệu (TP.HCM),https://www.topcv.vnhttps://www.topcv.vn/viec-lam/ke-toan-thue-luong-up-to-30-trieu-tp-hcm/1852731.html?ta_source=JobSearchList_LinkDetail&u_sr_id=ubYpy5tMsZRXLHoBj2AUCAlNMYAvmrE5BVaHrxLS_1756804252,CÔNG TY TNHH GIẢI PHÁP CÔNG NGHỆ VÀ ĐẦU TƯ XÂY DỰNG SDKD,15 - 30 triệu,Hồ Chí Minh,1 tuần trước,2 năm
ke-toan,Kế Toán Tổng Hợp (Mạnh Về Thuế) - Yêu Cầu Từ 24 - 33 Tuổi - Thu Nhập 12 - 20 Triệu - Từ 2 Năm Kinh N...,https://www.topcv.vnhttps://www.topcv.vn/viec-lam/ke-toan-tong-hop-manh-ve-thue-yeu-cau-tu-24-33-tuoi-thu-nhap-12-20-trieu-tu-2-nam-kinh-nghiem-ha-dong-ha-noi/1845975.html?ta_source=JobSearchList_LinkDetail&u_sr_id=ubYpy5tMsZRXLHoBj2AUCAlNMYAvmrE5BVaHrxLS_1756804252,HỘ KINH DOANH JOELLA,12 - 20 triệu,Hà Nội,1 tuần trước,2 năm
ke-toan,Kế Toán Thuế Tổng Hợp - Yêu Cầu Nữ - Từng Làm Công Ty Thuế,https://www.topcv.vnhttps://www.topcv.vn/viec-lam/ke-toan-thue-tong-hop-yeu-cau-nu-tung-lam-cong-ty-thue/1778102.html?ta_source=JobSearchList_LinkDetail&u_sr_id=ubYpy5tMsZRXLHoBj2AUCAlNMYAvmrE5BVaHrxLS_1756804252,CÔNG TY TNHH ĐẠI LÝ THUẾ TN,Thoả thuận,Hồ Chí Minh,1 tuần trước,2 năm
ke-toan,Kế Toán Tổng Hợp  ( Có Thưởng Doanh Thu ) - Lương Upto 17tr,https://www.topcv.vnhttps://www.topcv.vn/viec-lam/ke-toan-tong-hop-co-thuong-doanh-thu-luong-upto-17tr/1845936.html?ta_source=JobSearchList_LinkDetail&u_sr_id=ubYpy5tMsZRXLHoBj2AUCAlNMYAvmrE5BVaHrxLS_1756804252,CÔNG TY CỔ PHẦN THƯƠNG MẠI DỊCH VỤ VÀ TỔ CHỨC SỰ KIỆN PROMES,12 - 15 triệu,Hà Nội,1 tuần trước,2 năm
ke-toan,Kế Toán Tổng Hợp,https://www.topcv.vnhttps://www.topcv.vn/viec-lam/ke-toan-tong-hop/1851055.html?ta_source=JobSearchList_LinkDetail&u_sr_id=ubYpy5tMsZRXLHoBj2AUCAlNMYAvmrE5BVaHrxLS_1756804252,CÔNG TY TNHH MỘT THÀNH VIÊN THƯƠNG MẠI XÂY DỰNG HAN SA,14 - 16 triệu,Hồ Chí Minh,3 ngày trước,3 năm
ke-toan,Nhân Viên Kế Toán Tổng Hợp (Thu Nhập Upto 15 Triệu),https://www.topcv.vnhttps://www.topcv.vn/viec-lam/nhan-vien-ke-toan-tong-hop-thu-nhap-upto-15-trieu/1845082.html?ta_source=JobSearchList_LinkDetail&u_sr_id=ubYpy5tMsZRXLHoBj2AUCAlNMYAvmrE5BVaHrxLS_1756804252,CÔNG TY TNHH SOCAL,10 - 15 triệu,Bình Dương,1 tuần trước,3 năm
ke-toan,Trợ Lý Kế Toán Nội Bộ (Tiếng Trung) - Quận 7 (Thu Nhập Từ 13 Triệu Trở Lên),https://www.topcv.vnhttps://www.topcv.vn/viec-lam/tro-ly-ke-toan-noi-bo-tieng-trung-quan-7-thu-nhap-tu-13-trieu-tro-len/1835287.html?ta_source=JobSearchList_LinkDetail&u_sr_id=ubYpy5tMsZRXLHoBj2AUCAlNMYAvmrE5BVaHrxLS_1756804252,CÔNG TY TNHH FOCUS SUCCESS,Từ 13 triệu,Hồ Chí Minh,2 tuần trước,1 năm
ke-toan,Kế Toán Thuế - 1 Năm Kinh Nghiệm - Thu Nhập 15 Triệu Quyền Lợi Hấp Dẫn+++,https://www.topcv.vnhttps://www.topcv.vn/viec-lam/ke-toan-thue-1-nam-kinh-nghiem-thu-nhap-15-trieu-quyen-loi-hap-dan/1309474.html?ta_source=JobSearchList_LinkDetail&u_sr_id=ubYpy5tMsZRXLHoBj2AUCAlNMYAvmrE5BVaHrxLS_1756804252,Công ty TNHH Dịch vụ kế toán và tư vấn thuế Tín Phát,8 - 15 triệu,Hà Nội,1 tuần trước,1 năm
ke-toan,"Kế Toán Thuế - Lương 12 - 18 Triệu - Tại Hoàng Mai, HN - Đi Làm Ngay",https://www.topcv.vnhttps://www.topcv.vn/viec-lam/ke-toan-thue-luong-12-18-trieu-tai-hoang-mai-hn-di-lam-ngay/1850433.html?ta_source=JobSearchList_LinkDetail&u_sr_id=ubYpy5tMsZRXLHoBj2AUCAlNMYAvmrE5BVaHrxLS_1756804252,CÔNG TY TNHH ĐẦU TƯ VÀ PHÁT TRIỂN DỊCH VỤ TRƯỜNG PHÁT,Tới 18 triệu,Hà Nội,1 tuần trước,2 năm
ke-toan,Kế Toán Tổng Hợp - Đi Làm Ngay Lương Upto 15 Triệu/ Tháng,https://www.topcv.vnhttps://www.topcv.vn/viec-lam/ke-toan-tong-hop-di-lam-ngay-luong-upto-15-trieu-thang/1834142.html?ta_source=JobSearchList_LinkDetail&u_sr_id=ubYpy5tMsZRXLHoBj2AUCAlNMYAvmrE5BVaHrxLS_1756804252,CÔNG TY TNHH TTT VIỆT NAM,12 - 15 triệu,Hà Nội,1 tuần trước,2 năm
ke-toan,Nhân Viên Kế Toán Nội Bộ (Thu Nhập Hấp Dẫn),https://www.topcv.vnhttps://www.topcv.vn/viec-lam/nhan-vien-ke-toan-noi-bo-thu-nhap-hap-dan/1854441.html?ta_source=JobSearchList_LinkDetail&u_sr_id=ubYpy5tMsZRXLHoBj2AUCAlNMYAvmrE5BVaHrxLS_1756804252,CÔNG TY TNHH PHONG ĐÌNH VŨ,Tới 10 triệu,Hà Nội,6 ngày trước,1 năm
ke-toan,"Nhân Viên Kế Toán (Mức Lương 10 - 15 Triệu, Yêu Cầu Kinh Nghiệm)",https://www.topcv.vnhttps://www.topcv.vn/viec-lam/nhan-vien-ke-toan-muc-luong-10-15-trieu-yeu-cau-kinh-nghiem/1634367.html?ta_source=JobSearchList_LinkDetail&u_sr_id=ubYpy5tMsZRXLHoBj2AUCAlNMYAvmrE5BVaHrxLS_1756804252,CÔNG TY TNHH DU LỊCH ĐẲNG CẤP Á CHÂU,10 - 15 triệu,Hà Nội,1 tuần trước,2 năm
ke-toan,Kế Toán Tổng Hợp - Thu Nhập Hấp Dẫn - Hồ Chí Minh,https://www.topcv.vnhttps://www.topcv.vn/viec-lam/ke-toan-tong-hop-thu-nhap-hap-dan-ho-chi-minh/1846038.html?ta_source=JobSearchList_LinkDetail&u_sr_id=ubYpy5tMsZRXLHoBj2AUCAlNMYAvmrE5BVaHrxLS_1756804252,CÔNG TY TNHH SẢN XUẤT VÀ DỊCH VỤ BIOZYM,Thoả thuận,Hồ Chí Minh,1 tuần trước,2 năm
ke-toan,Nhân Viên Kế Toán Tổng Hợp 14 -15 Triệu Đi Làm Sau Lễ,https://www.topcv.vnhttps://www.topcv.vn/viec-lam/nhan-vien-ke-toan-tong-hop-14-15-trieu-di-lam-sau-le/1826507.html?ta_source=JobSearchList_LinkDetail&u_sr_id=ubYpy5tMsZRXLHoBj2AUCAlNMYAvmrE5BVaHrxLS_1756804252,CÔNG TY TNHH VIỆN DƯỠNG LÃO HẠNH PHÚC VIÊN,14 - 15 triệu,Hồ Chí Minh,1 tuần trước,3 năm
ke-toan,"Kế Toán Bán Hàng Ecommerce/ Sàn Thương Mại Điện Tử (Hoàng Mai, Hà Nội)",https://www.topcv.vnhttps://www.topcv.vn/brand/thoitrangsixdo/tuyen-dung/ke-toan-ban-hang-ecommerce-san-thuong-mai-dien-tu-hoang-mai-ha-noi-j1845151.html?ta_source=JobSearchList_LinkDetail&u_sr_id=ubYpy5tMsZRXLHoBj2AUCAlNMYAvmrE5BVaHrxLS_1756804252,CÔNG TY CỔ PHẦN THỜI TRANG SIXDO.,10 - 13 triệu,Hà Nội,2 tuần trước,1 năm
ke-toan,Nhân Viên Kế Toán Tổng Hợp Thu Nhập Từ 12 - 15 Triệu Tại Hà Nội,https://www.topcv.vnhttps://www.topcv.vn/viec-lam/nhan-vien-ke-toan-tong-hop-thu-nhap-tu-12-15-trieu-tai-ha-noi/1840336.html?ta_source=JobSearchList_LinkDetail&u_sr_id=ubYpy5tMsZRXLHoBj2AUCAlNMYAvmrE5BVaHrxLS_1756804252,CÔNG TY CỔ PHẦN TRANG TRÍ NỘI THẤT AMI VIỆT NAM,12 - 15 triệu,Hà Nội,2 tuần trước,1 năm
ke-toan,"Nhân Viên Kế Toán Tổng Hợp, Đi Làm Ngay",https://www.topcv.vnhttps://www.topcv.vn/viec-lam/nhan-vien-ke-toan-tong-hop-di-lam-ngay/1856853.html?ta_source=JobSearchList_LinkDetail&u_sr_id=ubYpy5tMsZRXLHoBj2AUCAlNMYAvmrE5BVaHrxLS_1756804252,Công ty TNHH Thương Mại Hoàng Hải Hưng Yên,Thoả thuận,"Hưng Yên, Hà Nội",4 ngày trước,3 năm
ke-toan,"Nhân Viên Kế Toán Tổng Hợp, Lương 13 - 18 Triệu",https://www.topcv.vnhttps://www.topcv.vn/viec-lam/nhan-vien-ke-toan-tong-hop-luong-13-18-trieu/1843763.html?ta_source=JobSearchList_LinkDetail&u_sr_id=ubYpy5tMsZRXLHoBj2AUCAlNMYAvmrE5BVaHrxLS_1756804252,CÔNG TY CỔ PHẦN DỊCH VỤ VÀ BẢO VỆ CHUYÊN NGHIỆP TOÀN TÂM,13 - 18 triệu,Hồ Chí Minh,2 tuần trước,3 năm
ke-toan,Kế Toán Thuế Thu Nhập 10- 25 Triệu Tại Hà Nội,https://www.topcv.vnhttps://www.topcv.vn/viec-lam/ke-toan-thue-thu-nhap-10-25-trieu-tai-ha-noi/1854614.html?ta_source=JobSearchList_LinkDetail&u_sr_id=ubYpy5tMsZRXLHoBj2AUCAlNMYAvmrE5BVaHrxLS_1756804252,CÔNG TY LUẬT TNHH ĐẦU TƯ QUỐC TẾ AN PHÁT,Thoả thuận,Hà Nội,5 ngày trước,2 năm
ke-toan,Kế Toán Tổng Hợp (Làm Việc Tại Bắc Ninh),https://www.topcv.vnhttps://www.topcv.vn/viec-lam/ke-toan-tong-hop-lam-viec-tai-bac-ninh/1844616.html?ta_source=JobSearchList_LinkDetail&u_sr_id=ubYpy5tMsZRXLHoBj2AUCAlNMYAvmrE5BVaHrxLS_1756804252,Công Ty Cổ Phần Hanacans,"800 - 1,200 USD",Bắc Ninh & 2 nơi khác,1 tuần trước,2 năm
ke-toan,"Nhân Viên Kế Toán Làm Việc Tại Hồ Chí Minh, Đi Làm Ngay",https://www.topcv.vnhttps://www.topcv.vn/viec-lam/nhan-vien-ke-toan-lam-viec-tai-ho-chi-minh-di-lam-ngay/1844693.html?ta_source=JobSearchList_LinkDetail&u_sr_id=ubYpy5tMsZRXLHoBj2AUCAlNMYAvmrE5BVaHrxLS_1756804252,CÔNG TY CỔ PHẦN CÔNG NGHỆ HỒNG PHÚ,9 - 16 triệu,Hồ Chí Minh,2 tuần trước,3 năm
ke-toan,Nhân Viên Kế Toán Nội Bộ Kiêm Nhân Sự - Tiếng Trung Thành Thạo - Lương 20 Triệu/Tháng,https://www.topcv.vnhttps://www.topcv.vn/viec-lam/nhan-vien-ke-toan-noi-bo-kiem-nhan-su-tieng-trung-thanh-thao-luong-20-trieu-thang/1846464.html?ta_source=JobSearchList_LinkDetail&u_sr_id=ubYpy5tMsZRXLHoBj2AUCAlNMYAvmrE5BVaHrxLS_1756804252,CÔNG TY TNHH YI YUAN HOUSEWARE (VIỆT NAM),Từ 20 triệu,Bình Dương,1 tuần trước,1 năm
ke-toan,"Kế Toán Nội Bộ Tại Hà Nội - Kinh Nghiệm Từ 3 Năm Trở Lên,  Lương Từ 15 - 20 Triệu",https://www.topcv.vnhttps://www.topcv.vn/viec-lam/ke-toan-noi-bo-tai-ha-noi-kinh-nghiem-tu-3-nam-tro-len-luong-tu-15-20-trieu/1840776.html?ta_source=JobSearchList_LinkDetail&u_sr_id=ubYpy5tMsZRXLHoBj2AUCAlNMYAvmrE5BVaHrxLS_1756804252,Hộ Kinh Doanh Nguyễn Đỗ Phương,15 - 20 triệu,Hà Nội,1 tuần trước,3 năm
ke-toan,Nhân Viên Kế Toán Nội Bộ - Lương Upto 10 Triệu++ Tại Hải Phòng,https://www.topcv.vnhttps://www.topcv.vn/viec-lam/nhan-vien-ke-toan-noi-bo-luong-upto-10-trieu-tai-hai-phong/1497280.html?ta_source=JobSearchList_LinkDetail&u_sr_id=ubYpy5tMsZRXLHoBj2AUCAlNMYAvmrE5BVaHrxLS_1756804252,CÔNG TY TNHH ESTELLE VIỆT NAM,8 - 10 triệu,Hải Phòng,3 ngày trước,Dưới 1 năm
ke-toan,Kế Toán Nội Bộ,https://www.topcv.vnhttps://www.topcv.vn/viec-lam/ke-toan-noi-bo/1631746.html?ta_source=JobSearchList_LinkDetail&u_sr_id=ubYpy5tMsZRXLHoBj2AUCAlNMYAvmrE5BVaHrxLS_1756804252,CÔNG TY TNHH THƯƠNG MẠI VÀ DỊCH VỤ KỸ THUẬT HÙNG PHÁT,Thoả thuận,Hồ Chí Minh,2 tuần trước,1 năm
ke-toan,Nhân Viên Kế Toán (Thu Nhập 10 - 15 Triệu) Đi Làm Ngay Tại Thanh Hóa,https://www.topcv.vnhttps://www.topcv.vn/viec-lam/nhan-vien-ke-toan-thu-nhap-10-15-trieu-di-lam-ngay-tai-thanh-hoa/1845150.html?ta_source=JobSearchList_LinkDetail&u_sr_id=ubYpy5tMsZRXLHoBj2AUCAlNMYAvmrE5BVaHrxLS_1756804252,CÔNG TY TNHH HAM GLOBAL,10 - 15 triệu,Thanh Hoá,2 tuần trước,1 năm
ke-toan,Kế Toán Mua Hàng Kiêm Kế Toán Nội Bộ,https://www.topcv.vnhttps://www.topcv.vn/viec-lam/ke-toan-mua-hang-kiem-ke-toan-noi-bo/1854766.html?ta_source=JobSearchList_LinkDetail&u_sr_id=ubYpy5tMsZRXLHoBj2AUCAlNMYAvmrE5BVaHrxLS_1756804252,CÔNG TY TNHH TỰ ĐỘNG HÓA PNC TECH,Thoả thuận,Hà Nội,6 ngày trước,1 năm
ke-toan,Kế Toán Kho 2 Năm Kinh Nghiệm - Thu Nhập Lên Đến 15 Triệu,https://www.topcv.vnhttps://www.topcv.vn/viec-lam/ke-toan-kho-2-nam-kinh-nghiem-thu-nhap-len-den-15-trieu/1321435.html?ta_source=JobSearchList_LinkDetail&u_sr_id=ubYpy5tMsZRXLHoBj2AUCAlNMYAvmrE5BVaHrxLS_1756804252,CÔNG TY TNHH GIẢI PHÁP ĐÔ THỊ NAM HẢI,10 - 15 triệu,Hà Nội,2 tuần trước,2 năm
ke-toan,Nhân Viên Kế Toán Thanh Toán,https://www.topcv.vnhttps://www.topcv.vn/viec-lam/nhan-vien-ke-toan-thanh-toan/1844675.html?ta_source=JobSearchList_LinkDetail&u_sr_id=ubYpy5tMsZRXLHoBj2AUCAlNMYAvmrE5BVaHrxLS_1756804252,CÔNG TY TNHH CÔNG NGHIỆP PHÚ THÁI,Thoả thuận,Hà Nội,2 tuần trước,1 năm
ke-toan,Kế Toán Tổng Hợp - Up To 15M,https://www.topcv.vnhttps://www.topcv.vn/viec-lam/ke-toan-tong-hop-up-to-15m/1850473.html?ta_source=JobSearchList_LinkDetail&u_sr_id=ubYpy5tMsZRXLHoBj2AUCAlNMYAvmrE5BVaHrxLS_1756804252,CÔNG TY CỔ PHẦN FABL VIỆT NAM,10 - 15 triệu,Hà Nội,1 tuần trước,1 năm
ke-toan,Kế Toán Tổng Hợp - Thu Nhập Hấp Dẫn,https://www.topcv.vnhttps://www.topcv.vn/viec-lam/ke-toan-tong-hop-thu-nhap-hap-dan/1855858.html?ta_source=JobSearchList_LinkDetail&u_sr_id=ubYpy5tMsZRXLHoBj2AUCAlNMYAvmrE5BVaHrxLS_1756804252,Công ty Cổ phần sản xuất thương mại và dịch vụ Phúc Thịnh,15 - 17 triệu,Hà Nội,5 ngày trước,2 năm
ke-toan,"Chuyên Viên Kế Toán Doanh Thu (Thu Nhập Hấp Dẫn, Phúc Lợi Tốt, Đi Làm Ngay) Tại Long Biên - Hà Nội",https://www.topcv.vnhttps://www.topcv.vn/viec-lam/chuyen-vien-ke-toan-doanh-thu-thu-nhap-hap-dan-phuc-loi-tot-di-lam-ngay-tai-long-bien-ha-noi/1854789.html?ta_source=JobSearchList_LinkDetail&u_sr_id=ubYpy5tMsZRXLHoBj2AUCAlNMYAvmrE5BVaHrxLS_1756804252,CÔNG TY TNHH DỊCH VỤ VẬN TẢI SINH THÁI VINBUS,15 - 25 triệu,Hà Nội,6 ngày trước,2 năm
ke-toan,Kế Toán Thuế Kiêm Kế Toán Tổng Hợp - Thu Nhập Upto 18 Triệu (Cung Cấp Trang Thiết Bị Làm Việc) Tại H...,https://www.topcv.vnhttps://www.topcv.vn/viec-lam/ke-toan-thue-kiem-ke-toan-tong-hop-thu-nhap-upto-18-trieu-cung-cap-trang-thiet-bi-lam-viec-tai-ha-noi/1851674.html?ta_source=JobSearchList_LinkDetail&u_sr_id=ubYpy5tMsZRXLHoBj2AUCAlNMYAvmrE5BVaHrxLS_1756804252,CÔNG TY TNHH BUTRACO VIỆT NAM,14 - 18 triệu,Hà Nội,1 tuần trước,3 năm
ke-toan,"Kế Toán Công Nợ Kiêm Điều Phối Xe Giao Hàng, Đi Làm Ngay, Lương Khởi Điểm 10 Triệu/Tháng, Quận 7 - T...",https://www.topcv.vnhttps://www.topcv.vn/viec-lam/ke-toan-cong-no-kiem-dieu-phoi-xe-giao-hang-di-lam-ngay-luong-khoi-diem-10-trieu-thang-quan-7-tphcm/1848827.html?ta_source=JobSearchList_LinkDetail&u_sr_id=ubYpy5tMsZRXLHoBj2AUCAlNMYAvmrE5BVaHrxLS_1756804252,CÔNG TY CỔ PHẦN QUỐC TẾ YUTAKA NHẬT BẢN,Từ 10 triệu,Hồ Chí Minh,1 tuần trước,1 năm
ke-toan,Nhân Viên Kế Toán Tổng Hợp Biết Tiếng Trung,https://www.topcv.vnhttps://www.topcv.vn/viec-lam/nhan-vien-ke-toan-tong-hop-biet-tieng-trung/1779722.html?ta_source=JobSearchList_LinkDetail&u_sr_id=ubYpy5tMsZRXLHoBj2AUCAlNMYAvmrE5BVaHrxLS_1756804252,CÔNG TY TNHH JMA (VN),20 - 25 triệu,Bình Dương,5 ngày trước,3 năm
ke-toan,Kế Toán Nội Bộ (Có Kinh Nghiệm Lên Báo Cáo Tài Chính),https://www.topcv.vnhttps://www.topcv.vn/viec-lam/ke-toan-noi-bo-co-kinh-nghiem-len-bao-cao-tai-chinh/1852385.html?ta_source=JobSearchList_LinkDetail&u_sr_id=ubYpy5tMsZRXLHoBj2AUCAlNMYAvmrE5BVaHrxLS_1756804252,CÔNG TY TNHH THỜI TRANG HDA VIỆT NAM,8 - 12 triệu,Hà Nội,1 tuần trước,1 năm
ke-toan,Kế Toán Tổng Hợp (Thu Nhập 12 - 16 Triệu) - HCM,https://www.topcv.vnhttps://www.topcv.vn/viec-lam/ke-toan-tong-hop-thu-nhap-12-16-trieu-hcm/1803814.html?ta_source=JobSearchList_LinkDetail&u_sr_id=ubYpy5tMsZRXLHoBj2AUCAlNMYAvmrE5BVaHrxLS_1756804252,CÔNG TY TNHH TOURPIK VINA,12 - 16 triệu,Hồ Chí Minh,1 tuần trước,1 năm
ke-toan,"Kế Toán Nội Bộ, 1 Năm Kinh Nghiệm (Nam Từ Liêm - Hà Nội)",https://www.topcv.vnhttps://www.topcv.vn/viec-lam/ke-toan-noi-bo-1-nam-kinh-nghiem-nam-tu-liem-ha-noi/1691503.html?ta_source=JobSearchList_LinkDetail&u_sr_id=ubYpy5tMsZRXLHoBj2AUCAlNMYAvmrE5BVaHrxLS_1756804252,Công ty TNHH Thương mại và phát triển An Nhiên,Từ 8 triệu,Hà Nội,1 tuần trước,1 năm
ke-toan,Kế Toán Tổng Hợp - Lương Thực Nhận Từ 15 Triệu ++ (TP.HCM),https://www.topcv.vnhttps://www.topcv.vn/viec-lam/ke-toan-tong-hop-luong-thuc-nhan-tu-15-trieu-tp-hcm/1844943.html?ta_source=JobSearchList_LinkDetail&u_sr_id=ubYpy5tMsZRXLHoBj2AUCAlNMYAvmrE5BVaHrxLS_1756804252,CÔNG TY TNHH XUẤT NHẬP KHẨU TOKI FOOD,Từ 15 triệu,Hồ Chí Minh,1 tuần trước,2 năm
ke-toan,Nhân Viên Kế Toán Kiêm Hành Chính Nhân Sự - Tại Đà Nẵng,https://www.topcv.vnhttps://www.topcv.vn/viec-lam/nhan-vien-ke-toan-kiem-hanh-chinh-nhan-su-tai-da-nang/1849851.html?ta_source=JobSearchList_LinkDetail&u_sr_id=ubYpy5tMsZRXLHoBj2AUCAlNMYAvmrE5BVaHrxLS_1756804252,CÔNG TY TNHH QUANG MINH EDU,9 - 11 triệu,Đà Nẵng,1 tuần trước,1 năm
ke-toan,Kế Toán Tổng Hợp (Phụ Trách Kế Toán ) Mức Lương 18-22 Triệu - Khu Vực Hà Đông,https://www.topcv.vnhttps://www.topcv.vn/viec-lam/ke-toan-tong-hop-phu-trach-ke-toan-muc-luong-18-22-trieu-khu-vuc-ha-dong/1853519.html?ta_source=JobSearchList_LinkDetail&u_sr_id=ubYpy5tMsZRXLHoBj2AUCAlNMYAvmrE5BVaHrxLS_1756804252,CÔNG TY CỔ PHẦN ĐÔNG PHÁT VIỆT NAM,18 - 22 triệu,Hà Nội,6 ngày trước,3 năm
ke-toan,Nhân Viên Kế Toán Thuế Chi Tiết,https://www.topcv.vnhttps://www.topcv.vn/viec-lam/nhan-vien-ke-toan-thue-chi-tiet/1849536.html?ta_source=JobSearchList_LinkDetail&u_sr_id=ubYpy5tMsZRXLHoBj2AUCAlNMYAvmrE5BVaHrxLS_1756804252,CÔNG TY CỔ PHẦN TẬP ĐOÀN VIANCO,9 - 12 triệu,Hà Nội,1 tuần trước,1 năm
ke-toan,Nhân Viên Kế Toán / Chuyên Viên Kế Toán / Thu Nhập 14-20tr / Đi Làm Ngay,https://www.topcv.vnhttps://www.topcv.vn/viec-lam/nhan-vien-ke-toan-chuyen-vien-ke-toan-thu-nhap-14-20tr-di-lam-ngay/1844201.html?ta_source=JobSearchList_LinkDetail&u_sr_id=ubYpy5tMsZRXLHoBj2AUCAlNMYAvmrE5BVaHrxLS_1756804252,"CÔNG TY TNHH SẢN XUẤT, LẮP RÁP TUẤN NGHĨA",14 - 20 triệu,Hà Nội,2 tuần trước,1 năm
