﻿keyword,title,link,company,salary,Nơi làm việc,thời gian đăng,Kinh nghiệm làm việc tối thiểu
ke-toan,"Kế Toán Tổng Hợp Tối Thiểu 3 Năm Kinh Nghiệm Công Ty Thương Mại Làm Việc Tại 458 Minh Khai, Hà Nội -...",https://www.topcv.vnhttps://www.topcv.vn/viec-lam/ke-toan-tong-hop-toi-thieu-3-nam-kinh-nghiem-cong-ty-thuong-mai-lam-viec-tai-458-minh-khai-ha-noi-thu-nhap-hap-dan-di-lam-ngay/1843216.html?ta_source=JobSearchList_LinkDetail&u_sr_id=lbFCZjUFIUqzEZ1GYCJDw1uGtZK8BHAR5WJEnhJj_1756812383,CÔNG TY TNHH TẬP ĐOÀN TEELA,Từ 15 triệu,Hà Nội,2 tuần trước,3 năm
ke-toan,Kế Toán Tổng Hợp Lương Cạnh Tranh Tại Cầu Giấy Hà Nội,https://www.topcv.vnhttps://www.topcv.vn/viec-lam/ke-toan-tong-hop-luong-canh-tranh-tai-cau-giay-ha-noi/1791726.html?ta_source=JobSearchList_LinkDetail&u_sr_id=lbFCZjUFIUqzEZ1GYCJDw1uGtZK8BHAR5WJEnhJj_1756812383,CÔNG TY CỔ PHẦN CHUYỂN ĐỔI SỐ AIONTECH,Thoả thuận,Hà Nội,2 ngày trước,5 năm
ke-toan,"Kế Toán Tổng Hợp - 2 Năm Kinh Nghiệm Trở Lên - Làm Việc Tại Bắc Ninh - Phúc Lợi Tốt, Lương Cứng Upto...",https://www.topcv.vnhttps://www.topcv.vn/viec-lam/ke-toan-tong-hop-2-nam-kinh-nghiem-tro-len-lam-viec-tai-bac-ninh-phuc-loi-tot-luong-cung-upto-19-trieu/1801549.html?ta_source=JobSearchList_LinkDetail&u_sr_id=lbFCZjUFIUqzEZ1GYCJDw1uGtZK8BHAR5WJEnhJj_1756812383,CÔNG TY CỔ PHẦN SẢN XUẤT ĐẦU TƯ THƯƠNG MẠI QUỐC TẾ MINH PHÚ,15 - 19 triệu,Bắc Ninh,1 tuần trước,2 năm
ke-toan,Nhân Viên Kế Toán/ Kế Toán Viên/ Kế Toán Tổng Hợp (1 Năm Kinh Nghiệm) Lương 13-15 Triệu Tại Hà Nội -...,https://www.topcv.vnhttps://www.topcv.vn/viec-lam/nhan-vien-ke-toan-ke-toan-vien-ke-toan-tong-hop-1-nam-kinh-nghiem-luong-13-15-trieu-tai-ha-noi-di-lam-ngay/1856420.html?ta_source=JobSearchList_LinkDetail&u_sr_id=lbFCZjUFIUqzEZ1GYCJDw1uGtZK8BHAR5WJEnhJj_1756812383,CÔNG TY TNHH THƯƠNG MẠI DỊCH VỤ NAG,13 - 15 triệu,Hà Nội,4 ngày trước,1 năm
ke-toan,Kế Toán Công Nợ Phải Trả,https://www.topcv.vnhttps://www.topcv.vn/brand/cellphones/tuyen-dung/ke-toan-cong-no-phai-tra-j1842801.html?ta_source=JobSearchList_LinkDetail&u_sr_id=lbFCZjUFIUqzEZ1GYCJDw1uGtZK8BHAR5WJEnhJj_1756812383,CÔNG TY TNHH THƯƠNG MẠI TỔNG HỢP HTV (CellphoneS),9 - 11 triệu,Hà Nội,5 ngày trước,1 năm
ke-toan,"Nhân Viên Kế Toán Thuế Làm Dịch Vụ Kế Toán - Tại Hà Nội, Hồ Chí Minh (Thu Nhập 25 - 35 Triệu)",https://www.topcv.vnhttps://www.topcv.vn/viec-lam/nhan-vien-ke-toan-thue-lam-dich-vu-ke-toan-tai-ha-noi-ho-chi-minh-thu-nhap-25-35-trieu/1850043.html?ta_source=JobSearchList_LinkDetail&u_sr_id=lbFCZjUFIUqzEZ1GYCJDw1uGtZK8BHAR5WJEnhJj_1756812383,Công ty TNHH Dịch vụ Tư vấn Anpha,25 - 35 triệu,"Hà Nội, Hồ Chí Minh",1 tuần trước,3 năm
ke-toan,Nhân Viên Kế Toán Tại Hà Nội,https://www.topcv.vnhttps://www.topcv.vn/viec-lam/nhan-vien-ke-toan-tai-ha-noi/1714575.html?ta_source=JobSearchList_LinkDetail&u_sr_id=lbFCZjUFIUqzEZ1GYCJDw1uGtZK8BHAR5WJEnhJj_1756812383,CHI NHÁNH CÔNG TY TNHH DU LỊCH TRẦN VIỆT,8 - 12 triệu,Hà Nội,5 ngày trước,1 năm
ke-toan,"Kê Toán Tổng Hợp (Thu Nhập Từ 20,000,000 - 25,000,000 VNĐ)",https://www.topcv.vnhttps://www.topcv.vn/viec-lam/ke-toan-tong-hop-thu-nhap-tu-20-000-000-25-000-000-vnd/1855003.html?ta_source=JobSearchList_LinkDetail&u_sr_id=lbFCZjUFIUqzEZ1GYCJDw1uGtZK8BHAR5WJEnhJj_1756812383,Công Ty Cổ phần Xuất Nhập Khẩu Thương Mại Đài Linh,20 - 25 triệu,Hà Nội,6 ngày trước,3 năm
ke-toan,Nhân Viên Kế Toán Tổng Hợp (Thu Nhập Upto 15 Triệu),https://www.topcv.vnhttps://www.topcv.vn/viec-lam/nhan-vien-ke-toan-tong-hop-thu-nhap-upto-15-trieu/1845082.html?ta_source=JobSearchList_LinkDetail&u_sr_id=lbFCZjUFIUqzEZ1GYCJDw1uGtZK8BHAR5WJEnhJj_1756812383,CÔNG TY TNHH SOCAL,10 - 15 triệu,Bình Dương,1 tuần trước,3 năm
ke-toan,Kế Toán Tổng Hợp,https://www.topcv.vnhttps://www.topcv.vn/viec-lam/ke-toan-tong-hop/1851055.html?ta_source=JobSearchList_LinkDetail&u_sr_id=lbFCZjUFIUqzEZ1GYCJDw1uGtZK8BHAR5WJEnhJj_1756812383,CÔNG TY TNHH MỘT THÀNH VIÊN THƯƠNG MẠI XÂY DỰNG HAN SA,14 - 16 triệu,Hồ Chí Minh,3 ngày trước,3 năm
ke-toan,Kế Toán Nội Bộ - Thu Nhập Đến 15 Triệu - Hà Nội,https://www.topcv.vnhttps://www.topcv.vn/viec-lam/ke-toan-noi-bo-thu-nhap-den-15-trieu-ha-noi/1241751.html?ta_source=JobSearchList_LinkDetail&u_sr_id=lbFCZjUFIUqzEZ1GYCJDw1uGtZK8BHAR5WJEnhJj_1756812383,CHI NHÁNH CÔNG TY TNHH KIỂM TOÁN IMMANUEL,12 - 15 triệu,Hà Nội,6 ngày trước,2 năm
ke-toan,Kế Toán Nội Bộ - Thương Mại Điện Tử/Bán Lẻ - Thu Nhập Upto 15tr Làm Việc Tại KĐT Định Công Hà Nội,https://www.topcv.vnhttps://www.topcv.vn/viec-lam/ke-toan-noi-bo-thuong-mai-dien-tu-ban-le-thu-nhap-upto-15tr-lam-viec-tai-kdt-dinh-cong-ha-noi/1849614.html?ta_source=JobSearchList_LinkDetail&u_sr_id=lbFCZjUFIUqzEZ1GYCJDw1uGtZK8BHAR5WJEnhJj_1756812383,Công ty TNHH Thương Mại và Dịch Vụ KR CTB,10 - 15 triệu,Hà Nội,4 ngày trước,1 năm
ke-toan,"Kế Toán Tổng Hợp Làm Việc Tại Văn Phòng Quận Tân Phú, Hồ Chí Minh, Thu Nhập 10-16 Triệu",https://www.topcv.vnhttps://www.topcv.vn/viec-lam/ke-toan-tong-hop-lam-viec-tai-van-phong-quan-tan-phu-ho-chi-minh-thu-nhap-10-16-trieu/1846399.html?ta_source=JobSearchList_LinkDetail&u_sr_id=lbFCZjUFIUqzEZ1GYCJDw1uGtZK8BHAR5WJEnhJj_1756812383,CÔNG TY CỔ PHẦN CÔNG NGHỆ XANH GROUP,10 - 16 triệu,Hồ Chí Minh,1 tuần trước,1 năm
ke-toan,Kế Toán Nhập Liệu - Nhận Việc Ngay,https://www.topcv.vnhttps://www.topcv.vn/viec-lam/ke-toan-nhap-lieu-nhan-viec-ngay/1847475.html?ta_source=JobSearchList_LinkDetail&u_sr_id=lbFCZjUFIUqzEZ1GYCJDw1uGtZK8BHAR5WJEnhJj_1756812383,CÔNG TY CỔ PHẦN ĐẦU TƯ THƯƠNG MẠI DỊCH VỤ PHỐ 79,9 - 10 triệu,Hồ Chí Minh,1 tuần trước,1 năm
ke-toan,"Chuyên Viên Kế Toán Thuế - Quận 7, Hồ Chí Minh",https://www.topcv.vnhttps://www.topcv.vn/brand/chuyenphatnhanhthuanphongcnhcm/tuyen-dung/chuyen-vien-ke-toan-thue-quan-7-ho-chi-minh-j1842228.html?ta_source=JobSearchList_LinkDetail&u_sr_id=lbFCZjUFIUqzEZ1GYCJDw1uGtZK8BHAR5WJEnhJj_1756812383,Công ty chuyển phát nhanh Thuận Phong chi nhánh Hồ Chí Minh (J&T Express),20 - 25 triệu,Hồ Chí Minh,2 tuần trước,2 năm
ke-toan,Kế Toán Nội Bộ - Nữ  - Thu Nhập Hấp Dẫn - Làm Việc Tại Tân Bình Hồ Chí Minh,https://www.topcv.vnhttps://www.topcv.vn/viec-lam/ke-toan-noi-bo-nu-thu-nhap-hap-dan-lam-viec-tai-tan-binh-ho-chi-minh/1825316.html?ta_source=JobSearchList_LinkDetail&u_sr_id=lbFCZjUFIUqzEZ1GYCJDw1uGtZK8BHAR5WJEnhJj_1756812383,công ty TNHH MTV Công Nghệ Đổi Mới,Thoả thuận,Hồ Chí Minh,1 tuần trước,2 năm
ke-toan,Kế Toán Nội Bộ - Bán Hàng - Từ 6 Tháng Kinh Nghiệm - Thu Nhập Từ 15 - 30 Triệu - Tại Hà Nội,https://www.topcv.vnhttps://www.topcv.vn/viec-lam/ke-toan-noi-bo-ban-hang-tu-6-thang-kinh-nghiem-thu-nhap-tu-15-30-trieu-tai-ha-noi/1848494.html?ta_source=JobSearchList_LinkDetail&u_sr_id=lbFCZjUFIUqzEZ1GYCJDw1uGtZK8BHAR5WJEnhJj_1756812383,CÔNG TY CỔ PHẦN XUÂN THIỆU VIỆT NAM,15 - 30 triệu,Hà Nội,1 tuần trước,Dưới 1 năm
ke-toan,Kế Toán Tổng Hợp (Kiêm Phụ Trách Báo Cáo Thuế),https://www.topcv.vnhttps://www.topcv.vn/viec-lam/ke-toan-tong-hop-kiem-phu-trach-bao-cao-thue/1840829.html?ta_source=JobSearchList_LinkDetail&u_sr_id=lbFCZjUFIUqzEZ1GYCJDw1uGtZK8BHAR5WJEnhJj_1756812383,CÔNG TY TNHH DMU LOGISTICS (VIETNAM),Thoả thuận,Hồ Chí Minh,2 tuần trước,3 năm
ke-toan,Kế Toán Tổng Hợp - Kinh Nghiệm 1 Năm (Nữ),https://www.topcv.vnhttps://www.topcv.vn/viec-lam/ke-toan-tong-hop-kinh-nghiem-1-nam-nu/1747493.html?ta_source=JobSearchList_LinkDetail&u_sr_id=lbFCZjUFIUqzEZ1GYCJDw1uGtZK8BHAR5WJEnhJj_1756812383,Công ty Cổ phần BMC Việt Nam,15 - 20 triệu,"Long An, Hồ Chí Minh",1 tuần trước,1 năm
ke-toan,Kế Toán Kho,https://www.topcv.vnhttps://www.topcv.vn/viec-lam/ke-toan-kho/1850906.html?ta_source=JobSearchList_LinkDetail&u_sr_id=lbFCZjUFIUqzEZ1GYCJDw1uGtZK8BHAR5WJEnhJj_1756812383,CÔNG TY TNHH THƯƠNG MẠI DỊCH VỤ DƯƠNG ANH AUTO,7 - 9 triệu,Hồ Chí Minh,5 ngày trước,Không yêu cầu
ke-toan,Kế Toán Tổng Hợp,https://www.topcv.vnhttps://www.topcv.vn/viec-lam/ke-toan-tong-hop/1842666.html?ta_source=JobSearchList_LinkDetail&u_sr_id=lbFCZjUFIUqzEZ1GYCJDw1uGtZK8BHAR5WJEnhJj_1756812383,CÔNG TY CP CAO SU VIỆT PHÚ THỊNH,16 - 25 triệu,Hồ Chí Minh,1 tuần trước,3 năm
ke-toan,Chuyên Viên Kế Toán Tổng Hợp Thu Nhập Lên Đến 16 Triệu + Trợ Cấp Ăn Trưa,https://www.topcv.vnhttps://www.topcv.vn/viec-lam/chuyen-vien-ke-toan-tong-hop-thu-nhap-len-den-16-trieu-tro-cap-an-trua/1770134.html?ta_source=JobSearchList_LinkDetail&u_sr_id=lbFCZjUFIUqzEZ1GYCJDw1uGtZK8BHAR5WJEnhJj_1756812383,Công ty Cổ phần Công nghệ Công nghiệp VConnex,Tới 16 triệu,Hà Nội,1 tuần trước,3 năm
ke-toan,Kế Toán Đặt Hàng - Nhận Việc Ngay,https://www.topcv.vnhttps://www.topcv.vn/viec-lam/ke-toan-dat-hang-nhan-viec-ngay/1842996.html?ta_source=JobSearchList_LinkDetail&u_sr_id=lbFCZjUFIUqzEZ1GYCJDw1uGtZK8BHAR5WJEnhJj_1756812383,CÔNG TY TNHH OTOKI VIET NAM,8 - 9 triệu,Hồ Chí Minh,2 tuần trước,1 năm
ke-toan,Nữ Kế Toán Nội Bộ - Nhận Việc Ngay,https://www.topcv.vnhttps://www.topcv.vn/viec-lam/nu-ke-toan-noi-bo-nhan-viec-ngay/1847550.html?ta_source=JobSearchList_LinkDetail&u_sr_id=lbFCZjUFIUqzEZ1GYCJDw1uGtZK8BHAR5WJEnhJj_1756812383,CÔNG TY TNHH SX TM ÁO MƯA VIỆT,Thoả thuận,Hồ Chí Minh,1 tuần trước,1 năm
ke-toan,Kế Toán Kho,https://www.topcv.vnhttps://www.topcv.vn/viec-lam/ke-toan-kho/1845224.html?ta_source=JobSearchList_LinkDetail&u_sr_id=lbFCZjUFIUqzEZ1GYCJDw1uGtZK8BHAR5WJEnhJj_1756812383,CÔNG TY TNHH HẦM RƯỢU VIỆT NAM,12 - 16 triệu,"Hồ Chí Minh, Hà Nội",1 tuần trước,1 năm
ke-toan,Kế Toán Nội Bộ - Hồ Chí Minh,https://www.topcv.vnhttps://www.topcv.vn/viec-lam/ke-toan-noi-bo-ho-chi-minh/1852547.html?ta_source=JobSearchList_LinkDetail&u_sr_id=lbFCZjUFIUqzEZ1GYCJDw1uGtZK8BHAR5WJEnhJj_1756812383,CÔNG TY TNHH VINMV,12 - 15 triệu,Hồ Chí Minh,1 tuần trước,2 năm
ke-toan,Kế Toán Tổng Hợp (Đi Làm Ngay),https://www.topcv.vnhttps://www.topcv.vn/viec-lam/ke-toan-tong-hop-di-lam-ngay/1857936.html?ta_source=JobSearchList_LinkDetail&u_sr_id=lbFCZjUFIUqzEZ1GYCJDw1uGtZK8BHAR5WJEnhJj_1756812383,CÔNG TY CỔ PHẦN TẬP ĐOÀN TECHLOG,12 - 16 triệu,Hồ Chí Minh,3 ngày trước,2 năm
ke-toan,Kế Toán Ngân Hàng,https://www.topcv.vnhttps://www.topcv.vn/viec-lam/ke-toan-ngan-hang/1847024.html?ta_source=JobSearchList_LinkDetail&u_sr_id=lbFCZjUFIUqzEZ1GYCJDw1uGtZK8BHAR5WJEnhJj_1756812383,CÔNG TY TNHH DƯỢC PHẨM U.N.I VIỆT NAM,Từ 12 triệu,Hà Nội,1 tuần trước,1 năm
ke-toan,Kế Toán Bán Hàng,https://www.topcv.vnhttps://www.topcv.vn/viec-lam/ke-toan-ban-hang/1845175.html?ta_source=JobSearchList_LinkDetail&u_sr_id=lbFCZjUFIUqzEZ1GYCJDw1uGtZK8BHAR5WJEnhJj_1756812383,CÔNG TY TNHH HẦM RƯỢU VIỆT NAM,10 - 12 triệu,"Hồ Chí Minh, Kiên Giang",1 tuần trước,1 năm
ke-toan,Kế Toán Nội Bộ,https://www.topcv.vnhttps://www.topcv.vn/viec-lam/ke-toan-noi-bo/1853087.html?ta_source=JobSearchList_LinkDetail&u_sr_id=lbFCZjUFIUqzEZ1GYCJDw1uGtZK8BHAR5WJEnhJj_1756812383,CÔNG TY TNHH TRUYỀN THÔNG SỰ KIỆN NHÂN MÃ,8 - 12 triệu,Hà Nội,6 ngày trước,1 năm
ke-toan,"Kế Toán Nội Bộ Không Yêu Cầu Kinh Nghiệm - Tại Bình Tân, Hồ Chí Minh - Thu Nhập Upto 10 Triệu - Đi L...",https://www.topcv.vnhttps://www.topcv.vn/viec-lam/ke-toan-noi-bo-khong-yeu-cau-kinh-nghiem-tai-binh-tan-ho-chi-minh-thu-nhap-upto-10-trieu-di-lam-ngay/1849862.html?ta_source=JobSearchList_LinkDetail&u_sr_id=lbFCZjUFIUqzEZ1GYCJDw1uGtZK8BHAR5WJEnhJj_1756812383,Công Ty TNHH Sunrise Colours Việt Nam,7 - 10 triệu,Hồ Chí Minh,1 tuần trước,Không yêu cầu
ke-toan,Kế Toán Viên,https://www.topcv.vnhttps://www.topcv.vn/viec-lam/ke-toan-vien/1855222.html?ta_source=JobSearchList_LinkDetail&u_sr_id=lbFCZjUFIUqzEZ1GYCJDw1uGtZK8BHAR5WJEnhJj_1756812383,ICONDENIM,10 - 13 triệu,Hồ Chí Minh,6 ngày trước,1 năm
ke-toan,"Kế Toán Tổng Hợp - Lương Thoả Thuận, Đi Làm Ngay",https://www.topcv.vnhttps://www.topcv.vn/viec-lam/ke-toan-tong-hop-luong-thoa-thuan-di-lam-ngay/1857275.html?ta_source=JobSearchList_LinkDetail&u_sr_id=lbFCZjUFIUqzEZ1GYCJDw1uGtZK8BHAR5WJEnhJj_1756812383,CÔNG TY CỔ PHẦN SÁCH VÀ THIẾT BỊ TRƯỜNG HỌC THÀNH PHỐ HỒ CHÍ MINH,Thoả thuận,Hồ Chí Minh,3 ngày trước,1 năm
ke-toan,Kế Toán Kho (1 Năm Kinh Nghiệm) Lương Từ 10-11 Triệu Tại Hồ Chí Minh - Đi Làm Ngay,https://www.topcv.vnhttps://www.topcv.vn/viec-lam/ke-toan-kho-1-nam-kinh-nghiem-luong-tu-10-11-trieu-tai-ho-chi-minh-di-lam-ngay/1838335.html?ta_source=JobSearchList_LinkDetail&u_sr_id=lbFCZjUFIUqzEZ1GYCJDw1uGtZK8BHAR5WJEnhJj_1756812383,CÔNG TY CỔ PHẦN DƯỢC PHẨM SO HA CO MIỀN NAM,10 - 11 triệu,Hồ Chí Minh,1 tuần trước,1 năm
ke-toan,Nhân Viên Kế Toán Nội Bộ,https://www.topcv.vnhttps://www.topcv.vn/viec-lam/nhan-vien-ke-toan-noi-bo/1850675.html?ta_source=JobSearchList_LinkDetail&u_sr_id=lbFCZjUFIUqzEZ1GYCJDw1uGtZK8BHAR5WJEnhJj_1756812383,CÔNG TY TNHH THƯƠNG MẠI PHÚ TIẾN,10 - 12 triệu,Hà Nội,6 ngày trước,1 năm
ke-toan,"Kế Toán Thuế (Công Ty Sản Xuất) - 3 Năm Kinh Nghiệm- Lương Trên 15 Triệu, Tại Hà Nội",https://www.topcv.vnhttps://www.topcv.vn/viec-lam/ke-toan-thue-cong-ty-san-xuat-3-nam-kinh-nghiem-luong-tren-15-trieu-tai-ha-noi/1835368.html?ta_source=JobSearchList_LinkDetail&u_sr_id=lbFCZjUFIUqzEZ1GYCJDw1uGtZK8BHAR5WJEnhJj_1756812383,CÔNG TY CỔ PHẦN HOBI VIỆT NAM,Từ 15 triệu,Hà Nội,1 tuần trước,3 năm
ke-toan,Trợ Lý Kế Toán Nội Bộ (Tiếng Trung) - Quận 7 (Thu Nhập Từ 13 Triệu Trở Lên),https://www.topcv.vnhttps://www.topcv.vn/viec-lam/tro-ly-ke-toan-noi-bo-tieng-trung-quan-7-thu-nhap-tu-13-trieu-tro-len/1835287.html?ta_source=JobSearchList_LinkDetail&u_sr_id=lbFCZjUFIUqzEZ1GYCJDw1uGtZK8BHAR5WJEnhJj_1756812383,CÔNG TY TNHH FOCUS SUCCESS,Từ 13 triệu,Hồ Chí Minh,2 tuần trước,1 năm
ke-toan,Nhân Viên Kế Toán Thuế _ Hà Nội _ Thu Nhập 12 - 15 Triệu,https://www.topcv.vnhttps://www.topcv.vn/viec-lam/nhan-vien-ke-toan-thue-ha-noi-thu-nhap-12-15-trieu/1847020.html?ta_source=JobSearchList_LinkDetail&u_sr_id=lbFCZjUFIUqzEZ1GYCJDw1uGtZK8BHAR5WJEnhJj_1756812383,CÔNG TY CỔ PHẦN XÂY DỰNG VÀ NỘI THẤT BẮC YÊN THÁI,12 - 15 triệu,Hà Nội,1 tuần trước,3 năm
ke-toan,Kế Toán Tổng Hợp - Tại Dương Nội Hà Đông Yêu Cầu Kinh Nghiệm 2 Năm Lương Từ 10 -13 Triệu,https://www.topcv.vnhttps://www.topcv.vn/viec-lam/ke-toan-tong-hop-tai-duong-noi-ha-dong-yeu-cau-kinh-nghiem-2-nam-luong-tu-10-13-trieu/1847296.html?ta_source=JobSearchList_LinkDetail&u_sr_id=lbFCZjUFIUqzEZ1GYCJDw1uGtZK8BHAR5WJEnhJj_1756812383,CÔNG TY CỔ PHẦN DỊCH VỤ VÀ TƯ VẤN PHÒNG CHÁY CHỮA CHÁY HÀ THÀNH,10 - 13 triệu,Hà Nội,1 tuần trước,2 năm
ke-toan,Kế Toán Thuế Tổng Hợp _ Hà Nội _ Thu Nhập 13 - 15 Triệu,https://www.topcv.vnhttps://www.topcv.vn/viec-lam/ke-toan-thue-tong-hop-ha-noi-thu-nhap-13-15-trieu/1851314.html?ta_source=JobSearchList_LinkDetail&u_sr_id=lbFCZjUFIUqzEZ1GYCJDw1uGtZK8BHAR5WJEnhJj_1756812383,CÔNG TY TNHH DỊCH VỤ VÀ TƯ VẤN THUẾ PPI VIỆT NAM,13 - 15 triệu,Hà Nội,1 tuần trước,3 năm
ke-toan,Kế Toán Tổng Hợp (Mạnh Về Thuế) - Yêu Cầu Từ 24 - 33 Tuổi - Thu Nhập 12 - 20 Triệu - Từ 2 Năm Kinh N...,https://www.topcv.vnhttps://www.topcv.vn/viec-lam/ke-toan-tong-hop-manh-ve-thue-yeu-cau-tu-24-33-tuoi-thu-nhap-12-20-trieu-tu-2-nam-kinh-nghiem-ha-dong-ha-noi/1845975.html?ta_source=JobSearchList_LinkDetail&u_sr_id=lbFCZjUFIUqzEZ1GYCJDw1uGtZK8BHAR5WJEnhJj_1756812383,HỘ KINH DOANH JOELLA,12 - 20 triệu,Hà Nội,1 tuần trước,2 năm
ke-toan,Kế Toán Thuế - 1 Năm Kinh Nghiệm - Thu Nhập 15 Triệu Quyền Lợi Hấp Dẫn+++,https://www.topcv.vnhttps://www.topcv.vn/viec-lam/ke-toan-thue-1-nam-kinh-nghiem-thu-nhap-15-trieu-quyen-loi-hap-dan/1309474.html?ta_source=JobSearchList_LinkDetail&u_sr_id=lbFCZjUFIUqzEZ1GYCJDw1uGtZK8BHAR5WJEnhJj_1756812383,Công ty TNHH Dịch vụ kế toán và tư vấn thuế Tín Phát,8 - 15 triệu,Hà Nội,1 tuần trước,1 năm
ke-toan,"Kế Toán Thuế - Lương 12 - 18 Triệu - Tại Hoàng Mai, HN - Đi Làm Ngay",https://www.topcv.vnhttps://www.topcv.vn/viec-lam/ke-toan-thue-luong-12-18-trieu-tai-hoang-mai-hn-di-lam-ngay/1850433.html?ta_source=JobSearchList_LinkDetail&u_sr_id=lbFCZjUFIUqzEZ1GYCJDw1uGtZK8BHAR5WJEnhJj_1756812383,CÔNG TY TNHH ĐẦU TƯ VÀ PHÁT TRIỂN DỊCH VỤ TRƯỜNG PHÁT,Tới 18 triệu,Hà Nội,1 tuần trước,2 năm
ke-toan,Kế Toán Tổng Hợp - Đi Làm Ngay Lương Upto 15 Triệu/ Tháng,https://www.topcv.vnhttps://www.topcv.vn/viec-lam/ke-toan-tong-hop-di-lam-ngay-luong-upto-15-trieu-thang/1834142.html?ta_source=JobSearchList_LinkDetail&u_sr_id=lbFCZjUFIUqzEZ1GYCJDw1uGtZK8BHAR5WJEnhJj_1756812383,CÔNG TY TNHH TTT VIỆT NAM,12 - 15 triệu,Hà Nội,1 tuần trước,2 năm
ke-toan,Nhân Viên Kế Toán Nội Bộ (Thu Nhập Hấp Dẫn),https://www.topcv.vnhttps://www.topcv.vn/viec-lam/nhan-vien-ke-toan-noi-bo-thu-nhap-hap-dan/1854441.html?ta_source=JobSearchList_LinkDetail&u_sr_id=lbFCZjUFIUqzEZ1GYCJDw1uGtZK8BHAR5WJEnhJj_1756812383,CÔNG TY TNHH PHONG ĐÌNH VŨ,Tới 10 triệu,Hà Nội,6 ngày trước,1 năm
ke-toan,"Nhân Viên Kế Toán (Mức Lương 10 - 15 Triệu, Yêu Cầu Kinh Nghiệm)",https://www.topcv.vnhttps://www.topcv.vn/viec-lam/nhan-vien-ke-toan-muc-luong-10-15-trieu-yeu-cau-kinh-nghiem/1634367.html?ta_source=JobSearchList_LinkDetail&u_sr_id=lbFCZjUFIUqzEZ1GYCJDw1uGtZK8BHAR5WJEnhJj_1756812383,CÔNG TY TNHH DU LỊCH ĐẲNG CẤP Á CHÂU,10 - 15 triệu,Hà Nội,1 tuần trước,2 năm
ke-toan,Nhân Viên Kế Toán Biết Báo Cáo Thuế (Nam) Thu Nhập 12 -15 Triệu (Long Biên - Hà Nội),https://www.topcv.vnhttps://www.topcv.vn/viec-lam/nhan-vien-ke-toan-biet-bao-cao-thue-nam-thu-nhap-12-15-trieu-long-bien-ha-noi/1835049.html?ta_source=JobSearchList_LinkDetail&u_sr_id=lbFCZjUFIUqzEZ1GYCJDw1uGtZK8BHAR5WJEnhJj_1756812383,Công ty TNHH Vina Foam Việt Nam,12 - 15 triệu,Hà Nội,2 tuần trước,1 năm
ke-toan,"Nhân Viên Kế Toán Tổng Hợp, Lương 13 - 18 Triệu",https://www.topcv.vnhttps://www.topcv.vn/viec-lam/nhan-vien-ke-toan-tong-hop-luong-13-18-trieu/1843763.html?ta_source=JobSearchList_LinkDetail&u_sr_id=lbFCZjUFIUqzEZ1GYCJDw1uGtZK8BHAR5WJEnhJj_1756812383,CÔNG TY CỔ PHẦN DỊCH VỤ VÀ BẢO VỆ CHUYÊN NGHIỆP TOÀN TÂM,13 - 18 triệu,Hồ Chí Minh,2 tuần trước,3 năm
ke-toan,Kế Toán Thuế Thu Nhập 10- 25 Triệu Tại Hà Nội,https://www.topcv.vnhttps://www.topcv.vn/viec-lam/ke-toan-thue-thu-nhap-10-25-trieu-tai-ha-noi/1854614.html?ta_source=JobSearchList_LinkDetail&u_sr_id=lbFCZjUFIUqzEZ1GYCJDw1uGtZK8BHAR5WJEnhJj_1756812383,CÔNG TY LUẬT TNHH ĐẦU TƯ QUỐC TẾ AN PHÁT,Thoả thuận,Hà Nội,5 ngày trước,2 năm
ke-toan,Kế Toán Tổng Hợp (Làm Việc Tại Bắc Ninh),https://www.topcv.vnhttps://www.topcv.vn/viec-lam/ke-toan-tong-hop-lam-viec-tai-bac-ninh/1844616.html?ta_source=JobSearchList_LinkDetail&u_sr_id=lbFCZjUFIUqzEZ1GYCJDw1uGtZK8BHAR5WJEnhJj_1756812383,Công Ty Cổ Phần Hanacans,"800 - 1,200 USD",Bắc Ninh & 2 nơi khác,1 tuần trước,2 năm
